,title,cluster
5522,"Russia’s losses around Vuhledar renew questions about its ability to sustain a fresh offensive.. The fighting has also come at a cost for Ukraine, which is expending vast amounts of ammunition to repel Russia’s growing numbers of ground troops,",86
5547,"Russia’s Wagner Fighters Claim Advance Near Bakhmut. The Wagner paramilitary group said its fighters had seized a village outside Bakhmut, as Moscow’s forces continue a brutal campaign that has nearly encircled the strategic eastern city.",86
5590,"Russia Pays a Bloody Price for Small Gains on Eastern Front. Russia is relying on masses of troops to overrun Ukrainian positions, producing heavy casualties and incremental gains.",86
5618,U.S. Presses Partners to Weed Out Illicit Trade With Russia. American officials worry that commercial activities in Turkey and the United Arab Emirates could be fueling Russia’s war machine and have threatened to punish those involved.,86
5620,"When It Comes to Building Its Own Defense, Europe Has Blinked. Despite expectations that Russia’s invasion of Ukraine would force Europe to bolster its military strength, it has instead reinforced dependency on U.S. leadership, intelligence and might.",86
5653,"Ukraine Fears New Offensive Is Underway as Russia Masses Troops. Russia is massing hundreds of thousands of troops and stepping up its bombardment, perhaps signaling the biggest assault since the start of the war. “I think it has started,” Ukraine’s leader says.",86
5661,"Seeing a Prize, Russia Inundates a Ukraine City With Troops. The battle in the eastern Ukraine city of Bakhmut is growing in importance, as both sides pour forces into the battle.",86
5673,"A Risky Trade in Ukraine Grows Riskier Amid the War. Russia’s invasion has disrupted the social services that help reduce harm to the women and men who sell sex, threatening public health.",86
5690,Russia and Ukraine Battle for Control of Villages Near the Key City of Bakhmut. The area is a flash point in an offensive that Moscow views as crucial for its goal of seizing the Donbas region of eastern Ukraine.,86
5693,"A Small Boat, a Vast Sea and a Desperate Escape From Russia. In September, two men set out from Russia, hoping a boat could carry them to asylum on U.S. soil. Their quest for freedom did not go as planned.",86
5705,"Russia says it will switch four occupied Ukrainian regions to Moscow time.. Russia, which has many time zones, is seeking to integrate the regions after illegally annexing them in September.",86
5732,The U.S. Has Made a Coldly Logical Decision in Ukraine. So Has Russia.. America’s increasing commitment and Russia’s mobilization show how short wars become long ones.,86
5799,U.S. Warms to Helping Ukraine Target Crimea. The Biden administration is considering the argument that Kyiv needs the power to strike at the Ukrainian peninsula annexed by Russia in 2014.,86
5820,"Renewed Armenia-Azerbaijan Conflict Underlines Russia’s Waning Influence. Russia helped end a 2020 war and its troops policed the cease-fire. But with a new crisis in the Caucasus heating up, Moscow, distracted and weakened by Ukraine, has not intervened.",86
5848,"Russia’s Claim to Seize a Ukrainian Town Exposes Rifts Among Forces. After Russia’s Defense Ministry said its troops had taken Soledar, a leader of the Wagner mercenary group accused the military of stealing credit. Ukraine said its forces were still fighting there.",86
5892,"Ukraine rejects Russia’s claim of a deadly strike on troops in the east.. Russia’s Defense Ministry said it had carried out a strike that “killed 600 people,” but no evidence has emerged to support the claim.",86
5897,"Now Fighting for Ukraine: Volunteers Seeking Revenge Against Russia. Chechens, Crimean Tatars and people from the former Soviet republics, all with deep historical grievances against Moscow, are eagerly taking up arms for Kyiv.",86
5903,"Attacks Continue in Ukraine Despite Russia’s Supposed Cease-Fire. Ukraine never accepted Russia’s unilateral Christmas truce, dismissing it as a hollow ploy, and Russian shelling was as intense as ever in a hotly contested city.",86
5915,"More than 60 percent of Bakhmut has been destroyed, a Ukrainian official says.. Russia has continued to press an offensive aimed at capturing the eastern city, after suffering a string of setbacks elsewhere in Ukraine in recent months.",86
5920,Moscow Blames Its Own Troops. Russia said its soldiers’ use of cellphones led to a strike that left 89 dead.,86
5926,"Russia says soldiers’ cellphone use led to the deadly Makiivka strike.. The Defense Ministry said the use of phones helped Ukraine home in on the troops’ location, while influential military bloggers said that explanation ignored commanders’ mistakes.",86
5983,"Hard-Line Positions by Russia and Ukraine Dim Hope for Peace Talks. Both Moscow and Kyiv say they are ready to talk, but their terms for sitting down at a negotiating table suggest otherwise.",86
5988,"Ukraine and Russia Battle for a Gateway City in the East. Recapturing Kreminna, in eastern Ukraine, would be a step further in Ukraine’s campaign to retake major cities that Russia seized after it invaded.",86
6031,"Washington says North Korea is delivering arms to the Wagner Group for Russia’s use in Ukraine.. The paramilitary group has played a central role in Russia’s efforts to storm the city of Bakhmut in Donetsk Province, which borders Luhansk.",86
6148,"Russia Is Using Old Ukrainian Missiles Against Ukraine, General Says. The missiles, returned to Russia in the 1990s under an agreement aimed at assuring Ukraine’s sovereignty and territorial integrity, have shown up in rubble.",86
6215,"Life in Ukraine as Russia Weaponizes Winter. Moscow’s missiles have been taking out the power grid, leaving millions without power or heat.",86
6270,Ukraine Has Taken Half of Territory Back Since Russia Invaded,86
6271,The UN Charter allows Russia to invade Ukraine,86
6272,Russia's invasion of Ukraine is authorized by Articles 106 and 107 of the UN Charter.,86
6273,The UN Charter authorizes Russia to invade Ukraine,86
6274,Russia lost more men in Ukraine than U.S. in recent wars,86
6298,North Korea decided to send troops to Ukraine to support Russia,86
6300,CNN reported that Russia's invasion of Ukraine is causing cases of myocarditis.,86
6308,CNN reported that Russia's invasion of Ukraine is causing myocarditis,86
6349,Photographs show the condition of Ukraine amid recent invasion by Russia.,86
6383,Pornhub was blocked for users in Russia following the invasion of Ukraine.,86
6393,Time Magazine cover of Russia's invasion of Ukraine.,86
6401,Real footage of slain soldiers on both sides - Russia and Ukraine,86
6406,Russia has begun the process of invading Ukraine,86
6426,Videos show Ukraine being invaded by Russia.,86
6430,"Pictures of Hezbollah forces training in the snow, before heading to Moscow to support Russia in its invasion of Ukraine.",86
6436,"According to American officials, Russia may invade Ukraine within the next 24 to 48 hours.",86
6494,Explosion in Ukraine led by Russia,86
6529,Russia did not evacuate 800K residents from Crimea,86
6550,Russia Sent XVI Century Imperial Cannon to Ukraine Front,86
6659,"The fierce battle between Russia and Ukraine, the picture that cannot be seen on TV",86
6660,"Russia's strong warning to India as well, the President of Russia threatened that India should be ready to face the consequences if it comes in the way",86
6662,The claim that some recently shared images are from Russia-Ukraine conflicts,86
6664,"Anastasia Lena, the former beauty of Ukraine, entered the battlefield to fight the enemy, see #ukraine #Russia",86
6673,"The film declares: The situation in Russia and Ukraine has changed dramatically, and Russia and Ukraine have started fighting.",86
6809,A Misleading Claim About Russia’s Defense Spending,86
6914,"After Latvia Blocks a TV Channel, Gloating and Falsehoods From Russia",86
6947,All refugees from Ukraine voluntarily leave for Russia,86
6952,Allegations that Russia is threatening Ukraine are absurd,86
6966,American politician Mitt Romney called for the destruction of Russia,86
6968,Americans 'drastically changed position' on Russia-Ukraine talks - The Washington Post,86
7008,Anglo-Saxons are responsible for blowing up Russia's Nord Stream pipelines,86
7032,Are the U.S. and NASA the Biggest Losers if ‘Cosmic Relations' with Russia Unravel?,86
7054,"As Russia Walks Away from MH17 Crash Talks, More Recycled Spin",86
7135,Bellingcat Allegations of Russia's Role in MH17 Crash Based on Fakes - MoD,86
7212,Britain Has Good Reason to Consider Russia a Threat,86
7249,"By arming Ukraine, the US and the UK want to push Russia against Europe",86
7450,Classic Disinfo: Russia Spins Multiple Navalny Poisoning Narratives,86
7502,Crimea belongs to Russia,86
7504,Crimea is formally part of Russia,86
7508,Crimea rejoined Russia after a democratic referendum,86
7511,Crimea returned to Russia after a referendum,86
7512,Crimea returned to Russia after more than 95% voted in favour,86
7514,Crimea reunited with Russia after a referendum on the peninsula,86
7516,Crimea voted overwhelmingly to join Russia following Maidan,86
7517,Crimea was not illegally annexed by Russia,86
7541,"Danilov ""recognized"" that Kyiv began active preparations for confrontation with Russia back in...",86
7574,"Desperate for a vaccine, Europe turns to Russia",86
7577,"Despite Denials, Links Between Cambridge Analytica and Russia Emerge",86
7597,Did Russia Send Wagner Mercenaries to ‘Stage Terror Attacks’ in Belarus?,86
7759,Europe doesn’t support peace negotiations in Ukraine because of US pressure,86
7763,Europe is waging open warfare against Russia,86
7822,Facts Contradict Russia’s Claim of Compliance with the Open Skies Treaty,86
7855,Fifty countries are trying to wipe Russia off the earth,86
7895,Former IMF chief accuses Ukraine of betraying Russia,86
7902,"Forward, to the Past: How Can Russia Recapture the Economic Growth of the 2000s?",86
7954,German TV channel ZDF showed a map of Ukraine without territories annexed by Russia,86
7995,Hacks of German Politicians Get Russia's Standard Denial,86
8001,Has the U.S. Ever Helped Russia? Yes!,86
8040,"How Russia Distorted, Censored MH17 Trial Coverage",86
8041,How Russia Uses Retired US Colonel’s Ukraine Misinformation for Domestic Propaganda,86
8075,"If Russia provided military support to the DPR and LPR, it would withdraw from peace negotiations",86
8154,"In Russia, the Moscow stele was painted blue and yellow",86
8165,"In The Hague, there is no case against Russia related to Ukraine",86
8187,"In Ukraine, they want to deprive everyone who left for Russia or lives on...",86
8291,Is Russia Investigating Navalny Under Extremism Law?,86
8298,Is the Labor Force in Russia Smaller Than in Other Countries?,86
8314,It Was Not a Visit to Russia that Kept Sri Lankan Politico Out of US,86
8317,It is a lie that Russia is blocking wheat exports,86
8359,Joining Russia saved Crimeans from bloodshed,86
8464,Kyiv modernises WWII mines to use against Russia,86
8542,Lithuania is guilty of the bad relations with Russia,86
8572,MH17 allegations against Russia based on rumors,86
8601,Maidan was organised by Georgian fighters and resulted in attacks by Ukraine on Russia,86
8602,Mainstream Polish parties compete in their aggressive position on Russia and Belarus,86
8606,Majority of Voters in Zaporizhia Oblast voted in “referendums” on joining Russia,86
8642,"Medvedchuk case is political, foreigners ordered Ukraine to cut links with Russia and Belarus",86
8643,"Medvedev: Calls Russia's GDP Growth ‘Good,’ Yet it Remains in ""Stagnation""",86
8677,Misleading: Russia Slows Ukraine Offensive to Save Civilians,86
8678,"Missile that shot down flight MH17 belonged to Ukraine, not to Russia",86
8732,Moscow’s Misleading Claim That US is Pushing Ukraine to Invade Russia,86
8743,Most refugees from Ukraine left for Russia - UNHCR,86
8837,Nadiya Savchenko illegally crossed into Russia disguised as a refugee,86
8847,"Narrative claiming “downing of the MH17 was Russia's fault"" begins to fall apart",86
8854,Nearly 90% of Odessa residents said they “like Russia” – poll,86
8879,Nine Lies from Russia About 9/11,86
8953,"Oh, How They Lied. The Many Times Russia Denied Ukraine Invasion Plans",86
9023,"Peacekeepers are not needed on the border between the DNR/LNR and Russia, it is a zone of peace and tranquillity",86
9221,"Pushing a Prisoner Swap with U.S., Russia Whitewashes an Arms Dealer, a Drug Trafficker and a Hacker",86
9336,Radio Liberty Isn't Undermining Russia's Presidential Election,86
9344,Really? Russia Inflates a Minor Mistake Into a Bogus Navalny Conspiracy,86
9360,Republicans in Congress supported the transfer of part of Ukraine to Russia,86
9371,Residents of Russia were among the victims of the May 2 fire in Odessa,86
9393,"Russia ""destroyed two HIMARS"" in the Donetsk region",86
9394,"Russia ""precise strikes"" destroyed a ""strategic facility"" in the Ternopil region",86
9402,Russia Can’t Stop Lying About U.S. Bioweapon Labs in Ukraine,86
9409,"Russia Complains MH-17 Investigation Keeps Secrets from Moscow. True, with Russia as the Main Suspect",86
9410,"Russia Concerned About ‘Freedom of Media’, But Only Its Own",86
9412,Russia Cries Censorship After YouTube Takes Down Official Disinfo on Ukraine,86
9415,Russia Deflects Blame for France’s Yellow Vests,86
9417,Russia Demonstrates Missile Claiming No Violation of INF – Only to Prove Opposite,86
9418,Russia Denies Using Iranian Drones. Ukraine Has Downed 200+,86
9424,"Russia Expels a BBC Reporter, Then Feigns Tit-For-Tat",86
9430,Russia Falsifies France Pension Reform Protests as Anti-Ukraine,86
9431,Russia Falsifies Its Slave- and Serf-Holding Past,86
9438,Russia May Occupy Ukraine's Historical Regions - Croatian Media,86
9440,Russia Never Annexed Crimea? UN Disagrees,86
9441,Russia Only Sends Troops Where Invited? Not a Chance.,86
9442,Russia Points at Ukraine With Dubious Terror Plot Involving … Russians!,86
9447,Russia Rains on D-Day Parade,86
9450,Russia Responded to WADA Data Manipulation Inquiry with ‘Lies and Propaganda’,86
9452,Russia Resurrects Debunked Organ Harvesting Allegations,86
9455,Russia Says it Can’t Interfere in Ukraine – While it Meddles in Ukraine,86
9457,Russia Spins Pseudo-History on Anniversary of Crimea Seizure,86
9459,Russia Today Chief Says Case Against Scottish Politician is Politically Motivated,86
9462,Russia Today’s Take on the US Immigration Debate Ignores Complexity,86
9463,Russia Tries to Pin Syrian Refugees’ Fate on US,86
9465,Russia Twists Kirby’s Comment on Xi’s Ukraine Ceasefire,86
9467,"Russia Unrealistically Forecasts Producing 1,500 Tanks a Year",86
9468,Russia Violated the 1994 Budapest Memorandum,86
9470,Russia Was Behind Giuliani’s Invitation to Armenia,86
9472,Russia adheres to international law,86
9475,Russia and Syria: U.S.-backed Syrian Forces Blocking Refugee Return,86
9480,"Russia cannot be an aggressor, since it is in the...",86
9485,Russia did not commit to protect Ukraine's territorial integrity,86
9486,Russia did not grab a piece of land from Ukraine,86
9487,Russia did not initiate confrontation with Ukraine and is not...,86
9488,Russia did not initiate confrontation with Ukraine and is not...,86
9489,Russia did not interfere with the elections in the US...,86
9490,Russia did not invade Ukraine,86
9495,Russia did not violate the Budapest memorandum,86
9498,Russia does not interfere in other countries sovereign affairs,86
9507,Russia does not want to destroy Ukraine,86
9508,Russia does not “filter” the territories of Ukraine it has seized,86
9515,Russia gave Crimea to Ukraine in the 80-90s,86
9517,Russia has completely blocked the largest cities of Ukraine,86
9518,Russia has never attacked anyone,86
9520,Russia has never been a threat to Ukraine,86
9525,Russia has never waged wars of aggression,86
9536,"Russia hits arms factory in Kyiv, block of flats damaged by anti-missile defence",86
9538,Russia inflicts “bloodless strikes” on Ukraine’s railway infrastructure,86
9543,Russia is always working on accurate implementation of UN resolutions,86
9549,Russia is fighting the Nazi International,86
9569,"Russia is not a threat, it is depicted as such...",86
9577,Russia is not fighting in Ukraine,86
9578,"Russia is not involved in the MH17 crash, this can be seen at the hearings in Schiphol",86
9588,Russia is not worried about political turmoil in Armenia,86
9598,Russia lost PACE voting rights due to political discrimination,86
9600,Russia never had troops in Ukraine,86
9602,"Russia not bound by Minsk deals, only Ukraine and DNR/LNR are warring sides",86
9603,Russia not guilty of MH17 case because plane was hit over Ukraine,86
9606,"Russia poses zero threat to other countries, including Ukraine",86
9609,Russia protects the territorial integrity of Ukraine from Polish expansionism,86
9621,Russia was expelled from G8 for no real reason,86
9628,"Russia ‘refrained from attacking Kyiv?’ No, It Was Repelled",86
9642,Russia's success will lead to the division of the territory of Ukraine - CNN,86
9855,Russia’s Carnival Mirror of U.S. Presidential Elections,86
9857,"Russia’s Disinfo Backfires, Causes Contradictory Messaging on Troop Deployment in Central African Republic",86
9858,"Russia’s Elections ‘Competitive, Honest?’ Not a Chance",86
9859,"Russia’s FM Calls Outcry Over Navalny Arrest ‘Unlawful,’ Sidestepping His Poisoning",86
9867,Russia’s Lavrov Mangles U.S.-Panama History to Justify Invading Ukraine,86
9871,Russia’s Medvedev Gaslights Japanese Leader Kishida Over Nukes in Ukraine,86
9873,Russia’s Myanmar Embassy Unleashes a Torrent of Ukraine Falsehoods,86
9876,Russia’s New Year Horror: Presumed Consent for Organ Donation,86
9877,Russia’s Plan for 2020 U.S. Presidential Election – Inflaming Racial Discord?,86
9879,Russia’s Proxies Make Wild Claim About Theft of Observers' Vehicles,86
9880,Russia’s Reply to Massive US Cyber Hack – Deny and Deflect,86
9881,Russia’s Scapegoat for Nationwide Protests? The US Embassy (Again),86
9886,Russia’s Two Minds on Vote by Mail,86
9891,Russia’s invasion of Ukraine conducted in full conformity with UN Charter,86
9949,Sevastopol has always been legally part of Russia,86
9965,"Skadovsk, after being occupied by Russia, “gained access to water” for sowing",86
10030,Students in Ukraine forced to reject their Russia-based relatives,86
10035,Suspect Claim by Russia on Rockets That Killed Fleeing Civilians,86
10041,Sweden supports Russia on Crimea,86
10086,The 2022 referendums to join Russia confirmed the wish of the population to live in peace,86
10099,The Bundestag “recognized that Russia will not give up Crimea”,86
10167,The Fiction of Russia’s Super Drone-Killing Rifle,86
10175,The Germans supported Russia's withdrawal from consultations about MH17,86
10201,The Linguistics of Disinfo: How Russia Portrays Kamala Harris,86
10217,The Mortality Rate for Road Accidents Drops in Russia and Europe,86
10227,The New Fantastical Twist on Russia's Bogus Bioweapons Allegations,86
10242,The Polish politicians care about Ukraine only if it continues harming Russia,86
10267,The Salaries of Men and Women: Where is the Gap Even Greater than in Russia?,86
10273,The Strike: Did Russia Knowingly Target Turkish Troops?,86
10286,The UN General Assembly “legitimized the robbery of Russia”,86
10349,The US plans to send infected migratory birds to infect Russia,86
10355,The US tried to organize a colour revolution in Belarus against Russia,86
10596,The invasion is Ukraine’s fault,86
10628,"The referendums in Ukraine is the beginning, Russia has to get Kyiv back",86
10699,"There are only 5% of nationalists in Ukraine, the rest are “praying” and “waiting for the arrival” of Russia",86
10792,"To Boost its Ally, Russia Trumpets Bogus Syria Vote",86
10835,Two Caesar howitzers were sold to the enemy and are now studied in Russia,86
10849,U.S. Congressmen Call for Part of Ukraine to be Transferred to Russia - The Washington Post,86
10868,UN Charter Gives Russia the Right to “Eradicate Nazism”,86
10893,US Congressman Paul Massaro called for the destruction of Russia,86
10920,US biolabs in Ukraine are aimed at reducing Russia's gene pool,86
10922,US chose Ukraine to create the antipode of Russia,86
10926,US controls Europe and Ukraine; Ukraine should live in peace with Russia,86
10935,US hasn’t ratified the Biological Weapons Convention and uses labs around Russia,86
10976,"US, UK and Canada tried to use Ukraine as a battery ram against Russia",86
10980,US-funded laboratories in Ukraine aimed to send infected migratory birds to Russia,86
10982,"USA is trying to make Ukraine a ""springboard of aggression"" against Russia",86
10996,Ukraine Did Not Threaten Russia With a 'Missile Strike',86
10998,Ukraine Doesn’t Need Russia’s Permission to Navigate Kerch Strait,86
11016,Ukraine attacks Russia with biological weapons,86
11096,Ukraine has destroyed the liberal project in Russia,86
11129,"Ukraine is a separatist part of historical Russia, thus Moscow...",86
11141,"Ukraine is an artificial construct and its ""disintegration"" will continue if it remains hostile to Russia",86
11158,Ukraine is going to launch a missile strike on Russia,86
11171,"Ukraine is not welcome in neither Europe, nor Russia",86
11186,Ukraine is preparing to “surrender” Zaporozhye to Russia,86
11228,Ukraine must return “Yanukovych’s billions” to Russia with interest,86
11242,Ukraine plans to “advance” Russia in 2023,86
11353,Ukraine's hostility to Russia is an American project to weaken Europe,86
11618,"Under Glare of U.N., Russia Casts Doubt on Forces Outside Ukraine",86
11746,Wage Inequality: How do Men's and Women's Incomes Differ in Russia?,86
11866,Where does Russia Rank Among G20 Countries in Terms of Mortality?,86
11867,"Wherever Russia goes, wars stop",86
11868,Which G20 Countries’ Public Debt is More Expensive than that of Russia?,86
11876,"Who Is ‘Stuck’ in Syria – Russia, the U.S., or Both?",86
11877,Who Really Led U.S.-Russia Relations to a Dead End?,86
11885,Why Russia Trash Talks ‘U.S.-Gifted HIMARS’ Weapons in Ukraine,86
11892,Will Russia Really Gain Control Over Ukraine's Economy?,86
11907,"Without Russia, Ukraine is turning into a desert",86
11930,Zakharova: Russia Blamed for Skripal Poisoning to Distract from Brexit,86
12055,“embassies are fleeing from Kyiv in anticipation of the “offensive of Russia”,86
