,title,cluster
9742,"Russian Police Say the Election Day Was 'Calmest,' After Clamping Down on Country-wide Protests",87
10047,Syria Accuses Americans of Supporting IS After U.S. Helped Free Most of Country From the Group,87
10340,The US is the only country that occupied Ukraine,87
10385,The Ukrainian authorities are destroying their country's industry and brainwashing...,87
10637,The sowing campaign in Ukraine is “in danger of failure” – since “everything was taken out of the country...,87
10641,"The story of how our country was ""stolen""",87
10763,"This Week's Trend: Part of the country wanted to ""stay...",87
10787,Three-quarters of all IT specialists in Ukraine have left the country,87
11117,Ukraine imposes restrictions on movement within the country,87
11137,"Ukraine is a vassal country, a colony of the US",87
11169,"Ukraine is not a country, it is a territory",87
11205,Ukraine is undergoing a digital transformation to turn the country into a colony,87
