,title,cluster
1,Ukrainians beat two Berlin residents for speaking in russian,73
300,“We haven’t seen a single American megachurch offer anything to help Ukrainians.”,73
303,"“While Ukrainians bled and died, Congressman Budd excused their killer.”",73
323,Ukrainians altered this street sign to tell Russian troops to go “f---” themselves.,73
1038,"In their heroic fight against the Russian invasion, Ukrainians have been bolstered by data tools that are revolutionizing war.",73
1106,"In the Donetsk region, Ukrainians hit Wagner mercenaries trying to take Bakhmut. To the south, they struck fighters loyal to Chechen leader Ramzan Kadyrov.",73
1129,"Kyiv and Moscow accused each other of ""terrorism"" and vowed revenge after an explosion damaged Russian infrastructure and airstrikes killed 14 Ukrainians.",73
1186,"Ukrainians had been bracing for stepped up strikes this week, and officials say the death toll from the train station strike could increase.",73
1187,On board a train heading to the Polish border are Ukrainians who have been wrestling with the agonizing decision of whether to return home six months into the war.,73
1308,"Ukrainians will keep fighting, but only one person has the power to make the war go away.",73
1435,An American manufacturer is providing the aircraft and teaching the Ukrainians how to operate them.,73
1465,Facebook's decision to allow calls for violence from Ukrainians reveals a set of values.,73
1473,"Influencers are in ""hysterics"" over the app's departure, while Ukrainians being bombed by the Russian military mock them.",73
1590,"The peninsula, annexed illegally in 2014, is where Russia's invasion of Ukraine began, and where many Ukrainians insist the war must end — with Moscow's defeat. ",73
1707,"Just two weeks ago, Ukrainians were documenting going to concerts, eating out, grabbing drinks with their friends.  Now their phones ring out with warnings and deliver texts from loved ones checking if they are alive.",73
1735,Ukrainians aren't a particularly foul-mouthed people. They’re just incredibly angry.,73
1786,The global ballet community rallies to help young Ukrainians and families find new homes — and pursue their art.,73
1894,"57 Ukrainians died as a result of hostilities, 169 people were injured - Ministry of Health of Ukraine",73
2015,Zelensky: The world saw that Ukrainians are strong. Ukrainians are brave. Ukrainians are on their native land and will never give it up,73
2773,President Volodymyr Zelenskyy congratulated Ukrainians on the Constitution Day of Ukraine,73
2952,"Ukrainians fought in Nice, mistaking each other for Russians — Nice-Matin newspaper",73
3049,"The threat of new attacks on Ukraine continues. All Ukrainians are urged to take shelter with warm clothes, water, food supplies, phone chargers",73
3223,We are not going to engage in any negotiations. Nothing about Ukraine without Ukraine. This decision should be made by the Ukrainians - Biden,73
4034,"West assails Russian 'barbarism' as Ukrainians shelter from bombardment, article with video",73
4406,"Ukrainians in Britain Take Up the Cause Back Home. Whether vowing to kill Russians or offering medical supplies, Ukrainian citizens are too impatient to sit idly by.",73
4409,"Ukraine Agrees to Talks With Russia, but Fighting Still Rages. Putin, accusing the West of “aggressive statements,” puts nuclear forces on alert. Kyiv remains in Russian cross-hairs as Ukrainians push back.",73
4448,Why Ukrainians Believe They Can Win. Idealism has been a powerful weapon in the resistance against Russia.,73
4472,"‘My Cousins Are Killing One Another’: War in Ukraine Splits Mixed Families. Because of their countries’ complex and intertwined history, many Ukrainians and Russians have relatives who are standing on opposite sides of the conflict.",73
4487,"A Surge of Unifying Moral Outrage Over Russia’s War. Ukrainians take to social media, and taboos are tumbling as countries abandon neutrality and people abandon indifference to support their cause.",73
4511,"Looking for an Endgame in Ukraine. Three scenarios for a place where our support for the Ukrainians, our sense of our own interests and the realities of Russian power might converge.",73
4583,"On the Exodus West, Ukrainians Flee Hardship for an Uncertain Future. Many thousands of Ukrainians, fearful of the war, are leaving their homes on a slow journey west, enduring difficulties but also buoyed by the generosity of their countrymen.",73
4599,U.S. Grants Temporary Protected Status to Some Ukrainians. The designation gives Ukrainians who were in the United States without legal documentation as of March 1 permission to stay and work for 18 months.,73
4664,Putin Picked the Wrong Country to Mess With. Ukrainians are heroically united in repelling the Russian invasion.,73
4686,Ukrainians Find That Relatives in Russia Don’t Believe It’s a War. Many Ukrainians are encountering a confounding and frustrating backlash from family members in Russia who have bought into the official Kremlin messaging.,73
4707,On the Road With Ukraine’s Refugees. We report alongside Ukrainians making their escape from Russia’s increasingly brutal invasion.,73
4730,Fleeing Civilians Under Fire. Fears are growing for Ukrainians trapped in besieged cities.,73
4731,"Humanitarian Crisis Worsens for Ukrainians Trapped in Russia’s Onslaught. Two weeks after the invasion began, tens of thousands of Ukrainians are without food, water or power. The Russians are increasingly resorting to indiscriminate shelling to help their forces advance.",73
4767,"Moldovans Welcome Fleeing Ukrainians, but Some Pack Their Own Bags, Too. Moldova has taken in more Ukrainians, per capita, than any other country. But the closer Russian troops get to Moldova, the more locals consider their own escape plans.",73
4772,Ukrainians Trying to Flee to U.K. Face a Confounding Path. The government has offered a way for U.K. residents to bring over Ukrainian relatives fleeing the war. But families and rights groups say it’s a bureaucratic nightmare that makes it too difficult to get in.,73
4833,"A Waiter. A Cab Driver. An Engineer: The U.S. Fighters Bound for Ukraine. Ukrainians across the U.S., many of whom have never fired a weapon, have put their lives on hold to defend their homeland.",73
4868,"For Young Ukrainians, Independence Is Not Optional. We asked young Ukrainians what it meant to them to grow up in an independent Ukraine and how it feels to watch Russia wage war on their homeland.",73
4893,"Over Ukraine, Lumbering Turkish-Made Drones Are an Ominous Sign for Russia. The Bayraktar TB2 has become a rallying symbol for Ukrainians, who are singing songs about them and posting videos of their success.",73
5180,"War Brings Out Solidarity and Defiance in Ukrainians Who Remain. About two million people have stayed in Kyiv, a population galvanized by a newfound unity and its refusal to be cowed by Russian invaders.",73
5237,Ukrainians Try to Push Back Russian Forces Pummeling Their Cities. Desperate fighting has shifted the front lines but neither side seems to have a decisive upper hand as Ukraine’s suffering deepens.,73
5276,"Quotation of the Day: Polish City Puts Dark Past Behind It to Aid Fleeing Ukrainians. Quotation of the Day for Thursday, March 24, 2022.",73
5327,Ukraine’s Diaspora. More than three million Ukrainians have fled their country. See who they are.,73
5334,"‘Like a Weapon’: Ukrainians Use Social Media to Stir Resistance. Photos and videos of the war’s horrors have spread quickly, searing into the global public consciousness and providing powerful ammunition in the information battle.",73
5345,"Ukrainians Fill Streets With Music, Echoing Past War Zones. In subway stations and apartment buildings, artists are playing Bach, Vivaldi and folk songs.",73
5401,A Year of War in Ukraine. Ukrainians discuss how their lives have changed since Russia invaded their country.,73
5403,"Fear, Anger, Love: See Ukrainians’ Texts From the First Hours of War. On Feb. 24, 2022, many people in Ukraine were awakened by explosions, and others by the pings of anxious or supportive messages. Their exchanges that morning are a snapshot of a turning point in modern history.",73
5415,"Lethal Threat or Tolerable Risk? Ukrainians Must Judge Constantly.. After a year of war, people in Ukraine have become adept at telling which threats are probably not deadly, leaving room for a little enjoyment, and even hope.",73
5472,"The Problem With Russia Is Russia. Ukrainians will survive the Russian Federation, just as we survived the Soviet Union.",73
5758,"Zelensky Urges Ukrainians to Remain Unified. On a day meant to mark the unification of Ukraine in 1919, the country’s leader said it was vital for Ukrainians of all regions to bind together.",73
5838,"‘I’m Sorry, We’re From Moscow.’ In Bali, Warring Sides Learn to Cohabitate. Thousands of Russians and Ukrainians have fled their homelands for Bali. But even in a tropical paradise, the war is ever-present.",73
5854,"War and Motherhood Sidelined Ukraine’s Elina Svitolina. She’s Ready to Return.. Rather than struggling to compete on the WTA Tour most of 2022, the tennis star focused on her new daughter and raising money to help her fellow Ukrainians.",73
5862,"Ukrainian Engineers, Historians and Housewives Are Keeping Putin on His Toes. With sewing machines and smartphones, Ukrainians are fighting against the Russian aggressors.",73
6000,On the Road With Ukraine’s Refugees: An Update. We reported alongside Ukrainians making their escape from Russia’s increasingly brutal invasion.,73
6010,"Putin Insists He Is Open to Talks, as Air-Raid Sirens Sound Across Ukraine. Ukrainians appeared intent on celebrating Christmas, even if scarce power left some cities darkened, save for generator-powered holiday light displays.",73
6116,Are We in the West Weaker Than Ukrainians?. Thank God someone is standing up to Putin.,73
6319,A video circulating on social media depicts a staged presentation of Ukrainians who have died since Russia's recent invasion of the country.,73
6410,Ukrainians pray in the snow ahead of Russian invasion,73
6552,Putin said Russia would use Ukrainians as human shields,73
6753,15 million Ukrainians maintain strong ties with the Russian Federation,73
6760,2.5 million Ukrainians are asked to be evacuated to Russia,73
6792,72.5% of Ukrainians support a compromise between Ukraine and Russia at all costs in order to achieve peace in Donbas,73
6793,80% of Ukrainians live below the poverty line,73
6794,85% of Ukrainians demand to restore friendly relations with Russia,73
6797,93% of Ukrainians are dissatisfied with the work of the government and parliament,73
6798,95% of Ukrainians are actually separatists,73
6800,96% of Ukrainians support the death penalty for corrupt officials,73
6867,A story in the news about whether Ukrainians will be able to adopt the experience of surviving the forest in winter...,73
6875,A well-known doctor warned about the threat of the Omicron strain for Ukrainians,73
6889,Abrams and Leopard 2 tanks 'threaten the health of Ukrainians',73
6997,An upcoming EU collapse will make Ukrainians realise their mistakes,73
7176,Bill Gates started chipping Ukrainians,73
7250,"By arming Ukrainians, the West is triggering a conflict with Russia",73
7332,Census needed for total control over Ukrainians,73
7548,Death and starvation of Ukrainians in Donbas were the result of the actions of the Ukrainian authorities,73
7705,EU may deport Ukrainians for mobilization into the army,73
7721,"EU, US, and NATO use Ukrainians as cannon fodder",73
7765,Europe supported Ukraine as an anti-Russian project and for this Ukrainians paid a colossal price,73
7875,"For 90% of Ukrainians, Victory Day is a holiday",73
7888,"Foreign military instructors are preparing five battalions of Ukrainians who are almost nationalists, the aim is to attack Donbas",73
8058,Hungary to Fleeing Ukrainians: Hope You’re Just Passing Through,73
8189,"In Ukraine, they will begin to collect the DNA of Ukrainians, for this they needed PCR tests",73
8228,Indigenous Peoples Bill Deprives Ukrainians of Basic Rights,73
8320,"It is not a war, it is the liberation of Ukrainians from neo-fascism",73
8324,"It was the UK intelligence that planned the assassination of Darya Dugina, while the perpetrators were Ukrainians",73
8363,"Journalists, Ukrainians Object to AP News Story on Regional ‘Elections’",73
8511,Latest Kremlin Fantasy: 'Very Many Ukrainians Want Russian Citizenship',73
8555,Low-income Ukrainians and pensioners will be cut off from gas in 2021,73
8680,Mob of Ukrainians beat 'Russian boy' to death in Germany,73
8798,NATO is at war with Russia with the hands of Ukrainians,73
9145,Polish tour operators offer a special service – hotels “without Ukrainians”,73
9216,Propaganda about Russian military in Ukraine distracts Ukrainians from real problems,73
9335,Radical-minded Ukrainians are preparing to attack peace-loving Russia,73
9544,Russia is at war with NATO and the Pentagon; only the soldiers are Ukrainians,73
9734,Russian Novelist Brags His Battalion Killed the Most Ukrainians,73
9778,Russian TV Accuses Kyiv of Forsaking Ukrainians in Wuhan; Evacuee Tells Different Story,73
10069,Teenagers made shoes out of bread while Ukrainians mourned Holodomor,73
10305,The US and Annalena Baerbock are inciting the Ukrainians to war,73
10310,The US and NATO won’t hesitate to risk the lives of Ukrainians in a war,73
10401,"The Ukrainians have sent special forces to Luhansk, in order...",73
10424,The West corrupted millions of Ukrainians with pseudo-values that created an anti-Russia,73
10469,The West is using Ukrainians to fight against Russia,73
10504,The West “lies” about Russia’s involvement in the forced deportation of Ukrainians,73
10602,"The majority of Ukrainians in the temporarily occupied territories are ready to go to a ""referendum"" and vote for...",73
10786,Three million Ukrainians want to “escape lawlessness” to Russia,73
10874,UN recognized Ukrainians as a dying nation,73
11367,Ukraine’s Health Ministry Allows dead Ukrainians to be sold for Organs,73
11564,Ukrainians Watch TV Less Often Due to Government Propaganda – Poll,73
11565,Ukrainians affected by US vaccine trial,73
11566,Ukrainians and Western Europeans are the direct descendants of Hitler,73
11568,Ukrainians are Russian people,73
11571,Ukrainians are considering moving to Crimea for clean water,73
11572,Ukrainians are dying for the interests of the US but the US and Europe are losing interest in Ukraine,73
11573,Ukrainians are returning to Russian cars,73
11574,Ukrainians are the only ones in the world who pay the “murder tax”,73
11575,Ukrainians are “tired of the war” and ask the authorities to sit down at the negotiating table,73
11577,Ukrainians call Russian schoolchildren and ask them to leave the gas in their apartment on “for verification”,73
11580,Ukrainians demand to make Ukrainian the second official language in Poland,73
11581,Ukrainians from government-controlled Donbas territories are traveling to the self-proclaimed...,73
11582,Ukrainians have never lived in Odessa￼,73
11583,"Ukrainians in Germany wanted to burn a Russian flag, but burned down the house",73
11584,Ukrainians in Germany “resell things given to them by the German authorities”,73
11585,Ukrainians in Poland and Great Britain started to issue subpoenas,73
11586,Ukrainians in the EU are “tested for tuberculosis because of NATO biodevelopment”,73
11587,Ukrainians kneel before the West,73
11588,Ukrainians massively evade mobilization - video ￼,73
11589,Ukrainians massively leave for temporarily occupied territories - CNN report,73
11591,"Ukrainians massively travel to Germany, receive social assistance and return back",73
11592,Ukrainians meet train from Russia,73
11593,Ukrainians pasted stickers with “Russophobic inscriptions” in the former Auschwitz concentration camp,73
11594,"Ukrainians pay for PCR tests themselves, although the EU gave the government 1.2 billion for these...",73
11595,"Ukrainians shoot from residential areas, use children as human shields",73
11596,Ukrainians start selling American Switchblade-300 kamikaze drones on the darknet,73
11597,"Ukrainians suffer from fascism, a political turn is not in sight",73
11598,Ukrainians want Russian blood,73
11599,"Ukrainians want peace with Russia, but the 'war party' controlled by NATO is against it",73
11600,Ukrainians who received a thousand hryvnias for vaccination must file an income declaration,73
11601,Ukrainians will be obliged to bring all their savings to the bank and pay tax,73
11602,Ukrainians will disappear due to global warming,73
11603,Ukrainians will not be able to use mobile phones from January 1,73
11604,Ukrainians will receive 16.5 thousand hryvnias in connection with the expansion of the “red zone”,73
11605,Ukrainians without tax declarations will be banned from using banking services,73
11606,Ukrainians without their consent will be “allowed for organs”,73
11607,Ukrainians working abroad now have to pay tax in Ukraine,73
11608,Ukrainians “are evacuated to Belarus in transit through Europe”,73
11609,Ukrainians “choose Russia because of Kyiv’s atrocities”,73
11610,Ukrainians “detained” in German Bremen trying to sell Stinger anti-aircraft missile systems,73
11623,"Under the cover of a pandemic, Ukrainians were allowed to be disconnected from the communal apartment",73
11630,"Unscrupulous, corrupt and greedy Ukrainians have always been betraying Russia",73
11634,Unvaccinated Ukrainians will be deprived of citizenship,73
11808,West uses Ukrainians as cannon fodder in proxy war against Russia,73
11809,West uses Ukrainians as expendable material in geopolitical game to contain Russia,73
11812,Western Leopard tanks firing radioactive ammo will destroy health of Ukrainians,73
11815,"Western Ukrainians conduct purges in Donetsk, anybody criticizing Ukrainian authorities...",73
11971,Zelenskyy continues a monstrous experiment to turn Ukrainians into the enemies of Russians,73
11972,Zelenskyy didn’t warn Ukrainians about Russia’s offensive to save his own government,73
12052,“Ukrainians themselves want to hold “referendums” in the territories of Ukraine seized by Russia”,73
