,title,cluster
21,"""Russia is becoming the first country to break ties with the Antarctic Treaty.""",87
175,"“The former Miss Universe-Ukraine, Anastasiia Lenna, turned in her high heels for some combat boots to fight for her country.”",87
243,“In every other major industrial country in the world … inflation is higher.”,87
350,"Photos show “Ukrainian Christians pray outdoors, in the snow, for their country in this phase of war danger.”",87
399,“We’ve tested more than every country combined.”,87
407,"""Vice President Biden threatened a foreign country and forced them to fire a prosecutor who was investigating a company,"" that paid his son Hunter.",87
429,"""When my father became commander in chief of this country, we got out of all international business.""",87
539,"Just 6 percent of Americans say Russia is the country’s most important issue, yet the story receives ""75 percent of the coverage"" in the media.",87
579,"Says Sen. John McCain was ""caught making highly illegal phone call to foreign country.""",87
583,"""Thirty years ago we were the most college-educated country on the globe. Today we are No. 11.""",87
610,"""If Texas were a country our economy would rank # 10...in the WORLD.""",87
617,"""Almost every country on Earth sees America as stronger and more respected today than they did eight years ago when I took office.""",87
642,"""Today in America, we have more people in jail than any other country on Earth.""",87
657,"""We are the only major country on Earth that doesn't guarantee health care to all people as a right.""",87
676,"""We live in the most incarcerated country in the world.""",87
771,"Under Hosni Mubarak's rule, ""Egypt received more American dollars than any country besides Israel.""",87
822,"Businessman Oleg Tinkov, who publicly criticized Russia's invasion in February, said he “can’t and won’t be associated with a fascist country.” ",87
880,"Muslims join the war effort as fighters or volunteers: ""We’re the minority here, but we’re a part of this country. We must do something.""",87
881,"The country is often seen as a quirk of geography and history, though it also became more worryingly known as a murky hub for organized crime and people smuggling.",87
892,"Ukraine's president has called for global protests in solidarity with his country, and demonstrators have taken to the streets in many nations to protest the Russian invasion.",87
899,"Thousands of IT professionals are fleeing the country, creating a brain drain that may never be reversed.",87
925,"The country's defense industry, long driven by persistent threats from the North, sees new opportunities to sell globally because of the Ukraine war. ",87
929,Poland is a member of NATO. A strike on the country could thus mark a pivotal moment in the Russia-Ukraine war — depending on what actually happened.,87
1024,Air raid sirens sounded in Kyiv a day after explosions rippled across the country in one of the fiercest attacks by Russia in recent weeks,87
1028,"A Ukrainian drone was shot down near Russia's Engels airfield, deep within the country, killing three people, Moscow officials said. ",87
1082,"Ukrainian officials accused Russia of launching a fresh volley of strikes against targets across the country, including in the capital.",87
1200,"Some parts of the country are suffering the daily brutality of war, while in other places, life feels relatively peaceful.",87
1268,"Ukraine’s wins off the battlefield stood in sobering contrast to developments in the country, where Russian troops have made further advances. ",87
1323,"In a letter circulated to colleagues and posted on social media, Boris Bondarev, counsellor to the Russian UN mission in Geneva, says he's never been ""so ashamed"" of his country.",87
1369,American officials say they are rushing equipment to Ukraine and resuming diplomatic activity in the country.,87
1385,"Ukraine's president noted the irony of Moscow refocusing attacks on his country's east, where many Russian speakers live. ",87
1504,Russia's invasion of Ukraine has drawn international condemnation. But at least one country has stood by Moscow and its leader.,87
1509,"A petition calling for an end to the fighting rocketed around Russia's technology community after the country invaded Ukraine on Thursday. More than 10,000 people have signed it.",87
1550,Ukrainian women are performing a variety of crucial roles in response to our country’s urgent situation — including on the front lines.,87
1581,"Thousands of Russians fled to Kazakhstan to avoid being sent to fight in Ukraine, but tighter visa rules will make it harder to enter and remain in the country. ",87
1656,"Fighting continued as two top Biden officials traveled to Kyiv to visit the Ukrainian president. European leaders visited Ukraine weeks ago to witness firsthand evidence of atrocities committed by Russian soldiers but until Sunday, top U.S. officials had not visited the country since the invasion.",87
1668,"As battles tilt toward full-scale military confrontation on open terrain, Ukrainian officials are again calling for Western alliances to step up weapons supplies to help the country strengthen its position on the battlefield.",87
1710,"Taiwan's leaders are at pains to point to the differences between their country and Ukraine, but residents still fear a Chinese invasion.",87
1716,"As we started driving from Kyiv, we saw warplanes in the sky and it smelled like burning. “The war is already here. Is this my country?”",87
1730,"As the second month of the war in Ukraine came to a close, Ukrainians across the country were praying. Some were in Orthodox churches. Others were in synagogues or mosques. Many were forced to worship underground, in shelters away from Russian military bombardment.",87
1760,"The country will need large investments and support, but progress won’t be possible or enough without security.",87
1783,"A 19-year-old says she is ready to volunteer to fight for her country, dismissing old assumptions about guilt and militarism.",87
1821,The Ukrainian Premier League announced the suspension of the country's football championship,87
1857,"There are no American diplomats left in Ukraine, and there are no plans to return them to the country yet, reports CNN.",87
1996,"From 12:00 p.m. on February 26, the Slovakian authorities are introducing a state of emergency in the country in connection with the influx of refugees from Ukraine.",87
2018,Armenia was the only country in the Council of Europe to join the Russian delegation in voting against the decision to expel Russia from the organization because of their invasion of Ukraine,87
2148,OnlyFans supported Ukraine and repainted its logo in the colors of the flag. The country's logo is displayed every time the website pages are updated.,87
2165,All mobile operators of Ukraine have banned calls from Russian SIM cards on the territory of the country,87
2192,"In a conversation with Sholtz, Zelensky stated the need to close the airspace over Ukraine and called for speeding up work on the country's admission to the EU",87
2290,"In the Czech Republic, due to the influx of refugees from Ukraine, a state of emergency has been introduced. It will last 30 days with the possibility of further extension. The country's government emphasized that this ""will not affect Czech citizens.""",87
2324,The Czech Republic plans to pay 200 euros per month to refugees from Ukraine. Refugees will be able to receive payments within three months of their arrival in the country,87
2355,CERN (European Organization for Nuclear Research) terminates the status of an observer country for Russia due to the situation in Ukraine,87
2431,Pope Francis wrote a tweet in Ukrainian in support of Ukraine. He called for specific efforts and prayers to help the country and urged its citizens not to get used to violence.,87
2457,"Skabeeva on Ukraine: ""It is impossible to capture such a large European country in a month""",87
2480,The Diet of Latvia announced May 9 as the day of remembrance for those killed in Ukraine in the country - Delfi portal,87
2571,"The Ukrainian Council banned the activities of pro-Russian parties on the territory of the country. 330 deputies voted for it. On the footage, Zelensky visited the Rada for the first time since February 24.",87
2621,President of Ukraine Zelenskyy signed the law banning pro-Russian parties in the country,87
2630,Ukraine won at Eurovision 2022. The country was represented by Kalush Orchestra with the song Stefania,87
2663,The Verkhovna Rada of Ukraine approved a bill banning the use of the symbols Z and V in the country,87
2707,"The government of Ukraine supported the bill on the legalization of medical cannabis, the country's health minister Viktor Lyashko said.",87
2715,"50 WTO members signed a joint statement in support of Ukraine, promising to promote exports from the country - US trade representative Ty",87
2717,"Lithuania will arm Ukraine with weapons against drones The country will hand over to Ukraine 110 anti-drone guns of its own production with a total cost of 1.5 million euros, Lithuanian journalist Andryus Tapinas reported.",87
2719,Ukraine received from the West only 10% of weapons according to its requests - Deputy Minister of Defense of the country Hanna Malyar Vona also added that it is planned to mobilize hundreds of thousands of people into the Ukrainian army.,87
2847,The President of Ukraine signed a decree on the appointment of Andrii Kostin as the country's Prosecutor General,87
2852,"A refugee from Ukraine, who arrived in the country on June 29, died of tropical malaria in Moldova, according to the National Public Health Agency.",87
3046,"In Kyiv schools, classes have been suspended, even in distance learning, reports ""Politics of the country"". In Western Ukraine, schools are moved to remote locations.",87
3060,"On Monday, the US Embassy in Kyiv called on citizens of the country who are in Ukraine to leave the country when it is safe to do so.",87
3090,"At her concert in Tel Aviv, before the song ""Don't Shoot"", Zemfira made an anti-war speech: ""Yesterday, my country launched a massive missile strike across Ukraine. These killings must stop.""",87
3252,"There is no more corruption in Ukraine. All corrupt officials have left the country and we will do everything to ensure that they remain where they are now, — Zelensky",87
3260,"The Minister of Finance of Ukraine stated that since February, damage to the country's infrastructure can be estimated at 100 billion dollars",87
3269,"In Ukraine, at least 5 million people lost their jobs, about 7 million left the country, which had a significant impact on the growth of the unemployment rate, Deputy Minister of Economy Tetiana Berezhna said.",87
3285,"Cellular communication towers in Ukraine switched to working from generators due to a power outage, the operators of working towers are overloaded, said the Minister of Digital Transformation of the country Mykhailo Fedorov.",87
3385,"For 300 days, the people of Ukraine have shown the whole world their steadfastness and resistance to the imperialist appetites of a country that thought it could get you. But you persevered - Biden",87
3487,"Dmytro Medvedev began to express himself in a completely undiplomatic language. He called Ukraine ""Country 404"" and the USA ""Pindostan""",87
3490,"Former Russian President Medvedev called Ukraine a ""mythical country"" and predicted its end",87
3549,"There are no American diplomats left in Ukraine, there are no plans to return them to the country yet, reports CNN.",87
3558,"In a conversation with Sholtz, Zelenskyi stated the need to close the airspace over Ukraine and called for speeding up work on the country's admission to the EU",87
4498,Exxon Mobil says it plans to leave its last remaining Russian project.. BP and Shell announced earlier that they were also seeking to leave the country after its invasion of Ukraine.,87
4544,"A War the Kremlin Tried to Disguise Becomes a Hard Reality for Russians. Moscow posted a death toll from its attack on Ukraine for the first time, and Russians who long avoided politics are now grappling with the fact that their country is fighting a deadly conflict.",87
4579,U.S. flag makers are rushing to fill orders for Ukrainian flags.. Demand has surged among buyers eager to show support for Ukraine. One manufacturer who sold seven of the country’s flags last year woke up on Thursday to an order for 100.,87
4719,"Russia, Blocked From the Global Internet, Plunges Into Digital Isolation. Russian authorities and multinational companies have erected a digital barricade between the country and the West, erasing the last remnants of independent information online.",87
4739,"For this border crisis, Poles extend a warm welcome, unlike last time.. Hundreds of thousands of Polish families have opened their homes to refugees from Ukraine, a sharp contrast to the country’s response to a different crisis last fall at the border with Belarus.",87
4846,"Russia, Where All the News Is Fake. The country has become a dystopian paragon of corrupted information.",87
4857,"Facing economic calamity, Putin talks of nationalizing Western businesses.. With the ruble collapsing, the economy contracting and people abandoning the country, Russia’s leader talks of a Western plot to destroy the country.",87
4881,Wall Street Joins the Unbanking of Russia. Goldman and JPMorgan are the first big U.S. lenders to pull out of the country.,87
4887,"U.S. and Allies Move to Further Isolate Russia From Global Economy. The Biden administration said it would join Europe and other allies in stripping Russia of permanent normal trade relations, another step to inflict economic damage on the country over its invasion of Ukraine.",87
4890,"‘This Is Everyone’s Culture’: Ukraine’s Architectural Treasures Face Destruction. The country’s vast array of historic buildings, artworks and public squares are an integral part of Ukraine’s cultural identity. Amid the violence of war, many are being reduced to rubble.",87
4904,‘We Live in a Different World Now’: Dispatch From a Changed Germany. A stunned country rearms.,87
4906,"The U.S. and the E.U., aiming to punish oligarchs, ban luxury exports to Russia.. The move will prevent any shipments of high-end watches, cars, apparel, alcohol and jewelry from reaching the country.",87
4951,"On a Stage 5,000 Miles Away, He Sings for His Family in Ukraine. At the Metropolitan Opera, the bass-baritone Vladyslav Buialskyi has become a symbol of his country’s struggles.",87
4974,Are Big Businesses In or Out of Russia?. Companies partially pulling out of the country are under pressure to make a cleaner break.,87
4991,"He’s American, He Oversees Papa John’s in Russia and He’s Staying. Christopher Wynne’s company controls the franchise agreements for the 190 Papa John’s locations in the country. “At the end of the day, they appreciate a good pizza,” he said.",87
5037,"The Sounds of Ukrainian Pop. A conversation about some of the country’s stars, the musical traditions they work within and how they have grappled with the war.",87
5091,"Russia appears to have avoided default as it makes a $117 million bond payment.. Sanctions have isolated the country financially, driven down the value of the ruble and cut off Moscow’s access to about half its foreign currency reserves.",87
5095,"What’s Going On in This Graph? | Refugees From Ukraine. Since the start of the Russian invasion of Ukraine on Feb. 24, 2022, almost three million of the country’s 44 million residents have left the country. How big is this crisis?",87
5131,Dispatch From Hungary: The Man Trying to Return His Country to the Free World. The strongman’s ties to Putin might finally hurt him.,87
5166,"Ukraine Reminds Georgia of Its Own War With Russia. That Creates a Dilemma.. Russia invaded Georgia in 2008. To many Georgians, that means the country should stand unequivocally with Ukraine. But the government is more cautious.",87
5225,"Venezuelan Vacations Abruptly End as Tourists Return Home to a Different Russia. While Russian tourists were visiting Margarita Island, their country invaded Ukraine. Many were left wondering what travails awaited them back at home.",87
5236,"A Kremlin spokesman says Russia could use nuclear weapons if there is ‘an existential threat for our country.’. The spokesman, Dmitri S. Peskov, made the comment after describing Ukraine, the neighboring country Russia invaded a month ago, as having been created by anti-Russian Western powers.",87
5255,"Ukraine War Ignites Israeli Debate Over Purpose of a Jewish State. Most Ukrainians seeking refuge in Israel are non-Jews. Some Israelis see a moral imperative to take them in, but others see a threat to the country’s Jewish character.",87
5256,Nestlé suspends sales of KitKat and Nesquik Brands in Russia.. The consumer giant said it did not expect to make a profit in the country “for the foreseeable future.”,87
5282,"With U.S. Focus on Ukraine, North Korea Launches a Powerful New ICBM. It was the country’s first long-range ballistic missile test since 2017, and it raised the specter of intensified provocations and threats on the Korean Peninsula.",87
5311,"Ukraine’s troops begin a counteroffensive that alters shape of the battle with Russia.. Although their claimed gains in territory are hard to quantify or verify, this picture of Ukrainian progress is aiding the country’s messaging to its citizens and to the world.",87
5347,"Putin Goes Into Battle on a Second Front: Culture. In a blast against “cancel culture,” he said the West is “canceling” Russia by going after “an entire thousand-year-old country, our people.”",87
5351,"Public Health Catastrophe Looms in Ukraine, Experts Warn. Even before the war, the country struggled with epidemics of H.I.V., tuberculosis and hepatitis. The conflict threatens to undo decades of progress.",87
5368,Janet Yellen in Kyiv: Economic Aid to Ukraine Is Vital. Our commitment to support a brave people defending their country is unwavering.,87
5371,"I Went to Syria, the Country That Remade Our World, and This Is What I Saw. We have abandoned the Syrian people to biblical devastation.",87
5439,"How Poland, Long Leery of Foreigners, Opened Up to Ukrainians. The country, once one of the world’s most ethnically and culturally homogeneous, has accommodated far more refugees from neighboring Ukraine than any other nation.",87
5482,Turkey’s Reeling Economy Is an Added Challenge for Erdogan. The earthquake’s staggering reconstruction bill will join other economic woes as the country’s autocratic leader faces re-election.,87
5486,"Straight Talk on the Country’s War Addiction. America’s forever wars are making us weaker, and misreading history doesn’t help.",87
5507,"Belarus Would Join Russia’s War if Ukraine Attacked, Lukashenko Says. President Aleksandr Lukashenko of Belarus has been surrounded by speculation that his country could be pressed into providing more support for Russia.",87
5521,A Ukrainian Orchestra on a Mission to Promote Its Country’s Culture. Members of the touring Lviv National Philharmonic Orchestra of Ukraine have watched the devastation of war from a distance.,87
5531,"Moldova briefly closed its airspace, raising tensions in a country shaken by the war.. The closure, because of a presumed air balloon, came days after a Russian missile flew over Moldova’s territory and after the country’s president accused Moscow of trying to sabotage her government.",87
5536,"Secretive Network Rescues Russia’s Antiwar Dissidents in Nick of Time. Hundreds of people facing long prison sentences are being spirited out of the country by groups that arrange daring escapes, with one trip using six different cars over more than 4,000 miles.",87
5549,Ukrainian Refugees and Host Families: What Is Life Like After Being Uprooted?. Times Opinion wants to hear from Ukrainians who have left their country and the people who are helping them.,87
5621,"Gautam Adani’s Rise Was Intertwined With India’s. Now It’s Unraveling.. The tycoon often said the Adani Group’s goals were in lock step with India’s needs. Now, the company’s fortunes are crashing, a collapse whose pain will be felt across the country.",87
5627,"At Czech Spa Town, ‘Russia for Us Is the Past, and It Was Not Pleasant’. Since the 18th century, Russians have flocked to the healing waters of Karlovy Vary. Now, the Czech government has barred them from visiting the country, and the town must reinvent itself.",87
5629,Ukraine Renews Threat to Boycott Olympics if Russians Compete. Ukraine’s sports minister said his country was marshaling allies to press the International Olympic Committee to bar Russian and Belarusian athletes.,87
5727,"Ukraine’s Scientists Receive a Funding Lifeline From Abroad. The Simons Foundation in New York is providing annual grants to the country’s chemists, biologists, physicists and mathematicians.",87
5761,Peru’s Deadly Protests. A failed coup attempt set off unrest that has immobilized the country.,87
5834,Israel Moves Right. Israel’s new right-wing government is moving quickly to transform the country.,87
5872,"It’s a Wonderful Country: Robert Kagan’s Case for U.S. Empire. In the second installment of his “Dangerous Nation” trilogy, the veteran foreign policy critic argues for embracing the better angels of America’s imperialist nature.",87
5878,"Russia posts a $47 billion budget deficit for 2022, its second highest in the post-Soviet era.. The budget gap reached 3.3 trillion rubles, or 2.3 percent of the size of the Russian economy, according to the country’s finance minister.",87
5881,How Finland Is Teaching a Generation to Spot Misinformation. The Nordic country is testing new ways to teach students about propaganda. Here’s what other countries can learn from its success.,87
5928,"Ukraine Keeps Downing Russian Drones, but Price Tag Is High. When costly missiles take out cheap drones, the real winner over time may be the country that spends less.",87
5949,"How Russia’s War on Ukraine Is Worsening Global Starvation. Moscow blocks most shipments from Ukraine, one of the world’s largest wheat producers, and its attacks on the country’s energy grid also disrupt the flow of food.",87
6059,Congress Proposes More Than $44 Billion for Ukraine. The spending bill unveiled Tuesday includes billions more for the country than President Biden had requested.,87
6097,"Russia keeps its key interest rate steady amid worries of inflation.. The country’s central bank said inflation, at 12 percent, risked rising because of a growing budget deficit.",87
6127,"Paintbrush in Hand, a Russian Muralist Wages His Own War. An 84-year-old artist, defying Moscow’s crackdown on dissent, wants his country to acknowledge misdeeds both past and present.",87
6130,"In Georgia, a New Figure Emerges to Shake Up the Status Quo. With the country’s politics ‘on hold’ during Russia’s war on Ukraine, Anna Dolidze is awaiting her turn to lead on grass roots issues.",87
6172,"Qatar Extends Its Natural Gas Dominance at Russia’s Expense. As its influence grows, the country is poised to become a big energy supplier to Europe, which has turned away from Russia after its invasion of Ukraine.",87
6184,"Away From the Spotlight, a Debate Rages Over a Postwar Ukraine Economy. Beyond the enormous cost of rebuilding the country are difficult and delicate choices about how to best connect the nation to European markets and commerce.",87
6226,"In Forests Full of Mines, Ukrainians Find Mushrooms and Resilience. These misty and damp parts of the country have long beckoned to mushroom hunters with the promise of plenty, but now peril, too, lies beneath the earth’s surface.",87
6240,"Caught Between Patriotism and Nationalism. The definition of what it means to be Ukrainian has always been fluid, but Russia’s invasion of the country has supercharged that debate.",87
6278,A video clip depicting a large group of people gathering in a bar and crying out after they watched a map of territory reclaim on a big screen was uploaded on Facebook.​ The video clip came with a claim saying they were Ukrainians cheering after their country’s counterattack had reclaimed many parts of territories from the Russian invasion.,87
6291,The LGTBI Pride flag has incorporated two stripes with the colors of the Ukrainian flag as a sign of support for that country against the Russian invasion.,87
6305,allegedly show India's Qutub Minar minaret lit up with the colors of the Russian flag in support of the country's invasion of Ukraine.,87
6331,Image shows the mythical “Ghost of Kyiv” responsible for shooting down numerous Russian jets amid the country’s invasion of Ukraine.,87
6346,"""Russia is not a threat to any country.""",87
6845,A map shows: Kyiv's eccentricity has already split the country,87
7150,Biden says Zelensky is stealing from his country,87
7255,CAR President Touadera said he “would not allow his country to be turned into Ukraine”,87
7791,Every Norwegian Citizen Receives Rent from Their Country's Natural Resources,87
8541,Lithuania is a country with a limited sovereignty,87
8551,London is helping Kyiv turn the country into a nuclear wasteland,87
8919,Not a single Ukrainian MP went to personally defend the country,87
9130,Polish Public Broadcaster uses a map of the country with part of Western Ukraine,87
9471,Russia Will Investigate Navalny’s Poisoning… As a Foreign Attempt to Destabilize the Country,87
9502,Russia does not threaten Ukraine or any other country,87
9522,Russia has never interfered in the internal affairs of any country,87
9540,"Russia is a ""peacemaker country"".",87
9541,Russia is a peaceful country that returned captured warships to Ukraine,87
