,title,cluster
67,"U.S. imports 1% of its oil from Russia while “Exxon, Chevron, BP and Shell profits are at their highest level in over 7 years.”",72
79,"The United States buys ""206,000 barrels of oil a day"" from Russia but ""shut down domestic oil production a year ago.""",72
140,“We have doubled our (oil) imports from Russia in the last year.”,72
299,Comparing the price of oil and gas in June 2008 to March 2022 shows that oil companies are “price gouging.”,72
326,"The Keystone XL pipeline ""would have produced 830,000 barrels of oil per day, more than enough to offset what we import from Russia.""",72
366,"The U.S. is “now importing 800,000 barrels of oil from Russia,” but that could have been prevented if the Keystone XL pipeline hadn’t been cancelled.",72
377,Says that the oil and gas industry comprises 35% of the Texas economy.,72
465,"Just before Thanksgiving, oil was $54 a barrel, down from $82. ""Thank you to Saudi Arabia.""",72
475,"""It is only under President Trump that we have become the largest producer of oil and gas resources.""",72
569,"The Keystone XL pipeline ""doesn’t even have any oil for America.""",72
582,"Says ExxonMobil ""fought to kill"" a rule requiring oil and mining companies to disclose payments made to foreign governments.",72
674,"""America produces more oil and gas than any other nation in the world.""",72
678,"""America is No. 1 one in oil and gas.""",72
681,"""We're now the No. 1 producer of oil in the world. We've surpassed Saudi Arabia.""",72
746,"The U.S. has a ""record number of oil rigs operating right now – more working oil and gas rigs than the rest of the world combined.""",72
763,"""Libya supplies the oil for China. We get no oil from Libya.""",72
780,"The U.S. spends $4 billion on research and development for energy, while spending $350 billion on oil from foreign countries, ""many of whom are our enemies.""",72
781,"The White House has ""refused"" international help in dealing with the oil spill.",72
782,"""Brazil got off oil in the last 30 years.""",72
795,"The U.S. energy policy is to ""borrow money from China to buy oil from countries that don't like us.""",72
854,"Caught in a price squeeze for both oil and fish, thousands of ""chippy"" shops could go out of business this year in Britain. ",72
883,Greenpeace protesters want the Norwegian government to impose an embargo on Russian oil imports in response to the war in Ukraine.,72
906,"India, the world’s biggest oil importer behind China and the United States, has agreed to purchase 3 million barrels of Russian oil at a heavy discount, an Indian official said.",72
1057,"As missiles headed for Kyiv, the European Union’s embargo on seaborne Russian crude and the Group of Seven’s price cap on oil went into effect.",72
1059,"Moscow has denounced a price cap on Russian oil agreed by Western nations as ""dangerous."" The Biden administration has called the cap “welcome news.”",72
1064,"In Brussels Monday, European diplomats will try to move forward with U.S.-backed plans to cap the price of Russian oil after talks last week stalled. ",72
2038,"The oil depot is on fire - Mayor Vasylkov Ukrainian mass media write that the environmental damage will be ""colossal""",72
2199,"Biden ordered the release of 30 million barrels of oil from the strategic reserve in connection with the situation around Ukraine, the US Department of Energy reports.",72
2335,"The US Congress will consider Russia's exception to the WTO and the ban on oil imports. The bill will cancel ""normal trade relations with Russia and Belarus."" $10 billion can be allocated to Ukraine.",72
2465,"Estonia offers to restore Ukraine with money from Russia's oil and gas revenues, so EU payments to Russia for the supply of energy carriers, as I believe in Tallinn, should be temporarily deposited.",72
3235,Ukraine suspended the pumping of Druzhba oil in the direction of Hungary — Transnefta.,72
3236,"Hungarian Prime Minister Orban convened the Security Council due to the suspension of the oil pipeline. Previously, Ukraine suspended the pumping of oil through the Druzhba oil pipeline to Hungary",72
4411,"Oil prices climb as Ukraine crisis deepens.. A nuclear threat, and skepticism at potential talks.",72
4465,"Countries rush to release emergency reserves as oil prices soar.. The announcement was aimed to assure markets that there would be “no shortfall” as a result of Russia’s invasion of Ukraine, but oil prices kept rising, closing above $100 a barrel.",72
4516,"As oil soars, OPEC and its allies decline to offer relief.. The oil cartel known as OPEC Plus said it would continue the strategy agreed to in July, rubber-stamping a 400,000-barrel-a-day production increase for April.",72
4542,The U.S. extends technology restrictions to Belarus and the Russian oil industry.. The Biden administration said the measures would degrade the ability to wage war on Ukraine and would prevent Belarus from channeling forbidden goods to Russia.,72
4590,"Lukoil, a Russian Oil Company, Calls for an End to the Ukraine War. The company, which has more than 200 gas stations in the U.S., acted as lawmakers in Washington were seeking to block Russian oil imports.",72
4593,"Lawmakers Push to Ban Russian Oil Imports, Amid White House Resistance. Republicans and Democrats on Capitol Hill are pursuing the ban to punish Russia for its invasion of Ukraine, but the White House is opposed, warning of energy price spikes.",72
4695,"Oil Prices Jump as U.S. Discusses Russian Import Ban. The cost of Brent crude, the international benchmark, was trading at about $129 a barrel on Monday.",72
4710,"As Oil Goes Up, Stocks Go Down. Climbing energy prices are roiling markets.",72
4733,Climate Hawks Join the Debate on Ukraine. Environmentalists say now is the time to choke off Russia’s oil and gas profits. But the White House has difficult choices to make.,72
4742,The Future Turns Dark for Russia’s Oil Industry. An exodus by Western companies and disdain for Russian oil signal the start of a reckoning.,72
4752,"Shell says it will quit purchasing oil and gas from Russia.. The oil giant said it would immediately halt spot purchases of Russian oil, but described other measures as a “phased withdrawal” as it seeks alternative sources.",72
4760,"Biden bans U.S. imports of Russian oil and natural gas, and Britain vows to phase Russian oil out.. The British also said they would phase out imports of Russian oil by the end of the year to increase the economic isolation of Russia’s president, Vladimir. V. Putin.",72
4761,"Suddenly, oil companies are upbeat again. Prices are soaring as industry leaders meet in Houston. The vibe at the conference is “we’re part of the solution.”",72
4778,U.S. Bans Russian Oil. McDonald’s and other big American brands are suspending operations in Russia.,72
4789,"Loss of Russian Oil Leaves a Void Not Easily Filled, Straining Market. Global production will take time to ramp up, so the U.S. and other buyers will chase limited supplies, creating upheaval unseen in decades.",72
4791,"Changed Itineraries, Higher Fares: How the War in Ukraine Is Affecting Travel. How travelers feel the effects of Russia’s assault on Ukraine depends largely on where they’re going, though the price of oil will weigh on all airfares, even domestic.",72
4822,"Democrats Find Their Inflation Villains: Vladimir Putin and Big Oil. With the U.S. battling high oil prices and facing a dangerous confrontation with Russia, the Democratic Party is coalescing around a new message for the midterms.",72
4961,"Oil Prices Drop as Market Volatility Eases. A barrel of oil is trading at roughly $107, while gasoline is at $4.33 on average in the United States.",72
5013,"India says it’s in talks with Russia about increasing oil imports.. The move comes as New Delhi is striving to preserve its relationship with Moscow, its biggest supplier of weapons, at a time when India faces an aggressive China.",72
5057,"Boris Johnson travels to Saudi Arabia for oil diplomacy.. At home, critics had another take on Mr. Johnson’s efforts to reduce western reliance on Russian energy.",72
5086,"Inflation vs. Recession: The Fed Is Walking a Tightrope. American consumers already have high inflation. Because of the oil price shock and Russia’s war, the odds of a recession have increased, too.",72
5230,TotalEnergies says it will stop buying oil from Russia by the end of the year.. The French company said it had been accused of “complicity in war crimes” for continuing to work in Russia.,72
5604,How Russia Is Surviving the Tightening Grip on Its Oil Revenue. Restrictions on Russia’s oil trade are raising the stakes in a protracted economic standoff that is reshaping the global energy market.,72
5647,Russian Diesel Is Europe’s New Embargo Target. The coming ban on Russian exports of refined oil products could strain energy markets and crimp Russia’s output.,72
5784,"In Davos, a Skirmish Over the Role of Oil States at Climate Talks. John Kerry defended the choice of an oil executive to run the next climate talks while Greta Thunberg and others raised an alarm.",72
5811,"Can We Put a Price Tag on Nature?. Oil is lucrative, protecting the Amazon is not. We visited a community that has to live with the consequences.",72
5827,"The war in Ukraine upended energy markets. What does that mean for the climate?. Almost a year after Russia launched its invasion, assessing the impact on the oil industry and greenhouse gas goals is not so simple.",72
5845,"The War in Ukraine Upended Energy Markets. What Does That Mean for the Climate?. Almost a year after Russia launched its invasion, assessing the impact on the oil industry and greenhouse gas goals is not so simple.",72
6093,"Biden Administration to Buy Three Million Barrels of Oil. The move appears to signal an end to the government’s effort to sell oil from a strategic reserve to help tamp down energy prices, which soared after Russia’s invasion of Ukraine.",72
6165,"Oil Prices Drop, Despite Heightened Sanctions on Russian Crude. The price of oil fell by about 10 percent this week, easing (for now) supply worries about the E.U. embargo and a price cap.",72
6168,"Turkey Is Strengthening Its Energy Ties With Russia. As Moscow seeks new customers for oil, gas and coal, Ankara is a willing buyer as it promotes plans as a regional trading hub.",72
6213,Oil Climbs as Western Nations Single Out Russia. Energy traders pushed crude prices higher on Monday following Europe’s embargo of seaborne Russian crude and a price cap by Group of 7 nations went into effect.,72
6217,"An E.U. embargo of Russian oil and the G7’s price cap take effect.. An immediate impact on oil supplies in Europe was not expected, partly because the embargo has been in the works for months.",72
6223,"Amid Churning Oil Market, OPEC and Russia Leave Production Unchanged. The group, OPEC Plus, reaffirmed an output cut in October as “the right course of action” but outlined no other changes before an E.U. embargo of Russian oil begins on Monday.",72
6224,The Week in Business: Upheaval in China. The labor market showed continued resilience. President Biden signed legislation averting a rail strike. And a near-total embargo on Russian oil takes effect.,72
6239,"Ukraine’s Allies Agree on Russian Oil Price Cap. The plan to impose a top price of $60 a barrel on Russian crude will most likely make a small dent in the Kremlin’s revenue, but the White House hopes it will help avert an oil shock.",72
6242,"Here is how the so-called price cap on Russian oil will work.. The plan to curb Moscow’s oil revenues relies heavily on European shipping and insurance companies, but experts point to major loopholes.",72
6246,"OPEC and Russia to Meet as Global Forces Weigh on Oil Market. As the West moves to intercede in oil trading, OPEC Plus, led by Saudi Arabia, is expected to protect its own interests.",72
6258,E.U. Talks Over Russian Oil Price Cap Drag On. The negotiations over a policy intended to crimp a vital source of revenue for Russia’s war effort have been going on for more than a week.,72
6290,"Worldwide shortages of oil, gas, paper, milk, grain and other raw materials are not because of Ukraine.",72
6364,Hunter Biden’s payments from the Ukrainian oil and gas company Burisma Holdings ended with the Russian invasion of Ukraine.,72
6586,Battle in a supermarket in France for sunflower oil as a result of the war in Ukraine,72
7209,"Bread, milk, eggs and sunflower oil may disappear from Ukrainian stores",72
7327,Cannabis oil kills cancer in 90 days,72
7664,"Don’t Panic! Russia Boosting Oil Production Good For the Country, Officials Say. Except It’s Not",72
8259,"Iran, Russia Dispute U.N. Findings on Saudi Oil Attack",72
8890,"No Sugar, Lemon Juice, Coconut Oil Cure Cancer",72
8954,Oil pipeline for Ukrainian sunflower oil to Gdansk is evidence of the “capture of Ukraine by Poland”,72
9966,"Skirting Sanctions, Moscow Slashes Prices to Find Oil Buyers",72
10049,Syria Misrepresents Scale of Mediterranean Oil Spill,72
10609,The objective of the oil price cap is for Europe to prosper,72
10615,The price cap on Russian oil will destroy the EU,72
