,title,cluster
128,"""I have been much tougher on Russia than Obama, just look at the facts. Total Fake News!""",99
264,NBC News “covered up Hunter Biden laptop story.”,99
273,March 2022 moon crash was orchestrated by the government and visible from Earth.,99
367,Says CNN and other news organizations tweeted that a journalist was executed in Kabul by Taliban fighters.,99
540,Shepard Smith was fired from Fox News.,99
580,"""While on FAKE NEWS @CNN, Bernie Sanders was cut off for using the term fake news to describe the network. They said technical difficulties!""",99
933,"Javaid comes to General Assignment from the New York Times, where she spent part of 2022 covering the Ukraine war and other news for the Live Desk.",99
1498,Putin is pulling the plug on independent news.,99
1517,"With just one day until Election Day, follow our live coverage to get the latest news and updates on the 2022 midterm elections.",99
1541,"David J. Lynch is a staff writer on the financial desk who joined The Washington Post in November 2017 after working for the Financial Times, Bloomberg News and USA Today.",99
1700,The network's opinion hosts would like to remind the news side who runs the show.,99
1703,Putin's lies about the war depend on a total monopoly on news coverage.,99
3395,Sky News shows how Kyiv looked from space in January 2022 and how it looked in November after shelling of Ukraine's critical infrastructure began,99
4463,"Weekly News Quiz for Students: Ukraine Invasion, C.D.C. Guidelines, Women’s Soccer. Have you been paying attention to the news recently? See how many of these 10 questions you can get right.",99
4505,"Corrections: March 2, 2022. Corrections that appeared in print on Wednesday, March 2, 2022.",99
4561,Ben Franklin’s Vaccine Lessons. And the overnight news from Ukraine.,99
4602,"Corrections: March 4, 2022. Corrections that appeared in print on Friday, March 4, 2022.",99
4645,Several Western news organizations suspend operations in Russia.. BBC and Bloomberg News were among the media outlets that instructed Russia-based reporters to cease news gathering after a new law cracked down on news and free speech.,99
4678,"On ‘S.N.L.,’ Tucker Carlson and Laura Ingraham Make Amends. The episode, hosted by Oscar Isaac, spoofed the Fox News hosts and the former president in a “Ukrainian Invasion Celebration Spectacular.”",99
4740,"Corrections: March 8, 2022. Corrections that appeared in print on Tuesday, March 8, 2022.",99
4747,Two Days of Russian News Coverage: An Alternate Reality of War. To watch news broadcasts of the fighting in Ukraine on the main state channels in Russia is to witness the extent of the Kremlin’s efforts to sanitize its war.,99
4755,"Weekly News Quiz for Students: Ukraine Refugees, State of the Union, ‘The Batman’. Have you been paying attention to the news recently? See how many of these 10 questions you can get right.",99
4758,"The New York Times Pulls Its News Staff From Russia. Other news organizations, like Bloomberg, have suspended their operations in Russia in response to a new law that effectively criminalizes independent reporting.",99
4873,"The New York Times News Quiz, March 11, 2022. Did you follow the news this week? Take our quiz to see how well you stack up with other Times readers.",99
4937,"When You Think About Investing, Don’t Think About the News. Our columnist spoke with a Nobel laureate, Richard H. Thaler, about how to invest for the long run even if the world seems to be going nuts now.",99
4973,"The New York Times launches a Telegram channel to deliver news about the war.. The channel delivers reporting from our continuous live blog, where Times journalists are providing witness accounts, interviews and breaking news from the Russia-Ukraine conflict.",99
4987,Fox News correspondent Benjamin Hall has been injured in Ukraine.. Mr. Hall is a longtime war correspondent who joined the network in 2015.,99
5012,"Weekly News Quiz for Students: Ukraine War, 2020 Census, Pokémon. Have you been paying attention to the news recently? See how many of these 10 questions you can get right.",99
5017,‘Minute-to-Minute Triage’: Weighing News Against Safety in Russia. Western news outlets are engaging in a tense debate over balancing an urgent need to bear witness with journalists’ ability to report freely under strict new laws there.,99
5019,"A Fox News crew in Ukraine was caught in fighting, leaving two journalists dead.. Pierre Zakrzewski, a Fox News cameraman, and Oleksandra Kuvshynova, a Ukrainian journalist, were killed outside Kyiv. A Fox News correspondent, Benjamin Hall, remained hospitalized.",99
5043,"Corrections: March 16, 2022. Corrections that appeared in print on Wednesday, March 16, 2022.",99
5056,A Fox News journalist who was injured in Ukraine is now ‘safe.’. Benjamin Hall was seriously injured in an incident that killed a Fox News cameraman and a young Ukrainian journalist.,99
5123,"The New York Times News Quiz, March 18, 2022. Did you follow the news this week? Take our quiz to see how well you stack up with other Times readers.",99
5220,"Weekly News Quiz for Students: Sunshine Protection Act, Aviation Disaster, Invasive Species. Have you been paying attention to the news recently? See how many of these 10 questions you can get right.",99
5240,"Corrections: March 23, 2022. Corrections that appeared in print on Wednesday, March 23, 2022.",99
5275,"Corrections: March 24, 2022. Corrections that appeared in print on Thursday, March 24, 2022.",99
5404,"The New York Times News Quiz, February 24, 2023. Did you follow the news this week? Take our quiz to see how well you stack up with other Times readers.",99
5546,"India’s Proud Tradition of a Free Press Is at Risk. Self-censorship has spread, along with a shrill Hindu nationalism in news reports that echoes the government line.",99
5699,"Russia Outlaws a News Site and a Rights Group, Stifling Critical Voices. The Kremlin stepped up efforts to banish independent sources of news. Prosecutors labeled Meduza, a popular news site, “undesirable,” so anyone who aids or promotes it can be prosecuted.",99
5710,"Russia cracks down on the free press and outlaws Meduza, a leading independent news site.. The move made Meduza the latest journalistic outlet to fall victim to the Kremlin’s efforts to suppress criticism.",99
5875,"Corrections: Jan. 11, 2023. Corrections that appeared in print on Wednesday, Jan. 11, 2023.",99
5970,The Forces Shaping 2023. We look at seven big news stories from the past 12 months and explain how they could be game changers.,99
5973,"What Happened in 2022? A Look at the Year, in Charts.. Ten charts to recap the trends and main events of 2022.",99
5976,The Great News Quiz of 2022. This was quite a year. How well do you remember it?,99
5978,Pictures of the Year. Some of the most memorable photos published in The Times in 2022.,99
6108,Special End-of-Year 2022 News Quiz for Students. See what you remember about this extraordinary year by taking our special 2022 news quiz.,99
6145,Teenagers in The Times: Fall 2022. Free links to over 75 pieces about young people that have appeared across sections of NYTimes.com since August.,99
6253,"Corrections: Dec. 2, 2022. Corrections that appeared in print on Friday, Dec. 2, 2022.",99
6322,The journalist Marina Ovsianikova published critical messages on social networks after her arrest for breaking into a television news program with a poster rejecting the invasion of Ukraine.,99
6506,"""It’s certainly hard to imagine someone spreading fake news about the death of a child.""",99
6595,The news broadcaster CNN has issued recordings of a Serbian hotel as current recordings from the Russia-Ukraine war.,99
6676,"The online video ""BREAKING NEWS C-RAM Russian & MIG-39 Ukraine""?",99
6677,Image spread fake news about the Russia-Ukraine crisis in a video.,99
7395,China Parries Cyberattack Allegations After News Corp Hack,99
8220,India's Misleading Defense of a News Media Raid,99
9895,Russia’s ‘Breaking’ U.S. Missile News is Two Years Old and Fake,99
