id,claim,desc,truth_value
283,"Russia Takes Censorship to New Extremes, Stifling War Coverage","Contradicting the Kremlin on the war in Ukraine — even calling it a war — is now a crime, prompting independent media to close, and Russia cut off access to Facebook, the BBC and other news sources.",meter-true
284,BBC suspends its operations in Russia after a strict censorship law is passed.,  ,meter-true
285,Wonking Out: Putin’s Other Big Miscalculation,What will isolation do to the Russian economy?,meter-true
286,Volunteer Hackers Converge on Ukraine Conflict With No One in Charge,"The hackers have claimed a number of disruptions over the past week, blurring the lines between amateurs and groups linked to governments.",meter-true
287,Letter From Ukraine: ‘I’m Not Planning to Leave’,A woman in Ukraine and other writers express their horror and discuss how other countries should respond. Also: Anna Netrebko; erectile problems; retirement.,meter-true
288,"With Sanctions, U.S. and Europe Aim to Punish Putin and Fuel Russian Unrest",The Biden administration and European officials are crushing the Russian economy and stirring mass anxiety to pressure President Vladimir V. Putin to end his war in Ukraine.,meter-true
289,Paralympics President Rebukes Russia at Opening Ceremony,"Andrew Parsons denounced Russia’s invasion of Ukraine, a notable act given the International Olympic Committee’s ban on protests and political messages.",meter-true
290,,,meter-true
291,‘I Don’t Want to Be Called Russian Anymore’: Anxious Soviet Diaspora Rethinks Identity,"Immigrants from the former Soviet bloc were never a monolith, but they bonded over shared language and history. Now, they are shifting away from being seen as one group.",meter-true
292,The War in Ukraine Holds a Warning for the World Order,The multinational response shows that liberalism has some life left. But the challenges posed by waning U.S. power and rising authoritarianism remain formidable.,meter-true
293,Ukraine War Forces a Question: How Far East Does Europe Go?,"After Russia invaded, Ukraine asked to join the European Union, quickly. Moldova and Georgia have asked, too. Member states would rather not answer.",meter-true
294,"Russia blocks Facebook inside the country, as the Kremlin moves to stifle dissent.",,meter-true
295,NATO Accuses Russia of Using Cluster Bombs in Ukraine,"Officials made the accusation Friday as part of a display of a unified front in support of Ukraine, but rejected a plea from Kyiv to impose a no-fly zone over its airspace.",meter-true
296,‘I Want Peace.’ Zelensky’s Heroic Resistance Is an Example for the World.,Which world leaders are rising to the challenge?,meter-true
297,"As Russia Pounds Ukraine, NATO Countries Rush In Javelins and Stingers",The American weapons are part of a $350 million package that President Biden authorized on Saturday.,meter-true
298,The Artist Who Painted a City,"As Jesse Marsch takes over Leeds United, he faces the difficult task of replacing Marcelo Bielsa, who was equal parts coach and icon.",meter-true
299,Jewish New Yorkers Unite to Raise Millions for Ukraine,"New York City is home to some 300,000 Jewish immigrants from the former Soviet Union.",meter-true
300,Ukraine’s Call to Arms,Civilians are being armed en masse — and there is no recent precedent.,meter-true
301,,,meter-true
302,The Battle for a Nuclear Plant,The fighting in Ukraine came as the Kremlin stepped up moves to stifle dissent in Russia.,meter-true
303,"In Kyiv’s Railway Station, Rumors, Near-Stampedes and Frustration","As Russian forces begin to encircle the Ukrainian capital, tens of thousands are clambering for a way out that may soon be closed off.",meter-true
304,He Won an Olympic Silver for Ukraine. Now He’s Hiding in a Kyiv Garage.,"At the Beijing Games, Oleksandr Abramenko got a hug from a Russian rival in a photo that went viral. This is the latest photo of him.",meter-true
305,Your Friday Evening Briefing,Here’s what you need to know at the end of the day.,meter-true
306,Combat at Ukraine Nuclear Plant Adds Radioactive Dangers to Russian Invasion,"While Zaporizhzhia appeared secure on Friday, Russia’s seizure of the vast energy production site and potential targeting of another nuclear plant created risks of an accident.",meter-true
307,On the Scene: New York's Russian Enclave,We spoke with residents in one of the largest communities of Russian-speakers in this country about the invasion of Ukraine.,meter-true
308,Republicans Sharpen Their Message on Ukraine,Party leaders think that tying President Biden’s handling of the war to his domestic woes could be a potent argument with voters in the fall.,meter-true
309,Several Western news organizations suspend operations in Russia.,BBC and Bloomberg News were among the media outlets that instructed Russia-based reporters to cease news gathering after a new law cracked down on news and free speech.,meter-true
310,Russians Seize Europe’s Biggest Nuclear Plant and Gain in the South as More Ukrainians Flee,"The Russian military advance in Ukraine sowed more destruction and chaos, pointing to a worsening conflict, as the Kremlin also moved to restrict how it’s reported at home.",meter-true
311,Zelensky criticizes NATO over its rejection of a no-fly zone.,"“All the people who will die from this day will die because of you, as well,” the Ukrainian president told NATO leaders in a video shared on social media.",meter-true
312,,,meter-true
313,China Outlines Plan to Stabilize Economy in Crucial Year for Xi,"China calls for heavy government spending and lending, as its leaders seek to project confidence in the face of global uncertainty over the pandemic and war in Ukraine.",meter-true
314,"Finland, Non-NATO and Nervous, Discusses Defense With Biden","“We usually don’t start wars,” President Sauli Niinisto of Finland said as the leaders spoke amid the war in Ukraine.",meter-true
315,A Paranoid Person’s Guide to Preparing for Digital Danger,Russia’s attack may have you wondering what will happen if the conflict spills into cyberthreats beyond Ukraine’s borders. Here’s what you can do to ease your mind.,meter-true
316,"Too Close to Putin? Institutions Vet Artists, Uncomfortably.","Russia’s invasion of Ukraine has led arts organizations to reconsider who performs, forcing them to confront questions about free speech and policing political views.",meter-true
317,‘I Just Can’t Stand By’: American Veterans Join the Fight in Ukraine,"All across the country, small groups of military veterans are hungry for what they see as a righteous fight to defend freedom against an autocratic aggressor.",meter-true
318,TikTok Is Gripped by the Violence and Misinformation of Ukraine War,The Chinese-owned video app is dealing with a flood of war videos and the question of whether it is spreading unverified information.,meter-true
319,Advertising Acts as Another Vehicle of Protest to Ukraine War,Criticism of Russia has become a common feature of advertisements and the marketing industry.,meter-true
320,"In Ukraine’s West, Lviv Makes Itself a Vital Rear Base","Spared direct attacks so far, the city has become a transit point for thousands of fleeing refugees and for men and supplies headed to the front lines.",meter-true
321,How the West Marshaled a Stunning Show of Unity Against Russia,"In a few frantic days, the West threw out the playbook it used for decades against the Kremlin and isolated Russia with unparalleled sanctions and penalties.",meter-true
322,"While Canada Welcomes Refugees, Its Door Is Far From Wide Open","The war in Ukraine may bring another wave of asylum seekers to Canada, but they will face many controls and restrictions.",meter-true
323,,,meter-true
324,True Stories,Why are so many drama series based on real-life events?,meter-true
325,Here are the latest developments in the Russian invasion of Ukraine.,,meter-true
326,"Brittney Griner, Star W.N.B.A. Center, Is Detained in Russia",Russian customs officials said a U.S. basketball player had vape cartridges containing hashish oil in her luggage. A Russian news agency identified the player as Griner.,meter-true
327,A Welcome Steeped in History: Ukrainian Refugees Arrive in Germany,"Berlin has become a major hub for refugees from Ukraine, welcoming them with an outpouring of help. The response stirs memories of both bright and dark chapters of German history.",meter-true
328,U.S. and Allies Discuss Security of Ukraine’s Leaders Amid Fears for Zelensky’s Safety,Concerns about the line of succession were prompted in part because President Volodymyr Zelensky insists he will not be evacuated.,meter-true
329,"On Ukraine, I Know What I Don’t Know",Sometimes it is better to listen than to speak.,meter-true
330,Putin’s Fear of Free Speech Speaks Volumes,What we are seeing in Russia is a reminder of why protecting free speech is so important.,meter-true
331,Putin Picked the Wrong Country to Mess With,Ukrainians are heroically united in repelling the Russian invasion.,meter-true
332,"Russian Forces Pound Civilians, as Putin Likens Sanctions to a ‘Declaration of War’","Despite a cease-fire, Russia shelled near humanitarian corridors meant for civilians to escape an embattled city, Ukraine says, while the Russian leader also warned about a no-fly zone.",meter-true
333,Israeli prime minister visits Moscow for talks with Putin on Ukraine.,"Prime Minister Naftali Bennett of Israel met for three hours with President Vladimir V. Putin of Russia, the Israeli leader’s office said.",meter-true
334,,,meter-true
335,How to Stop a Nuclear War,It’s often better to constrain yourself than to limit your enemy’s choices.,meter-true
336,The State of Fighting in Ukraine’s Besieged Cities,About two-thirds of Ukraine’s population of 44 million people lived in cities before Russia’s invasion began. Now many urban areas are in the cross-hairs of war.,meter-true
337,U.S. intelligence weighs Putin’s two years of extreme pandemic isolation as a factor in his wartime mind-set.,"Analysts are debating whether the Russian leader’s ambitions and appetite for risk have been altered by his long-held Covid bubble, or by his urgency to secure a legacy, or both.",meter-true
338,"Fast-food chains and food producers stay open in Russia, and mostly quiet about Ukraine.",Many fast-food chains are facing growing pressure on social media platforms and from large investors to halt operations in Russia.,meter-true
339,Blinken Arrives in Poland to Gauge Additional U.S. Aid for Ukraine,The Russian invasion has pushed more than one million refugees to flee Ukraine for neighboring nations.,meter-true
340,"U.S. Officials Travel to Venezuela, a Russia Ally, as the West Isolates Putin","The trip is the highest-level visit by American officials to Caracas in years, driven by a desire to separate Russia from its remaining Latin American allies.",meter-true
341,Mastercard and Visa suspend operations in Russia.,"Russian-issued cards will no longer work in other countries, and purchases from Russian vendors by cardholders in other countries will be cut off.",meter-true
342,Russian Prisoners and Ukrainian Soldiers Describe Two Sides of the Conflict,"The accounts painted a picture of a conflict consisting largely of ambushes, at least in northern Ukraine where the Russian forces are striving to encircle and capture the capital, Kyiv.",meter-true
343,Boris Johnson: 6 Steps the West Must Take to Help Ukraine Right Now,What happens in Europe will have profound implications worldwide.,meter-true
344,The Cancellation of Mother Russia Is Underway,China is the one country that might have the power to stop Putin. ,meter-true
345,,,meter-true
346,"Quotation of the Day: After Zelensky’s Plea, the West Raced to Form a United Front","Quotation of the Day for Sunday, March 6, 2022.",meter-true
347,"On ‘S.N.L.,’ Tucker Carlson and Laura Ingraham Make Amends","The episode, hosted by Oscar Isaac, spoofed the Fox News hosts and the former president in a “Ukrainian Invasion Celebration Spectacular.”",meter-true
348,Here is the latest news about Russia’s invasion of Ukraine.,,meter-true
349,Here’s why Western leaders are reluctant to impose a no-fly zone over Ukraine.,"Enforcing a ban on aircraft could draw more countries into conflict against Russia and set off “a full-fledged war in Europe,” NATO’s leader has warned.",meter-true
350,The Week in Business: Guns vs. Economic Sanctions,"U.S. employers added 678,000 jobs in February, a strong gain. President Biden unveiled a new coronavirus defense strategy. And we’re about to hear how much prices rose in February.",meter-true
351,Police and the Alternatives,"Murders have spiked in the U.S., and experts say a mix of solutions works best.",meter-true
352,What We Know About Brittney Griner’s Release From Russia,The W.N.B.A. star had been detained in Russia on drug charges for nearly 10 months before she was released in a prisoner swap on Thursday.,meter-true
353,"On Ukraine’s Border, Moldovans Wonder: Where Will Putin Stop?","Moldovans fear that Transnistria, a region run by Russia-backed separatists in eastern Moldova, might be the next target after Ukraine.",meter-true
354,‘Falling Into Emptiness’: Ukrainian Families Feel the Pain of Separation,"With most Ukrainian men legally prohibited from leaving Ukraine, the international border gates serve as a painful filter, splitting families as women and children move on.",meter-true
355,"Police arrest more than 3,000 people as protests grow across Russia.",An activist group that tracks protests found demonstrations in nearly 50 cities on Sunday.,meter-true
356,,,meter-true
357,Ukrainians Find That Relatives in Russia Don’t Believe It’s a War,Many Ukrainians are encountering a confounding and frustrating backlash from family members in Russia who have bought into the official Kremlin messaging.,meter-true
358,U.S. lawmakers say they are largely opposed to a no-fly zone over Ukraine.,"Members of both parties said such a move would risk drawing the United States into a conflict with Russia, another nuclear power.",meter-true
359,"Pressed About Putin, Russian Conductor Quits Bolshoi and French Posts","The Bolshoi music director, Tugan Sokhiev, said he was “asked to choose one cultural tradition” over another and denounce President Putin for invading Ukraine.",meter-true
360,"For German Firms, Ties to Russia Are Personal, Not Just Financial",The economic fallout from Russia’s invasion of Ukraine is only part of the pain for German companies.,meter-true
361,TikTok suspends livestreaming and new uploads from Russia.,Millions of people have turned to TikTok for live updates from Ukraine.,meter-true
362,What Is NATO and Which Countries Are Members?,"This Western mutual-defense alliance, which recently said it would increase the number of troops on standby, is central to the war in Ukraine, even though Ukraine is not a member.",meter-true
363,Gas Prices in U.S. Climb Above $4 a Gallon,"The national average price on Sunday was $4.009 a gallon, approaching a record set in 2008.",meter-true
364,Your Monday Briefing: Russian Forces Attack Evacuees,Plus China’s new economic plan and updates on an attack on a Pakistani mosque.,meter-true
365,"Arming Ukraine: 17,000 Anti-Tank Weapons in 6 Days and a Clandestine Cybercorps","The United States has walked to the edge of direct conflict with Russia in an operation that is reminiscent of the Berlin airlift of 1948-49, but far more complex.",meter-true
366,Oil Prices Jump as U.S. Discusses Russian Import Ban,"The cost of Brent crude, the international benchmark, was trading at about $129 a barrel on Monday.",meter-true
367,,,meter-true
368,Proud Band of Ukrainian Troops Holds Russian Assault at Bay — for Now,"“Few expected such strength from our people,” said a Ukrainian colonel whose soldiers have repelled a Russian attack on the port city of Mykolaiv for three days.",meter-true
369,"Russia Keeps Up Attack, Again Halting Evacuation of Ukrainian Port City","An encircled Mariupol faced intense shelling, while Russian forces kept up their slow advance on Ukraine’s capital, Kyiv.",meter-true
370,Your Monday Briefing,A renewed attack by Russia.,meter-true
371,Balenciaga Goes Where Fashion Hasn’t Dared Go Before,"In the show of the season, the brand takes on the war in Ukraine. Valentino embraces love. And Givenchy buckles down.",meter-true
372,‘Putin Will Not Lose. He’s Not Going to Let That Happen.’,"Whether the Russian leader wins this war or loses it, Europe is in trouble.",meter-true
373,Car Industry Woes Show How Global Conflicts Will Reshape Trade,"The war in Ukraine has highlighted the risks of doing business with authoritarian countries — not just Russia, but also China.",meter-true
374,"For a Russian Journalist, the Family Trade Is Dissidence",Four generations of Zoya Svetova’s family have stood up to repression. The invasion of Ukraine has shaken them but also given them reasons for hope.,meter-true
375,Ukraine Is a Test We Cannot Fail,"We need to make it clear to Vladimir Putin that he will never, ever win this war.",meter-true
376,Italian City Tied to Russia by a Revered Saint Feels the Sting of War in Ukraine,The port of Bari holds relics venerated by Orthodox Christians throughout the former Soviet bloc. Today it is also home to a spillover of tensions from Russia’s invasion.,meter-true
377,This Price Surge Really Hits New Yorkers Hard,"Rents are spiking in the city, especially in wealthier neighborhoods, where they have gone up by 40 percent.",meter-true
378,,,meter-true
379,"‘No Wavering’: After Turning to Putin, Xi Faces Hard Wartime Choices for China",Beijing aligned itself with Putin as Russia prepared to invade Ukraine. Now its efforts to edge away are constrained by leadership politics.,meter-true
380,On the Road With Ukraine’s Refugees,We report alongside Ukrainians making their escape from Russia’s increasingly brutal invasion.,meter-true
381,Here are the latest developments in Ukraine.,,meter-true
382,Preventing This War,What might have done it?,meter-true
383,FIFA Will Allow Foreign Players in Russia to Break Contracts,"The move announced Monday is temporary, but it will free about 100 players to seek new teams for the rest of the season.",meter-true
384,"As Oil Goes Up, Stocks Go Down",Climbing energy prices are roiling markets.,meter-true
385,Hate for Putin’s Russia Consumes Ukraine,"Much of the bitterness is directed at President Vladimir V. Putin, but Ukrainians also chastise ordinary Russians, calling them complicit.",meter-true
386,Stocks extend their rout as the Ukraine war and its economic fallout intensify.,The S&P 500’s drop was its sharpest since October 2020. The tech-heavy Nasdaq composite is down 20 percent from its November record.,meter-true
387,Ukraine takes its case against Russia to the U.N.’s highest court.,The head of the Ukrainian delegation told the court that “millions are in danger” and accused Moscow of defiling the Genocide Convention.,meter-true
388,Ukraine Asks for Injuction at United Nation’s Highest Court,"Ukraine’s representative told judges at the International Court of Justice that “the court has a role” in stopping Russia, as he urged them to issue an injunction demanding that Russia end its invasion of Ukraine.",meter-true
389,,,meter-true
390,"These Refugees Can’t Stay in Denmark, but They Can’t Be Sent Home",Dozens of Syrian asylum seekers are stuck in limbo after the Danish authorities decided it was safe for them to go back home and stripped their residency permits.,meter-true
391,"Ukrainian forces have repelled another Russian assault on Mykolaiv, officials say.","As the opposing armies fought outside the strategic port city near the Black Sea, residential areas within Mykolaiv came under intensifying Russian rocket and artillery fire.",meter-true
392,A Quebec restaurant that claimed to invent poutine rebrands to rebuke Putin (Poutine in French).,Protest against the war in Ukraine has a new cultural front — food and drink names — as people across the world show solidarity with Ukraine by renaming or boycotting Russian-made products.,meter-true
393,A Ukrainian Family Killed While Fleeing,“Do we have the courage to stop Vladimir Putin?” a reader asks. Others discuss sanctions and censorship. Also: Pregnant at work; truly seeing; “unbecoming” women.,meter-true
394,"Russia, Blocked From the Global Internet, Plunges Into Digital Isolation","Russian authorities and multinational companies have erected a digital barricade between the country and the West, erasing the last remnants of independent information online.",meter-true
395,"With New Limits on Media, Putin Closes a Door on Russia’s ‘Openness’","The Russian leader is undoing the social freedoms introduced at the end of the Soviet Union, risking a return to total control and ideological isolation.",meter-true
396,Metropolitan Opera Will Host Concert in Support of Ukraine,"“We want Putin to know he is the enemy of artists and that we are united against his horrific actions,” the company’s general manager said.",meter-true
397,"Again and Again, Literature Provides an Outlet for the Upended Lives of Refugees",The current flood of refugees from Ukraine is a reminder of how much of literature is fueled by such crises and their aftermaths.,meter-true
398,Your Tuesday Briefing: Russia escalates attacks on civilians,Plus new research warning of a drier Amazon and Xi’s relationship with Putin.,meter-true
399,"Baltics, in Russia's Shadow, Demand Tougher Stance From West","“We have no illusions about Putin’s Russia anymore,” said one Baltic official in a meeting with the U.S. secretary of state.",meter-true
400,,,meter-true
401,The letter ‘Z’ has become a symbol for Russians who support the invasion of Ukraine.,"The letter, painted on Russian military vehicles, is suddenly ubiquitous in Russia, prompting talk of a Kremlin public relations campaign.",meter-true
402,"Once Victims in Southeast Europe, Jews Come to Aid Fleeing Ukrainians","Today, as in the early 1900s, Jews are once again escaping violence in southeast Europe. But the context is radically different — cathartically so for the many Israelis who have come here to join the relief effort.",meter-true
403,Why China Can’t Bail Out Putin’s Economy,"No, the Chinese can’t protect Russia from sanctions.",meter-true
404,Your Monday Evening Briefing,Here’s what you need to know at the end of the day.,meter-true
405,U.S. Weighs Russian Oil Ban as Gas Prices Surge and Ukraine War Grows,"Global stocks dipped on Monday as U.S. officials discussed an oil cutoff, and gas prices hit a national average above $4, up more than 10 percent in a week.",meter-true
406,Fleeing Civilians Under Fire,Fears are growing for Ukrainians trapped in besieged cities.,meter-true
407,Humanitarian Crisis Worsens for Ukrainians Trapped in Russia’s Onslaught,"Two weeks after the invasion began, tens of thousands of Ukrainians are without food, water or power. The Russians are increasingly resorting to indiscriminate shelling to help their forces advance.",meter-true
408,War in Ukraine Rallies Support in Congress for More Military Spending,A bipartisan consensus in Congress to increase the Pentagon’s budget is growing stronger as Russia’s invasion of Ukraine has created a sense of insecurity.,meter-true
409,Climate Hawks Join the Debate on Ukraine,Environmentalists say now is the time to choke off Russia’s oil and gas profits. But the White House has difficult choices to make.,meter-true
410,"As Russia’s Military Stumbles, Its Adversaries Take Note","President Vladimir Putin could still reduce cities in Ukraine to rubble, officials say. But European countries say they are not as intimidated by Russian ground forces as they were in the past.",meter-true
411,,,meter-true
412,"Zelensky addressed Ukraine from his office, showing that he remained in Kyiv.",The Ukrainian president told his people that he was not afraid or in hiding.,meter-true
413,Your Tuesday Briefing,An intensifying humanitarian crisis in Ukraine.,meter-true
414,I Left Ukraine 20 Years Ago. But It Never Left Me.,"Departure, however final it seems, is not forever.",meter-true
415,Seth Meyers Skewers Trump for a ‘Looney’ Idea on Russia,Meyers said the former president’s suggestion that the U.S. paint Chinese flags on planes and bomb Russia was “a slightly stupider version of Bugs Bunny dressing up as a sexy lady to distract Elmer Fudd.”,meter-true
416,"For this border crisis, Poles extend a warm welcome, unlike last time.","Hundreds of thousands of Polish families have opened their homes to refugees from Ukraine, a sharp contrast to the country’s response to a different crisis last fall at the border with Belarus.",meter-true
417,"Corrections: March 8, 2022","Corrections that appeared in print on Tuesday, March 8, 2022.",meter-true
418,"Rising Gas Prices Have Drivers Asking, ‘Is This for Real?’","The average price of a gallon of gasoline is up more than 10 percent in the last week, leading some consumers to rethink their routines and spending.",meter-true
419,The Future Turns Dark for Russia’s Oil Industry,An exodus by Western companies and disdain for Russian oil signal the start of a reckoning.,meter-true
420,Fiona Hill on the War Putin Is Really Fighting,"A discussion on the Russian president’s motivations, the West’s response and how the conflict could play out.",meter-true
421,How the U.S. Can Help Refugees (and Weaken Vladimir Putin),Opening our doors would ease the suffering caused by Vladimir Putin’s invasion and strengthen our position against him.,meter-true
422,,,meter-true
423,New York’s Russian Restaurants Feel War’s Impact,"Most owners are antiwar, and many of them are from Ukraine. But customer numbers are down all the same.",meter-true
