id,claim,desc,truth_value
703,"He’s American, He Oversees Papa John’s in Russia and He’s Staying","Christopher Wynne’s company controls the franchise agreements for the 190 Papa John’s locations in the country. “At the end of the day, they appreciate a good pizza,” he said.",meter-true
704,Kyiv’s Once-Busy Streets Empty as Russia Targets Capital,"With civilian areas coming under fire and an estimated half the population having fled, the avenues of the Ukrainian capital, under siege by Russian forces, are almost deserted.",meter-true
705,Diplomacy Quickens to Halt Ukraine War or Stop Its Expansion,"Ukraine and Russia held a new round of talks and agreed to resume them on Tuesday, as the United States warned China about helping an increasingly isolated Kremlin and expanding the conflict.",meter-true
706,How Not to Have a Putin Recession,The Fed should keep calm and carry on.,meter-true
707,How a Murdoch Hopes to Save American Democracy,Kathryn Murdoch is trying to change how elections are run. It’s a work in progress.,meter-true
708,,,meter-true
709,Russian Mogul Is Charged With Donating Illegally to U.S. Campaigns,Andrey Muraviev was indicted on charges of making donations as a foreign national to boost licensing decisions for a marijuana business.,meter-true
710,Russia Deploys a Mystery Munition in Ukraine,"Iskander-M short-range ballistic missiles are releasing a previously unknown decoy designed to evade air-defense systems, an American official said.",meter-true
711,Zelensky calls on Russian troops to surrender.,The Ukrainian leader and the Pentagon have both said some Russian soldiers have surrendered or been captured.,meter-true
712,Here are the latest developments in Ukraine.,,meter-true
713,"Daniil Medvedev Loses a Match and No. 1 Ranking, but Faces Bigger Concerns","At Indian Wells, the Russian fell in the third round to Gael Monfils of France, as Medvedev faced criticism that Russian players should not be competing because of Putin’s invasion of Ukraine.",meter-true
714,Your Tuesday Briefing,Attacks on Kyiv.,meter-true
715,Attack Hits Kyiv Neighborhood,"An explosion rocked a residential neighborhood in Kyiv, killing one and injuring six. It was the second attack on a civilian area in the Ukrainian capital on Monday.",meter-true
716,A Chinese video blogger in Odessa challenges Beijing’s version of the war.,"Wang Jixian has become one of the boldest voices confronting the Chinese state-controlled media’s narrative, drawing hundreds of thousands of viewers.",meter-true
717,"Ukraine’s Refugee Crisis Is Unprecedented. The Response Must Be, Too.",History shows that sympathy for refugees can be fleeting.,meter-true
718,Timothy Snyder on the Myths That Blinded the West to Putin’s Plans,"The renowned historian on Putin’s myths, Ukrainian identity and the West’s “politics of inevitability.”",meter-true
719,,,meter-true
720,We Were Worried About Inflation. Then Russia Invaded Ukraine.,The Federal Reserve has to juggle conflicting goals of taming inflation and sustaining growth.,meter-true
721,Impunity for War Crimes in Syria Casts a Grim Shadow Over Ukraine,"Syria, with Russian support, used many of the brutal tactics now seen in Ukraine — and its dictator stayed in power. That conflict offers lessons for Russia’s leader, analysts say.",meter-true
722,The Story Behind a Defining War Photo,"Lynsey Addario, a photojournalist, took an image that captured the new reality of the fighting in Ukraine.",meter-true
723,The Latest Covid Surge,A new version of Omicron and Hong Kong’s rising death toll.,meter-true
724,Transcript: Ezra Klein Interviews Timothy Snyder,A conversation with historian Timothy Snyder.,meter-true
725,Prepare for Interest Rate Liftoff,How high will the Fed go?,meter-true
726,Airline Ticket Sales Exceed a 2019 Milestone for the First Time,"February bookings for U.S. travel beat those preceding the pandemic, a data analysis found. Summer looks promising for the industry, if fuel costs cooperate.",meter-true
727,"Weekly News Quiz for Students: Ukraine War, 2020 Census, Pokémon",Have you been paying attention to the news recently? See how many of these 10 questions you can get right.,meter-true
728,India says it’s in talks with Russia about increasing oil imports.,"The move comes as New Delhi is striving to preserve its relationship with Moscow, its biggest supplier of weapons, at a time when India faces an aggressive China.",meter-true
729,California Lawmakers Have Solved Berkeley’s Problem. Is CEQA Next?,"A legislative fix helps the university avoid an enrollment freeze, but calls persist for an overhaul of a decades-old environmental law.",meter-true
730,,,meter-true
731,The Road Ahead for the Democrats: Here Are Some Directions,"As the Democrats seek a sharper message, readers have some ideas. Also: The world must act in Ukraine; encourage parents.",meter-true
732,The U.K. targets more oligarchs and Putin allies with sanctions.,"More than 370 people are being penalized, including Russia’s prime minister, a former president and the Kremlin’s press secretary.",meter-true
733,‘Minute-to-Minute Triage’: Weighing News Against Safety in Russia,Western news outlets are engaging in a tense debate over balancing an urgent need to bear witness with journalists’ ability to report freely under strict new laws there.,meter-true
734,Global Economy Sinks Deeper Into Turmoil as Fed Prepares to Raise Rates,"Federal Reserve officials are set to raise interest rates to control inflation, but the return to normal they had hoped to see remains painfully elusive.",meter-true
735,"A Fox News crew in Ukraine was caught in fighting, leaving two journalists dead.","Pierre Zakrzewski, a Fox News cameraman, and Oleksandra Kuvshynova, a Ukrainian journalist, were killed outside Kyiv. A Fox News correspondent, Benjamin Hall, remained hospitalized.",meter-true
736,‘I’m Not Scared of Anything’: Death and Defiance in a Besieged Ukrainian City,The port city of Mykolaiv is being shelled by Russian forces every day. Bodies are piled at the morgue. But residents refuse to succumb.,meter-true
737,The war in Ukraine is raising fears of a recession in Germany.,"Uncertainty looms for German business leaders, who worry that the war could upend their country’s globalized, export-focused economy.",meter-true
738,"Review: With Anthems and Flags, the Met Opera Plays for Ukraine","A concert to benefit relief efforts featured a young Ukrainian singer, Beethoven’s “Ode to Joy” and the Met’s prima donna of the moment.",meter-true
739,Music’s Messy Digital Revolution,"Streaming services bring in steady cash for the music industry, but sales are down and many artists feel left out.",meter-true
740,Can Germany Break Up With Russian Gas?,When a small import threatens to become a big problem.,meter-true
741,,,meter-true
742,Zelensky’s appeal to Canada: Imagine if Toronto were Kyiv.,The Ukrainian president’s emotional speech to Canadian lawmakers underscored how he has increasingly cast himself as a spokesman for liberal democracy.,meter-true
743,Ukraine’s National Anthem Reverberates Around the World,"“Ukraine’s glory hasn’t perished,” begins the anthem, which is being played by orchestras worldwide as a sign of solidarity with Ukraine.",meter-true
744,Officials in Mariupol struggle to account for the dead.,"The coastal city, a battleground for weeks, is under an increasingly relentless Russian assault that is taking an unspeakable toll.",meter-true
745,Russian Artists Lose the Tools of Their Trades as Companies Pull Out,"Creative professionals have been cut off from Western clients and from the products and services they use to make, market and get paid for their work.",meter-true
746,Biden will travel to Europe next week for an extraordinary NATO meeting.,"The president will travel to Brussels for the NATO session, and will also attend a European Union summit meeting.",meter-true
747,"Ukraine War Shifts the Agenda in Congress, Empowering the Center","With a crisis rocking Europe, the left is shelving demands for defense cuts and a swift end to fossil fuels, while on the right, Trump-era foreign policy and criticism of Ukraine are fading.",meter-true
748,"Dollars or Rubles? Russian Debt Payments Are Due, and Uncertain.","Citing sanctions, the Russian government warned it might pay foreign debt obligations in rubles. Credit rating agencies say a default is imminent.",meter-true
749,A Russian TV worker who protested the war on a live broadcast is fined.,"In a video following her sentence, the state TV worker said she had been interrogated for 14 hours and “spent two days without sleep.” She still faces a lengthy prison sentence.",meter-true
750,"On a trip shrouded in secrecy, 3 European leaders travel to Kyiv to offer support.","“It is here, in war-torn Kyiv, that history is being made,” one European leader wrote after arriving in Ukraine’s battered capital.",meter-true
751,Russian State Television Worker Charged for Anti-War Protest,"Marina Ovsyannikova, who worked for Channel 1 in Moscow, could face 15 years in prison for protesting Russia’s invasion of Ukraine during a live broadcast.",meter-true
752,,,meter-true
753,Scenes from the Resistance,Mykolaiv is under daily attack but its residents refuse to succumb.,meter-true
754,Your Wednesday Briefing: E.U. Leaders Visit Kyiv,Plus the ripple effects of China’s surge of Covid cases and a once-perilous road in Afghanistan.,meter-true
755,Your Tuesday Evening Briefing,Here’s what you need to know at the end of the day.,meter-true
756,The Sounds of Ukrainian Pop,"A conversation about some of the country’s stars, the musical traditions they work within and how they have grappled with the war.",meter-true
757,European Leaders Brave Russian Bombardment in Visit to Kyiv,"The prime ministers of Poland, the Czech Republic and Slovenia made the trip as a show of solidarity, but it also bared divisions with other European Union members.",meter-true
758,This Is How World War III Begins,Why Putin is likelier to double down than he is to cut his losses. ,meter-true
759,"In the War Over Ukraine, Expect the Unexpected",Wars bring out the best and the worst of humanity. Surprises are the only constant.,meter-true
760,Republican in Ohio Senate Primary Spoke Offensively About Asians,"Mike Gibbons, a leading contender to succeed Senator Rob Portman, made the comments in a 2013 podcast on doing business in China.",meter-true
761,Zelensky urges more leaders to visit Kyiv after a visit by prime ministers of 3 NATO nations.,"The leaders from Poland, the Czech Republic and Slovenia “fear nothing,” President Volodymyr Zelensky said, and he urged other leaders to make similar visits.",meter-true
762,"Corrections: March 16, 2022","Corrections that appeared in print on Wednesday, March 16, 2022.",meter-true
763,,,meter-true
764,Russians Must Accept the Truth. We Failed.,Now we must bear that failure.,meter-true
765,Refugee Crisis Will Test a European Economy Under Pressure,"Resettling the refugees fleeing Ukraine could cost $30 billion in the first year alone, and the permanent integration of millions of people would reshape Europe’s economy.",meter-true
766,Your Wednesday Briefing,A clandestine visit by European leaders to Ukraine.,meter-true
767,Putin Is ‘High Off His Own Propaganda Supply’,Peter Pomerantsev discusses the Kremlin’s war on information.,meter-true
768,"‘We Want People That Are Going to Fight the Left,’ Says the Man Out-Trumping Trump",Ron DeSantis might well match or exceed the former president as liberals’ worst nightmare.,meter-true
769,Will the Ukraine War End the Age of Populism?,Populism’s poor fit for this particular moment has given an opportunity to its enemies and critics.,meter-true
770,"Citing a Chevron Tanker, Ukraine Seeks Tougher Restrictions at Russian Ports",A top Ukrainian official criticized companies in the United States and Greece for helping Russia continue to profit from oil despite its attack on Ukraine.,meter-true
771,Imagining Peace in Ukraine,Is it possible? And what could it look like?,meter-true
772,A Question of Default,Russian debt faces an uncertain future.,meter-true
773,Putin’s War on Ukraine Is About Ethnicity and Empire,"Biden’s framework of ‘democracies versus autocracies’ misses the darker source of this war, which has deep roots in Russian history and thought.",meter-true
774,,,meter-true
775,"Ruthless Russia, Brave Ukraine: Reflections on the War, 3 Weeks In",Sampling the outpouring of reaction to “Russia’s murderous assault on Ukraine.”,meter-true
776,"As Russia Digs In, What’s the Risk of Nuclear War? ‘It’s Not Zero.’",A series of shifts in Russian statements about using nuclear weapons has led some analysts to believe that the Kremlin sees a nuclear exchange as a viable strategy.,meter-true
777,A Fox News journalist who was injured in Ukraine is now ‘safe.’,Benjamin Hall was seriously injured in an incident that killed a Fox News cameraman and a young Ukrainian journalist.,meter-true
778,Boris Johnson travels to Saudi Arabia for oil diplomacy.,"At home, critics had another take on Mr. Johnson’s efforts to reduce western reliance on Russian energy.",meter-true
779,What a Federal Reserve Rate Increase Means for You,"Rates on credit cards, savings accounts and different kinds of loans move when the Fed changes its benchmark rate. Here’s what you need to know.",meter-true
780,U.S. Casts a Global Net to Stop Shipments to Russia,"To try to halt the war in Ukraine, the U.S. and its allies have imposed the most sweeping export controls seen in decades on Russia. Now they have to enforce them.",meter-true
781,Biden announces $800 million in military aid for Ukraine.,"President Biden’s announcement came hours after Ukraine’s president, Volodymyr Zelensky, delivered a virtual address to Congress and pleaded for more help in defending against Russia’s invasion.",meter-true
782,"A Russian Ballet Star, Opposed to the Ukraine War, Quits the Bolshoi","Olga Smirnova said she was against the war in Ukraine “with all the fibers of my soul.” Now, she has joined the Dutch National Ballet.",meter-true
783,"In ‘Lessons From the Edge,’ How an Ambassador to Ukraine Became a Casualty of the Trump Administration",Marie Yovanovitch recounts her career in public service and the experience of testifying during President Trump’s first impeachment.,meter-true
784,The U.S. Is the Only Sanctions Superpower. It Must Use That Power Wisely.,Overreach could be disastrous.,meter-true
785,,,meter-true
786,"Putin Assails Russians Who Back the West, Signaling More Repression","President Vladimir V. Putin of Russia denigrated European and American leaders, and Russians who disagreed with him. Analysts fear his remarks could signal a new wave of repression.",meter-true
787,Will the Fed Cause a Recession?,Here’s an argument against aggressively raising interest rates to stop inflation.,meter-true
788,Volkswagen eyes U.S. market as war in Ukraine disrupts European production.,"Focusing on electric vehicles, Volkswagen aims for growth in North America, though it could face tough competition.",meter-true
789,Russia’s Attack Rallies a Divided Nation: The United States,"Americans across the political spectrum express broad support for Ukraine, though opinions diverge on what that means and how far the U.S. response should go.",meter-true
790,Zelensky’s Emotional Appeal to Congress,"President Volodymyr Zelensky of Ukraine gave a searing speech to a joint meeting of Congress, an extraordinary address by a leader under assault by a hostile foreign power.",meter-true
791,Your Thursday Briefing: Zelensky Speaks to Congress,Plus an offshore earthquake in Japan and mass graves in Syria.,meter-true
792,The W.H.O. puts off assessing Russia’s Sputnik vaccine because of the war in Ukraine.,"An official with the World Health Organization said “the assessment, along with inspections, have been affected.”",meter-true
793,Zelensky’s Plea to Congress,Biden announced $800 million in new military aid to Ukraine.,meter-true
794,Your Wednesday Evening Briefing,Here’s what you need to know at the end of the day.,meter-true
795,Annotated Transcript: Zelensky’s Speech to Congress,President Volodymyr Zelensky of Ukraine addressed a joint meeting of the House and Senate to press his case for more aid to Ukraine amid devastating attacks by Russia.,meter-true
796,,,meter-true
797,What the Ukraine War Means for the Future of Climate Change,European leaders are realizing they can no longer depend  on Russian fossil fuels. But whether renewable energy fills the gap is an open question.,meter-true
798,"As Russian Troop Deaths Climb, Morale Becomes an Issue, Officials Say","More than 7,000 Russian troops have been killed in less than three weeks of fighting, according to conservative U.S. estimates.",meter-true
799,"Invoking America’s Darkest Days, Zelensky Pleads for More U.S. Aid",President Volodymyr Zelensky of Ukraine called for a no-fly zone and more weapons to combat Russia’s assault and implored President Biden to be “the leader of peace.”,meter-true
800,Teaching Resources to Help Students Make Sense of the War in Ukraine,"Articles, maps, photos, videos, podcasts and more, as well as suggestions for using them in your classroom.",meter-true
801,"Biden calls Putin a ‘war criminal,’ in his latest verbal escalation against Russia.",The U.S. president’s unscripted remarks echoed comments other American officials have made recently.,meter-true
802,U.S. Adds ‘Kamikaze Drones’ as More Weapons Flow to Ukraine,NATO allies are focused on providing Kyiv with high-tech defensive weapons that are easy to use and move.,meter-true
803,What Is Our Moral Obligation in Ukraine?,The U.S. should supply aid to Ukraine. But we must be more consistent in determining who deserves humanitarian intervention.,meter-true
804,Your Thursday Briefing,More U.S. military aid for Ukraine.,meter-true
805,A Russian Rapper Brings His Banned Antiwar Message to Istanbul,"The rapper, Oxxxymiron, said proceeds from his show would go to help Ukrainian refugees. Russians at the concert denounced the war but said they felt helpless to stop it.",meter-true
806,"Trevor Noah: Addressing Congress, Zelensky ‘Knew His Audience’","Ukraine’s president must have researched American history before his speech, said Noah (who speculated about how it “could have gone very wrong”).",meter-true
807,,,meter-true
808,Where Does American Democracy Go From Here?,,meter-true
809,Russia Is Destroying Kharkiv,Residents describe what has been lost after three weeks of attacks.,meter-true
810,‘They’re Willing to Risk Ruining Their Lives.’ Putin’s War Is Driving Russians Out.,Russia is witnessing its greatest mass exodus since the revolution.,meter-true
811,"In Some Parts of the World, the War in Ukraine Seems Justified","In countries friendly toward Russia, people are troubled by the war and loss of life, but some say they think that Putin has a point.",meter-true
812,Inflation vs. Recession: The Fed Is Walking a Tightrope,"American consumers already have high inflation. Because of the oil price shock and Russia’s war, the odds of a recession have increased, too.",meter-true
813,UNESCO will send body armor to Ukrainian journalists.,The U.N. agency said thousands of Ukrainian journalists with no protective equipment or training were now covering the war. At least four journalists have been killed.,meter-true
814,Four Paths Forward in Ukraine,"How might the war in Ukraine unfold in the coming weeks or, potentially, months?",meter-true
815,A City Under Siege,"We give you a rare dispatch from Mariupol, Ukraine.",meter-true
816,"Amid Invasion of Ukraine, I.R.S. Aims to Police Oligarch Sanctions","It wants to add agents to a 3,000-person investigations unit to help crack down on attempts by Russian oligarchs to evade sanctions.",meter-true
817,Russia appears to have avoided default as it makes a $117 million bond payment.,"Sanctions have isolated the country financially, driven down the value of the ruble and cut off Moscow’s access to about half its foreign currency reserves.",meter-true
818,,,meter-true
819,Will Inflation Fix Itself?,That appears to be what the Federal Reserve is counting on.,meter-true
820,The Bank of England raises rates again in a bid to corral inflation.,"The bank on Thursday lifted its key interest rate to 0.75 percent, the third consecutive increase.",meter-true
821,War Strands Ukrainian and Russian Tourists Together in Egyptian Resorts,"The tension in hotels and on Red Sea beaches is palpable, though there are also moments of compassion.",meter-true
822,What’s Going On in This Graph? | Refugees From Ukraine,"Since the start of the Russian invasion of Ukraine on Feb. 24, 2022, almost three million of the country’s 44 million residents have left the country. How big is this crisis?",meter-true
823,Some of the Tech Magic Is Gone,"The bubble hasn’t exactly burst, but we’re no longer seeing a fantastical belief in the power of technology.",meter-true
824,Zelensky’s Powerful Plea to Congress,Readers react to President Volodymyr Zelensky’s speech and urge a no-fly zone in Ukraine. Also: Violence against Asian Americans; daylight saving time.,meter-true
825,"Why Arnold Schwarzenegger taped an impassioned video to Russia, telling Putin: ‘Stop this war.’","The movie star and former governor of California addressed Russians and Russian soldiers, saying, “ “your lives, your limbs, your futures are being sacrificed for a senseless war.”",meter-true
826,Countries previously hostile to refugees embrace Ukrainians.,"While the warm welcome has been applauded, some human rights advocates point to a humanitarian double standard when it comes to refugees from the Middle East and Africa.",meter-true
827,Review: ‘The Medium’ Is Less a Message and More a Museum Piece,"This early 1990s play, based on the life of Marshall McLuhan, is being revived by the company that created it.",meter-true
828,L.G.B.T.Q. activists in Ukraine share the fight against Russia’s invasion.,"A pro-Russian puppet government would be less supportive of gay rights, the activists say, and incidents of discrimination would be likely to rise, as they have in Russian-backed separatist regions.",meter-true
829,,,meter-true
830,"Riding High in the Polls, an Aloof Macron Steps Into the Election Fray",The Ukraine war has given the French leader a strong edge and few reasons to engage with his political opponents. He held a news conference to quell criticism that he is avoiding debate.,meter-true
831,House Votes to Suspend Normal Trade Relations With Russia,"The bill, which still needs Senate approval, is the latest in a series of measures that lawmakers have passed to support Ukraine and punish Russia for its invasion.",meter-true
832,A Show About European Identity Opens With a Backdrop of War,Jasmina Cibic’s new exhibition explores the theatricality of nation building in Europe. She didn’t expect it to have such immediate contemporary relevance.,meter-true
833,Your Friday Briefing: The Destruction of Ukraine,Plus South Korea’s new approach to the virus and Cambodia’s crackdown on opposition leaders.,meter-true
834,What Has Been Lost in Kharkiv,Russian forces are destroying Ukraine’s second-largest city.,meter-true
835,Republicans Once Silent on Russia Ratchet Up Attacks on Biden,"Even as they praise the bipartisan congressional response to Russia’s invasion of Ukraine, Republicans are increasingly eager to blame President Biden for the devastation.",meter-true
836,Four Opinion Writers on the War: ‘Putin’s Final Cards Are Very Far From Played’,"Lulu Garcia-Navarro, Michelle Goldberg, Bret Stephens and David Brooks discuss the latest developments in Russia’s Ukraine war.",meter-true
837,Your Thursday Evening Briefing,Here’s what you need to know at the end of the day.,meter-true
838,"Survivors Emerge From a Bombed Theater, but Ukraine’s Suffering Grows","Russia continues to devastate cities and hit civilians, as Ukrainian forces strike back and peace talks drag on.",meter-true
839,Why Vladimir Putin Invokes Nazis to Justify His Invasion of Ukraine,The language of Russia’s invasion has been dominated by the word “Nazi” — a puzzling assertion about a country whose leader is Jewish.,meter-true
840,,,meter-true
841,Another Dictator Is Having a Bad Year,Covid is becoming China’s equivalent of Ukraine.,meter-true
842,Yuri Milner’s Russian Clapback,A Russian-born tech titan takes a bold stance against his birth country’s pummeling of Ukraine.,meter-true
843,Climate Activists Flex Their Political Muscle,Environmental groups want Democrats to confront oil companies over high gas prices. And Democrats are listening.,meter-true
844,"U.S. Will Punish China if It Gives Military Aid to Russia, Blinken Says","President Biden plans to talk on Friday with Xi Jinping, who has a close partnership with Vladimir V. Putin and supports him in the Ukraine war.",meter-true
845,Sanctions against Russia may cost BNY Mellon $200 million this year.,"BNY Mellon has ceased new business in Russia and has “suspended investment management purchases of Russian securities,” it said.",meter-true
846,"By Labeling Putin a ‘War Criminal,’ Biden Personalizes the Conflict",President Biden’s visceral reaction to the horrifying images coming out of Ukraine also reflects a broader effort to isolate the Russian leader.,meter-true
847,"U.S. Calls Putin a ‘War Criminal,’ but Consequences Are Unclear","A day after President Biden’s remark, Secretary of State Antony Blinken said he agreed. Experts warned of hurdles to a successful prosecution.",meter-true
848,"Kids, Covid Isolation and Learning to Endure","The virus found us, and we’re doing just fine. I think.",meter-true
