,Link,Text,Label,sources,translated
573,https://t.me/nrpublic/20297,Поширення COVID-19 може посилитися через конфлікт в Україні.,True,t.me/nrpublic,The spread of COVID-19 may increase due to the conflict in Ukraine.
574,https://t.me/nrpublic/20308,"Володимир Зеленський підписав закон, який дозволяє всім жителям України використовувати зброю під час воєнного стану.",True,t.me/nrpublic,Volodymyr Zelenskyy signed a law that allows all residents of Ukraine to use weapons during martial law.
575,https://t.me/nrpublic/20370,Колишній канцлер Німеччини Герхард Шредер прибув до Москви на переговори з Путіним щодо України — джерело Politico,True,t.me/nrpublic,Former German Chancellor Gerhard Schröder arrived in Moscow for talks with Putin on Ukraine — Politico source
576,https://t.me/nrpublic/20407,Франція не вважає за можливу процедуру розгляду заявки України на вступ до Євросоюзу в умовах конфлікту.,True,t.me/nrpublic,France does not consider it a possible procedure to consider Ukraine's application to join the European Union in conflict conditions.
577,https://t.me/nrpublic/20426,"Україна повністю відмовляється від закупівлі російського ядерного палива - ""Енергоатом"".",True,t.me/nrpublic,"Ukraine completely refuses to purchase Russian nuclear fuel - ""Energoatom""."
578,https://t.me/nrpublic/20439,"Прем'єр-міністр Словенії: ЄС змінився недостатньо, щоб надати Україні членства",True,t.me/nrpublic,The prime minister of Slovenia: the EU has not changed enough to grant membership to Ukraine
579,https://t.me/nrpublic/20441,"Канадський прем'єр Трюдо заявив, що НАТО не зможе допомогти Україні із закриттям неба",True,t.me/nrpublic,Canadian Prime Minister Trudeau said that NATO will not be able to help Ukraine with the closure of the sky
580,https://t.me/nrpublic/20443,"Події в Україні не повинні перетворитися на війну НАТО з Росією, це призведе до великих жертв - Столтенберг",True,t.me/nrpublic,"Events in Ukraine should not turn into a NATO war with Russia, this will lead to great casualties - Stoltenberg"
581,https://t.me/nrpublic/20445,"НАТО розуміє розчарування України через небажання альянсу закрити небо, але ескалація призведе до жертв та страждань за межами країни, сказав генсек НАТО Столтенберг.",True,t.me/nrpublic,"NATO understands Ukraine's frustration with the alliance's reluctance to close the skies, but escalation will lead to casualties and suffering beyond the country's borders, NATO Secretary General Stoltenberg said."
582,https://t.me/nrpublic/20446,"Кількість біженців, які залишили Україну з 24 лютого, досягла 2,5 мільйона людей, повідомив верховний комісар ООН у справах біженців Філіппо Гранді.",True,t.me/nrpublic,"The number of refugees who left Ukraine since February 24 has reached 2.5 million people, the UN High Commissioner for Refugees Filippo Grandi said."
583,https://t.me/nrpublic/20456,Єврокомісія виділить Україні допомогу у розмірі 300 мільйонів євро.,True,t.me/nrpublic,The European Commission will allocate EUR 300 million in aid to Ukraine.
584,https://t.me/nrpublic/20470,Український суд заочно заарештував Маргариту Симоньян - заяву генпрокурора України,True,t.me/nrpublic,The Ukrainian court arrested Margarita Simonyan in absentia - statement of the Prosecutor General of Ukraine
585,https://t.me/nrpublic/20485,"У Криму впав безпілотник Ту-141, запущений з території України, повідомляють російські держЗМІ.",True,t.me/nrpublic,"A Tu-141 drone launched from the territory of Ukraine crashed in Crimea, Russian state media reported."
586,https://t.me/nrpublic/20511,Швейцарія у зв'язку із ситуацією в Україні закриває небо для літаків сторін конфлікту та літаків інших держав з метою надання військової підтримки сторонам конфлікту,True,t.me/nrpublic,"In connection with the situation in Ukraine, Switzerland closes the sky to aircraft of the parties to the conflict and aircraft of other states in order to provide military support to the parties to the conflict"
587,https://t.me/nrpublic/20516,"The Wall Street Journal: Байден особисто заборонив постачання польських винищувачів МіГ-29 для України, щоб ""не спровокувати Путіна до ескалації спецоперації""",True,t.me/nrpublic,"The Wall Street Journal: Biden personally banned the supply of Polish MiG-29 fighter jets to Ukraine in order ""not to provoke Putin to escalate the special operation"""
588,https://t.me/nrpublic/20520,"Варшава прийняла 200 000 біженців з України і не може прийняти більше, повідомляє польське видання Rzeczpospolita. Видання також зазначає, що така сама ситуація і в Кракові.",True,t.me/nrpublic,"Warsaw has accepted 200,000 refugees from Ukraine and cannot accept more, reports the Polish publication Rzeczpospolita. The publication also notes that the situation is the same in Krakow."
589,https://t.me/nrpublic/20549,"Telegram супроводжував оголошення про нові оновлення картинкою, де на передньому плані книга з гербом України та Доббі, який підозріло когось нагадує",True,t.me/nrpublic,"Telegram accompanied the announcement of new updates with a picture in the foreground of a book with the coat of arms of Ukraine and Dobby, who suspiciously resembles someone"
590,https://t.me/nrpublic/20553,"Україна має сама вирішити, чи вступати їй до НАТО чи ні, заявив Столтенберг.",True,t.me/nrpublic,"Ukraine should decide for itself whether to join NATO or not, Stoltenberg said."
591,https://t.me/nrpublic/20562,"Український тревел-блогер Антон Птушкін записав звернення до росіян ""Я родом із Луганська. Луганськ — це мій будинок, який у 2014 році у мене забрали. У вас колись забирали будинок?""",True,t.me/nrpublic,"Ukrainian travel blogger Anton Ptushkin recorded an appeal to the Russians: ""I come from Luhansk. Luhansk is my home, which was taken from me in 2014. Have you ever had your home taken away?"""
592,https://t.me/nrpublic/20582,"Компанія Sony Pictures Entertainment заявила, що припиняє всю діяльність у Росії через ситуацію з Україною, пише видання Variety.",True,t.me/nrpublic,"Sony Pictures Entertainment has announced that it is suspending all activities in Russia due to the situation with Ukraine, writes Variety."
593,https://t.me/nrpublic/20593,Зеленський на прес-конференції з іноземними ЗМІ: Сміливості в об'єднанні країн-членів НАТО заради України я не бачу,True,t.me/nrpublic,Zelensky at a press conference with foreign media: I do not see courage in uniting NATO member countries for the sake of Ukraine
594,https://t.me/nrpublic/20624,"Президент України Володимир Зеленський повідомив, що наразі із зони бойових дій вдалося вивезти майже 125 тисяч громадян.",True,t.me/nrpublic,"The President of Ukraine, Volodymyr Zelenskyy, announced that almost 125,000 citizens have been evacuated from the combat zone."
595,https://t.me/nrpublic/20625,"Мешканець Києва у перуці та з макіяжем намагався втекти з України, видаючи себе за жінку на кордоні, повідомляє держприкордонслужба України.",True,t.me/nrpublic,"A resident of Kyiv wearing a wig and makeup tried to escape from Ukraine, posing as a woman at the border, the State Border Service of Ukraine reports."
596,https://t.me/nrpublic/20636,"Президент України Зеленський опублікував відео, на якому він відвідує постраждалих українських військових",True,t.me/nrpublic,"The President of Ukraine, Zelenskyy, published a video in which he visits the injured Ukrainian soldiers"
597,https://t.me/nrpublic/20654,"Якщо Кадиров справді під Києвом, ЗСУ його знищить, – радник Президента України Олексій Арестович.",True,t.me/nrpublic,"If Kadyrov is really near Kyiv, the Armed Forces of Ukraine will destroy him - Oleksiy Arestovych, adviser to the President of Ukraine."
598,https://t.me/nrpublic/20693,Україна оголосить Володимира Соловйова у міжнародний розшук - заява,True,t.me/nrpublic,Ukraine will declare Volodymyr Solovyov on international wanted list - statement
599,https://t.me/nrpublic/20705,Суд в Україні заочно заарештував російського журналіста Володимира Соловйова,True,t.me/nrpublic,A court in Ukraine arrested Russian journalist Volodymyr Solovyov in absentia
600,https://t.me/nrpublic/20748,Володимир Зеленський продовжує воєнний стан в Україні ще на 30 днів.,True,t.me/nrpublic,Volodymyr Zelenskyy extends martial law in Ukraine for another 30 days.
601,https://t.me/nrpublic/20750,Потенційний перелік заборонених осіб на території Росії Вони висловилися проти спецоперації в Україні.,True,t.me/nrpublic,A potential list of banned persons on the territory of Russia They spoke out against the special operation in Ukraine.
602,https://t.me/nrpublic/20752,"Україна пручається довше, ніж США припускали.",True,t.me/nrpublic,Ukraine has been resisting for longer than the US assumed.
603,https://t.me/nrpublic/20769,"Українська залізниця розпочинає процедуру націоналізації російських вагонів, що знаходяться на території України",True,t.me/nrpublic,Ukrainian Railways is starting the procedure of nationalization of Russian wagons located on the territory of Ukraine
604,https://t.me/nrpublic/20778,"Питання зміни режиму в Україні навіть не порушувалося на переговорах російської та української делегацій, заявив російський посол у Парижі.",True,t.me/nrpublic,"The issue of regime change in Ukraine was not even raised during the negotiations between the Russian and Ukrainian delegations, said the Russian ambassador in Paris."
605,https://t.me/nrpublic/20794,"Україна почула, що не увійде до НАТО, це правда, треба визнати — Зеленський",True,t.me/nrpublic,"Ukraine heard that it will not join NATO, it is true, it must be admitted — Zelensky"
606,https://t.me/nrpublic/20795,НАТО на даний момент не розглядає питання про запровадження над Україною безпольотної зони - постпред США,True,t.me/nrpublic,"At the moment, NATO is not considering the issue of introducing a no-fly zone over Ukraine - the post of the US ambassador"
607,https://t.me/nrpublic/20822,"У суді з’ясувалося, що протокол на Марину Овсяннікову склали не за акцію з плакатом в ефірі Першого каналу, а за відеозвернення, в якому вона виступила проти війни з Україною",True,t.me/nrpublic,"The court found out that the protocol against Maryna Ovsyannikova was drawn up not for the action with the poster on the air of the First Channel, but for the video message in which she spoke against the war with Ukraine"
608,https://t.me/nrpublic/20834,Українські Forbes: Через блокування Instagram російські блогери втратять від $200 млн до $2 млрд,True,t.me/nrpublic,"Ukrainian Forbes: Due to the blocking of Instagram, Russian bloggers will lose from $200 million to $2 billion"
609,https://t.me/nrpublic/20850,"Президент США Джо Байден вирушить до Європи наступного тижня для особистих переговорів із європейськими лідерами щодо спецоперації Росії в Україні, повідомляє Білий дім.",True,t.me/nrpublic,"US President Joe Biden will travel to Europe next week for personal talks with European leaders regarding Russia's special operation in Ukraine, the White House reports."
610,https://t.me/nrpublic/20866,"США надасть Україні 13,6 мільярда доларів",True,t.me/nrpublic,The USA will provide Ukraine with 13.6 billion dollars
611,https://t.me/nrpublic/20870,"Євросоюз не забороняв імпорт із Росії ікри та горілки в рамках четвертого пакету санкцій через ситуацію навколо України, йдеться в повідомленні, опублікованому Єврокомісією.",True,t.me/nrpublic,"The European Union did not ban the import of caviar and vodka from Russia as part of the fourth package of sanctions due to the situation around Ukraine, according to a message published by the European Commission."
612,https://t.me/nrpublic/20875,Близько 3 млн біженців з України прибули до сусідніх країн — Управління верховного комісара ООН у справах біженців.,True,t.me/nrpublic,About 3 million refugees from Ukraine arrived in neighboring countries — Office of the United Nations High Commissioner for Refugees.
613,https://t.me/nrpublic/20885,"Байден може надати Україні понад $1 млрд військової допомоги, пише WSJ з посиланням на американських чиновників.",True,t.me/nrpublic,"Biden can provide Ukraine with more than $1 billion in military aid, WSJ writes with reference to American officials."
614,https://t.me/nrpublic/20918,"Берлін проти відправлення будь-яких військових НАТО на Україну, це червона лінія - ФРН про ідею відправити миротворців на Україну",True,t.me/nrpublic,"Berlin is against sending any NATO troops to Ukraine, this is a red line - Germany on the idea of ​​sending peacekeepers to Ukraine"
615,https://t.me/nrpublic/20928,Заводи BMW та Volkswagen у Європі призупиняють роботу через брак деталей з України,True,t.me/nrpublic,BMW and Volkswagen factories in Europe suspend work due to a lack of parts from Ukraine
616,https://t.me/nrpublic/20932,"Собянін заявив, що він підтримує спецоперацію Росії в Україні",True,t.me/nrpublic,Sobyanin said that he supports Russia's special operation in Ukraine
617,https://t.me/nrpublic/20937,"FT пише з посиланням на джерела, що Росія та Україна підготували план, що включає припинення вогню та виведення військ за умови нейтралітету Києва та скорочення чисельності українських військ",True,t.me/nrpublic,The FT writes with reference to sources that Russia and Ukraine have prepared a plan that includes a ceasefire and the withdrawal of troops on the condition of Kyiv's neutrality and a reduction in the number of Ukrainian troops
618,https://t.me/nrpublic/20951,"Зеленський підписав закон, який відкриває легальний ринок криптовалюти в Україні",True,t.me/nrpublic,Zelensky signed a law that opens the legal cryptocurrency market in Ukraine
619,https://t.me/nrpublic/20955,"Міжнародний суд ООН ухвалив, що Росія має зупинити спецоперацію в Україні.",True,t.me/nrpublic,The UN International Court of Justice ruled that Russia should stop the special operation in Ukraine.
620,https://t.me/nrpublic/20957,"Українець спробував перетнути кордон у коробці з дитячими речами, але його виявили прикордонники",True,t.me/nrpublic,"A Ukrainian tried to cross the border in a box with children's things, but he was discovered by border guards"
621,https://t.me/nrpublic/20965,Байден про ситуацію навколо України: це може бути тривала та важка боротьба,True,t.me/nrpublic,Biden on the situation around Ukraine: it could be a long and difficult struggle
622,https://t.me/nrpublic/20993,Україна обміняла 9 полонених російських солдатів на мера Мелітополя Івана Федорова,True,t.me/nrpublic,Ukraine exchanged 9 captured Russian soldiers for Melitopol mayor Ivan Fedorov
623,https://t.me/nrpublic/21028,НАТО не втручатиметься в конфлікт в Україні — канцлер ФРН Олаф Шольц,True,t.me/nrpublic,NATO will not intervene in the conflict in Ukraine - Chancellor of Germany Olaf Scholz
624,https://t.me/nrpublic/21039,"Білий дім: Байден завтра переговорить із Сі Цзіньпіном, обговорить події в Україні та двосторонні відносини",True,t.me/nrpublic,"White House: Biden will talk with Xi Jinping tomorrow, discuss events in Ukraine and bilateral relations"
625,https://t.me/nrpublic/21046,"Погодження мирного договору України та Росії може зайняти від кількох днів до півтора тижня, - Подоляк",True,t.me/nrpublic,"The agreement of a peace treaty between Ukraine and Russia may take from several days to a week and a half, - Podoliak"
626,https://t.me/nrpublic/21072,"Байден має намір заявити Сі Цзіньпіну, що США вживуть заходів, якщо з'ясується, що Китай підтримує дії Росії в Україні — держсекретар Блінкен",True,t.me/nrpublic,Biden intends to tell Xi Jinping that the US will take action if it turns out that China supports Russia's actions in Ukraine - Secretary of State Blinken
627,https://t.me/nrpublic/21073,Економічні наслідки російської військової операції в Україні торкнуться всього світу — Блінкен,True,t.me/nrpublic,The economic consequences of the Russian military operation in Ukraine will affect the whole world - Blinken
628,https://t.me/nrpublic/21077,"Президента України Володимира Зеленського висунули на Нобелівську премію миру Це зробила група європейських політиків – колишні та чинні міністри європейських держав, депутати",True,t.me/nrpublic,"The President of Ukraine, Volodymyr Zelensky, was nominated for the Nobel Peace Prize. This was done by a group of European politicians - former and current ministers of European states, deputies"
629,https://t.me/nrpublic/21094,"Steam призупинив виплати розробникам з Білорусі, Росії та України",True,t.me/nrpublic,"Steam suspended payments to developers from Belarus, Russia and Ukraine"
630,https://t.me/nrpublic/21124,Байден закликає Сі Цзіньпіна використати свій вплив на Путіна для припинення спецоперації в Україні,True,t.me/nrpublic,Biden calls on Xi Jinping to use his influence with Putin to end the special operation in Ukraine
631,https://t.me/nrpublic/21128,"Нейтральний статус України та її невступ до НАТО є темами, за якими Москва та Київ максимально зблизили позиції на переговорах.",True,t.me/nrpublic,The neutral status of Ukraine and its failure to join NATO are topics on which Moscow and Kyiv have brought their positions as close as possible during the negotiations.
632,https://t.me/nrpublic/21138,"Путін і Макрон телефоном обмінялися думками щодо ситуації навколо України, повідомили у Кремлі.",True,t.me/nrpublic,"Putin and Macron exchanged views on the situation around Ukraine by phone, the Kremlin said."
633,https://t.me/nrpublic/21139,"Голівудський режисер Стівен Спілберг пожертвував $1 млн п'ятьом організаціям, які допомагають біженцям з України.",True,t.me/nrpublic,Hollywood director Steven Spielberg donated $1 million to five organizations that help refugees from Ukraine.
634,https://t.me/nrpublic/21150,"США та ЄС обговорюють можливість використання активів Росії та російських еліт, які перебувають під санкціями, для фінансування відновлення України.",True,t.me/nrpublic,The US and the EU are discussing the possibility of using the assets of Russia and Russian elites under sanctions to finance the reconstruction of Ukraine.
635,https://t.me/nrpublic/21171,Путін заявив прем'єру Люксембургу про небезпеку для ЄС військово-біологічної діяльності США в Україні,True,t.me/nrpublic,Putin told the Prime Minister of Luxembourg about the danger for the EU of the biological military activities of the USA in Ukraine
636,https://t.me/nrpublic/21199,Epic Games направить усі доходи від Fortnite з 20 березня по 3 квітня на гуманітарну допомогу Україні,True,t.me/nrpublic,Epic Games will direct all proceeds from Fortnite from March 20 to April 3 to humanitarian aid in Ukraine
637,https://t.me/nrpublic/21208,"Зеленський: я готовий до переговорів з Путіним, але якщо вони закінчаться невдачею,***** між Росією та Україною призведе до третьої світової",True,t.me/nrpublic,"Zelensky: I am ready for negotiations with Putin, but if they end in failure, ***** between Russia and Ukraine will lead to the third world war"
638,https://t.me/nrpublic/21209,Зеленський продовжив військовий стан в Україні з 26 березня ще на 30 діб,True,t.me/nrpublic,Zelenskyi extended martial law in Ukraine from March 26 for another 30 days
639,https://t.me/nrpublic/21210,10 млн людей вимушено залишили свої будинки в Україні з 24 лютого — дані верховного комісара ООН у справах біженців,True,t.me/nrpublic,10 million people have been forced to leave their homes in Ukraine since February 24 — according to the UN High Commissioner for Refugees
640,https://t.me/nrpublic/21219,Папа Римський Франциск написав твіт українською на підтримку України Він закликав до конкретних зусиль та молитов для допомоги країні та закликав її громадян не звикати до насильства.,True,t.me/nrpublic,Pope Francis wrote a tweet in Ukrainian in support of Ukraine. He called for specific efforts and prayers to help the country and urged its citizens not to get used to violence.
