,Link,Text,Label,sources,translated
1478,https://t.me/nrpublic/37156,50% енергосистеми України виведено з ладу – прем'єр-міністр країни Шмигаль,True,t.me/nrpublic,50% of Ukraine's energy system is out of order - Prime Minister of the country Shmyhal
1479,https://t.me/nrpublic/37194,"Карикатура: Катар'22 - чемпіонат світу, який пройде протягом [воєнної операції] в Україні Автор: Julio Carrión Cueva",True,t.me/nrpublic,Cartoon: Qatar'22 - World Cup to be held during [military operation] in Ukraine Author: Julio Carrión Cueva
1480,https://t.me/nrpublic/37207,"Британський прем'єр Сунак під час візиту до Києва заявив, що Лондон сприятиме Україні у посиленні ППО — ЗМІ",True,t.me/nrpublic,"During his visit to Kyiv, British Prime Minister Sunak said that London will assist Ukraine in strengthening air defense — mass media"
1481,https://t.me/nrpublic/37214,Україна готує добровільну евакуацію населення з Херсона та області — Верещук,True,t.me/nrpublic,Ukraine is preparing a voluntary evacuation of the population from Kherson and the Vereshchuk region
1482,https://t.me/nrpublic/37233,Повітряна тривога оголошена по всій Україні,True,t.me/nrpublic,An air alert has been announced throughout Ukraine
1483,https://t.me/nrpublic/37262,"Україна може стати членом ЄС, навіть якщо [військова операція] не буде остаточно завершена, — заявила віце-прем'єр з питань європейської та євроатлантичної інтеграції Ольга Стефанишина",True,t.me/nrpublic,"Ukraine can become a member of the EU, even if [the military operation] is not finally completed, - said the Deputy Prime Minister for European and Euro-Atlantic Integration Olha Stefanyshyn"
1484,https://t.me/nrpublic/37282,"За словами Києва, розстріляні російські солдати здійснили провокацію: зімітували здачу в полон і відкрили вогонь по українських солдатах Україна не визнає їхнього статусу військовополонених.",True,t.me/nrpublic,"According to Kyiv, the shot Russian soldiers committed a provocation: they simulated surrender and opened fire on Ukrainian soldiers. Ukraine does not recognize their status as prisoners of war."
1485,https://t.me/nrpublic/37288,"В Україні щонайменше 5 мільйонів людей втратили роботу, близько 7 мільйонів залишили країну, що суттєво вплинуло на зростання рівня безробіття, повідомила заступник міністра економіки Тетяна Бережна.",True,t.me/nrpublic,"In Ukraine, at least 5 million people lost their jobs, about 7 million left the country, which had a significant impact on the growth of the unemployment rate, Deputy Minister of Economy Tetiana Berezhna said."
1486,https://t.me/nrpublic/37325,"НАТО хоче домогтися ""прийнятної мирної угоди для України"", тому необхідно нарощувати військову допомогу Києву - Столтенберг",True,t.me/nrpublic,"NATO wants to achieve an ""acceptable peace agreement for Ukraine"", therefore it is necessary to increase military aid to Kyiv - Stoltenberg"
1487,https://t.me/nrpublic/37349,"Євросоюз не зможе ухвалити нових членів, включаючи Україну — прем'єр Португалії",True,t.me/nrpublic,"The European Union will not be able to accept new members, including Ukraine — the Prime Minister of Portugal"
1488,https://t.me/nrpublic/37380,"Служба безпеки України заявила, що проводить на території Києво-Печерської Лаври ""контррозвідувальні заходи""",True,t.me/nrpublic,"The Security Service of Ukraine announced that it was conducting ""counter-intelligence measures"" on the territory of the Kyiv-Pechersk Lavra"
1489,https://t.me/nrpublic/37420,"США надали Україні $4,5 млрд як додаткову пряму бюджетну підтримку, повідомив Мінфін.",True,t.me/nrpublic,"The United States provided $4.5 billion to Ukraine as additional direct budget support, the Ministry of Finance announced."
1490,https://t.me/nrpublic/37421,"Українська прокуратура звинуватила у ""віроломстві"" та ""порушенні законів війни"" російських військовослужбовців, розстріляних після здачі в полон українськими силовиками в селі Макіївка у ЛНР",True,t.me/nrpublic,"The Ukrainian prosecutor's office accused the Russian servicemen who were shot after being captured by Ukrainian security forces in the village of Makiivka in the LPR of ""treason"" and ""violation of the laws of war"""
1491,https://t.me/nrpublic/37430,"Прем'єр-міністр України Денис Шмигаль не виключив, що в країні можливі аварійні відключення електропостачання через настання холодів",True,t.me/nrpublic,Prime Minister of Ukraine Denys Shmyhal did not rule out the possibility of emergency power outages in the country due to the onset of cold weather
1492,https://t.me/nrpublic/37441,"Секретар РНБО України Олексій Данилов заявив, що Росія має достатню кількість ресурсів для того, щоб провести три-чотири масовані атаки, рівноцінні тій, що сталася 15 листопада.",True,t.me/nrpublic,"Oleksiy Danilov, Secretary of the National Security and Defense Council of Ukraine, stated that Russia has sufficient resources to carry out three or four massive attacks equivalent to the one that occurred on November 15."
1493,https://t.me/nrpublic/37467,Українські ЗМІ повідомляють про вибухи в Одесі,True,t.me/nrpublic,Ukrainian mass media report on explosions in Odesa
1494,https://t.me/nrpublic/37471,"Повітряна тривога оголошена по всій Україні, в Одеській та Дніпропетровській областях працюють системи ППО — влада",True,t.me/nrpublic,"An air alert has been declared throughout Ukraine, air defense systems are operating in Odesa and Dnipropetrovsk regions — the government"
1495,https://t.me/nrpublic/37474,Українські ЗМІ повідомляють про вибухи у Києві та Вінниці,True,t.me/nrpublic,Ukrainian mass media report on explosions in Kyiv and Vinnytsia
1496,https://t.me/nrpublic/37484,В усіх регіонах України запроваджено аварійні відключення електроенергії — енергокомпанія Укренерго,True,t.me/nrpublic,Emergency power outages have been introduced in all regions of Ukraine — the energy company Ukrenergo
1497,https://t.me/nrpublic/37496,В Україні спостерігаються серйозні проблеми з інтернетом - Netblocks,True,t.me/nrpublic,"In Ukraine, there are serious problems with the Internet - Netblocks"
1498,https://t.me/nrpublic/37498,Байден доручив Держдепартаменту виділити 400 мільйонів доларів на військову підтримку України.,True,t.me/nrpublic,Biden instructed the State Department to allocate 400 million dollars for military support to Ukraine.
1499,https://t.me/nrpublic/37501,Переважна більшість споживачів електроенергії України знеструмлено.,True,t.me/nrpublic,The vast majority of Ukraine's electricity consumers have been cut off.
1500,https://t.me/nrpublic/37502,"Новий пакет військової допомоги Україні на $400 млн включатиме обладнання для ППО, додаткові озброєння та боєприпаси",True,t.me/nrpublic,"A new $400 million package of military aid to Ukraine will include air defense equipment, additional weapons and ammunition"
1501,https://t.me/nrpublic/37510,"Вишки стільникового зв'язку в Україні через відключення електроенергії перейшли на роботу від генераторів, оператори працюючих вишок перевантажені, заявив міністр цифрової трансформації країни Михайло Федоров.",True,t.me/nrpublic,"Cellular communication towers in Ukraine switched to working from generators due to a power outage, the operators of working towers are overloaded, said the Minister of Digital Transformation of the country Mykhailo Fedorov."
1502,https://t.me/nrpublic/37539,"Українські ЗМІ публікують кадри, на яких лікарі продовжують оперувати серце дитини після відключення світла у Києві Відновити подачу енергії вдалося за допомогою генератора.",True,t.me/nrpublic,Ukrainian mass media published footage showing doctors continuing to operate on a child's heart after a power outage in Kyiv. Power was restored with the help of a generator.
1503,https://t.me/nrpublic/37576,Єврокомісія закликала країни ЄС масово направити Україні високовольтні трансформатори та електрогенератори — єврокомісар,True,t.me/nrpublic,The European Commission called on the EU countries to massively send high-voltage transformers and generators to Ukraine - the European Commissioner
1504,https://t.me/nrpublic/37594,"Ворожки у шоу Малахова на ""Росії 1"" передбачили перемогу Росії у [військовій операції] та припинення існування України як країни За їхніми прогнозами все закінчиться до 2024 року.",True,t.me/nrpublic,"The fortune-tellers in Malakhov's show on ""Russia 1"" predicted the victory of Russia in the [military operation] and the end of the existence of Ukraine as a country. According to their predictions, everything will end by 2024."
1505,https://t.me/nrpublic/37613,"На Україну чекає жахлива зима, заявив Столтенберг",True,t.me/nrpublic,"A terrible winter awaits Ukraine, Stoltenberg said"
1506,https://t.me/nrpublic/37665,Уряд України запровадив заборону на експорт дров,True,t.me/nrpublic,The government of Ukraine introduced a ban on the export of firewood
1507,https://t.me/nrpublic/37713,"Як повідомили в офісі президента України, насамперед світло подають на об'єкти критичної інфраструктури, а потім уже мешканцям.",True,t.me/nrpublic,"As reported in the office of the President of Ukraine, first of all, light is given to critical infrastructure facilities, and then to residents."
1508,https://t.me/nrpublic/37743,У 15 суб'єктах України обмежено електропостачання — Зеленський,True,t.me/nrpublic,Electricity supply is limited in 15 entities of Ukraine — Zelenskyi
1509,https://t.me/nrpublic/37765,"Залізниця у Кривому Розі в Україні тривалий час не працюватиме, заявив начальник Криворізької військової адміністрації Євген Ситниченко.",True,t.me/nrpublic,"The railway in Kryvyi Rih in Ukraine will not work for a long time, said Yevhen Sytnychenko, the head of the Kryvyi Rih Military Administration."
1510,https://t.me/nrpublic/37769,"Генсек НАТО Столтенберг визнав, що підтримка України у нинішньому конфлікті дорого обходиться жителям країн Заходу, проте зазначив, що необхідно ""підтримувати та збільшувати"" допомогу Києву",True,t.me/nrpublic,"NATO Secretary General Stoltenberg admitted that supporting Ukraine in the current conflict is expensive for the residents of Western countries, but noted that it is necessary to ""support and increase"" aid to Kyiv"
1511,https://t.me/nrpublic/37780,"Прем'єр-міністр Угорщини Віктор Орбан заявив, що збереження незалежності України необхідне для безпеки Європи",True,t.me/nrpublic,"The Prime Minister of Hungary, Viktor Orban, said that preserving the independence of Ukraine is necessary for the security of Europe"
1512,https://t.me/nrpublic/37853,"Повітряну тривогу оголосили на півдні та півночі України, а також у центральній частині країни",True,t.me/nrpublic,"An air alert was announced in the south and north of Ukraine, as well as in the central part of the country"
1513,https://t.me/nrpublic/37860,"Секретар РНБО України Олексій Данилов закликав партнерів надати ЗСУ ракети дальністю 800 кілометрів для ""вирішення енергетичної проблеми""",True,t.me/nrpublic,"Oleksiy Danilov, Secretary of the National Security Council of Ukraine, called on partners to provide the Armed Forces with missiles with a range of 800 kilometers to ""solve the energy problem"""
1514,https://t.me/nrpublic/37874,"Повітряна тривога оголошена у Дніпропетровській, Полтавській та Харківській областях України Українські ЗМІ повідомляють про вибухи у Дніпропетровську та Полтаві",True,t.me/nrpublic,"An air alert has been announced in Dnipropetrovsk, Poltava and Kharkiv regions of Ukraine. Ukrainian mass media report explosions in Dnipropetrovsk and Poltava"
1515,https://t.me/nrpublic/37902,Втрата від ракетних ударів по Україні колосальна — Столтенберг,True,t.me/nrpublic,The loss from missile strikes on Ukraine is colossal — Stoltenberg
1516,https://t.me/nrpublic/37938,НАТО вважає єдиним шляхом до миру в Україні постійне постачання зброї Києву - Столтенберг,True,t.me/nrpublic,NATO believes that the only way to peace in Ukraine is the constant supply of weapons to Kyiv - Stoltenberg
1517,https://t.me/nrpublic/37954,Повітряну тривогу оголошено в Харківській та Дніпропетровській областях України Місцеві ЗМІ повідомляють про вибухи там.,True,t.me/nrpublic,An air alert has been announced in the Kharkiv and Dnipropetrovsk regions of Ukraine. Local media reports about explosions there.
1518,https://t.me/nrpublic/38029,"Влада США вважає продовження підтримки Заходом Києва єдиним способом забезпечити врегулювання ситуації в Україні, повідомив держсекретар США Ентоні Блінкен.",True,t.me/nrpublic,"The US authorities consider the continuation of the West's support for Kyiv as the only way to ensure the settlement of the situation in Ukraine, US Secretary of State Anthony Blinken said."
1519,https://t.me/nrpublic/38054,"Зеленський запросив Ілона Маска до України, щоб він після побаченого розповів, хто розпочав війну, як і коли її закінчувати, — NYT",True,t.me/nrpublic,"Zelensky invited Elon Musk to Ukraine so that, after what he saw, he would tell who started the war, how and when to end it, NYT"
1520,https://t.me/nrpublic/38055,МВФ прогнозує зростання кількості бідних у Середній Азії на 1 мільйон людей через конфлікт в Україні,True,t.me/nrpublic,The IMF predicts an increase in the number of poor people in Central Asia by 1 million people due to the conflict in Ukraine
1521,https://t.me/nrpublic/38060,Дружина президента України Олена Зеленська зустрілася з Королем Британії Чарльзом ІІІ,True,t.me/nrpublic,"The wife of the President of Ukraine, Olena Zelenska, met with the King of Great Britain, Charles III"
1522,https://t.me/nrpublic/38063,"Верховний комісар ООН з прав людини Фолькер Тюрк відвідає Україну з 4 по 7 грудня, зокрема, Харків та Ізюм, випливає із заяви на сайті УВКПЛ.",True,t.me/nrpublic,"The UN High Commissioner for Human Rights Volker Türk will visit Ukraine from December 4 to 7, in particular, Kharkiv and Izyum, according to a statement on the OHCHR website."
1523,https://t.me/nrpublic/38092,"Переговори про вступ України до ЄС розпочнуться найближчим часом, — МЗС Німеччини",True,t.me/nrpublic,"Negotiations on Ukraine's accession to the EU will begin in the near future, the German Foreign Ministry said"
1524,https://t.me/nrpublic/38097,Повітряну тривогу оголосили на всій території України,True,t.me/nrpublic,An air alert was announced throughout Ukraine
1525,https://t.me/nrpublic/38104,"Єврокомісія не приноситиме вибачення Україні у зв'язку з публікацією даних про 100 тис. загиблих українських військових, заявила офіційний представник ЄК Дана Спінант на прес-конференції.",True,t.me/nrpublic,"The European Commission will not apologize to Ukraine in connection with the publication of data on 100,000 dead Ukrainian soldiers, the official representative of the EC, Dana Spinant, said at a press conference."
1526,https://t.me/nrpublic/38110,"Агенство Regnum у своїй новині про повітряну тривогу в Україні назвало територію країни ""захопленою режимом Києва""",True,t.me/nrpublic,"In its news about the air alert in Ukraine, the Regnum agency called the territory of the country ""captured by the Kyiv regime"""
1527,https://t.me/nrpublic/38134,"Те, що Путін робить в Україні, огидно.",True,t.me/nrpublic,What Putin is doing in Ukraine is disgusting.
1528,https://t.me/nrpublic/38136,"Ми маємо підтримувати народ України. І ідея, що Путін колись переможе в Україні, неприпустима. Це не можна допустити! - Байден",True,t.me/nrpublic,We must support the people of Ukraine. And the idea that Putin will one day win in Ukraine is unacceptable. This cannot be allowed! - Biden
1529,https://t.me/nrpublic/38137,"Але це станеться, якщо Путін виведе війська з України. Консультації з НАТО.",True,t.me/nrpublic,But it will happen if Putin withdraws troops from Ukraine. Consultations with NATO.
1530,https://t.me/nrpublic/38138,"Захід не чинитиме тиск на Україну, щоб змусити її розпочати переговори з Росією — Макрон",True,t.me/nrpublic,The West will not put pressure on Ukraine to force it to start negotiations with Russia - Macron
1531,https://t.me/nrpublic/38148,"Байден хоче уникнути розширення конфлікту в Україні, США не хочуть війни з Росією — Блінкен",True,t.me/nrpublic,"Biden wants to avoid the expansion of the conflict in Ukraine, the USA does not want a war with Russia - Blinken"
1532,https://t.me/nrpublic/38169,"Зеленський ввів у дію рішення Ради національної безпеки та оборони України щодо обмежувальних заходів щодо представників релігійних організацій, пов'язаних з Росією",True,t.me/nrpublic,Zelenskyy implemented the decision of the National Security and Defense Council of Ukraine regarding restrictive measures against representatives of religious organizations connected to Russia
1533,https://t.me/nrpublic/38172,"Німеччина лагодить танки Gepard, які мали утилізувати, а навесні 2023 року їх доставлять в Україну — Der Spiegel",True,t.me/nrpublic,"Germany is repairing Gepard tanks, which were supposed to be scrapped, and they will be delivered to Ukraine in the spring of 2023 — Der Spiegel"
1534,https://t.me/nrpublic/38185,"Іспанська поліція знову оточила територію довкола посольства України в Мадриді, повідомила державна телекомпанія TVE.",True,t.me/nrpublic,"The Spanish police have again surrounded the territory around the Embassy of Ukraine in Madrid, the state television company TVE reported."
1535,https://t.me/nrpublic/38204,Висловлювання Байдена про потенційну готовність до діалогу з Путіним не означають зміни позиції США щодо України — Білий дім,True,t.me/nrpublic,Biden's statements about potential readiness for dialogue with Putin do not mean a change in the US position on Ukraine — White House
1536,https://t.me/nrpublic/38205,"Адміністрація США веде переговори з конгресом про виділення додаткових $37,7 млрд для України, з яких $21 млрд становитиме військова допомога — Білий дім",True,t.me/nrpublic,"The US administration is negotiating with Congress to allocate an additional $37.7 billion for Ukraine, of which $21 billion will be military aid — White House"
1537,https://t.me/nrpublic/38252,"Макрон заявив, що хоче поговорити з Путіним після розмови з гендиректором МАГАТЕ, обговорити ситуацію з цивільною атомною енергетикою в Україні",True,t.me/nrpublic,"Macron said that he wants to talk with Putin after talking with the director general of the IAEA, to discuss the situation with civil nuclear energy in Ukraine"
1538,https://t.me/nrpublic/38282,"Розвідка США вважає, що темпи ведення бойових дій в Україні буде знижено найближчими місяцями Про це заявила директор Національної розвідки США Евріл Хейнс.",True,t.me/nrpublic,"US intelligence believes that the pace of hostilities in Ukraine will be reduced in the coming months, Director of US National Intelligence Euryl Haynes said."
1539,https://t.me/nrpublic/38293,Ухвалення Конгресом тимчасового фінансування уряду призведе до можливої ​​зупинки або скорочення військової допомоги Україні — Politico,True,t.me/nrpublic,Congressional passage of temporary government funding will lead to possible suspension or reduction of military aid to Ukraine — Politico
1540,https://t.me/nrpublic/38314,"У трьох областях України оголосили повітряну тривогу – Харківській, Дніпропетровській та Полтавській областях, а також на підконтрольній Україні Запорізькій області",True,t.me/nrpublic,"An air alert was declared in three regions of Ukraine - Kharkiv, Dnipropetrovsk, and Poltava regions, as well as in the Zaporizhia region controlled by Ukraine"
1541,https://t.me/nrpublic/38355,"Служба безпеки України заявила про проведення ""контррозвідувальних заходів"" на об'єктах канонічної Української православної церкви у Полтавській області.",True,t.me/nrpublic,"The Security Service of Ukraine announced the implementation of ""counter-intelligence measures"" at the sites of the canonical Ukrainian Orthodox Church in the Poltava region."
