,Link,Text,Label,sources,translated
0,https://t.me/nrpublic/16263,"Україна вважає це подальшою ескалацією Росії, додав Кулеба.",True,t.me/nrpublic,"Ukraine considers this a further escalation of Russia, Kuleba added."
1,https://t.me/nrpublic/16264,Франція закликала всіх співвітчизників негайно залишити територію України,True,t.me/nrpublic,France called on all compatriots to immediately leave the territory of Ukraine
2,https://t.me/nrpublic/16272,Зеленський: Україна не становить загрози для Росії Цього не буде,True,t.me/nrpublic,Zelensky: Ukraine does not pose a threat to Russia This will not happen
3,https://t.me/nrpublic/16290,ВМС України переведено в бойову готовність в Одеському порту,True,t.me/nrpublic,The Navy of Ukraine has been put on alert in Odesa port
4,https://t.me/nrpublic/16291,"На тлі виступу Зеленського CNN повідомляє, що Росія закриває повітряний простір на кордоні з Україною для цивільних літаків. До 18 травня.",True,t.me/nrpublic,"Against the background of Zelensky's speech, CNN reports that Russia is closing the airspace on the border with Ukraine to civilian aircraft. Until May 18."
5,https://t.me/nrpublic/16295,"Екстрене засідання РБ ООН щодо України призначено на 5.30 у Москві, повідомило російське постпредство.",True,t.me/nrpublic,"An emergency meeting of the UN Security Council regarding Ukraine is scheduled for 5:30 in Moscow, the Russian embassy reported."
6,https://t.me/nrpublic/16301,Небо над Україною закрите для цивільної авіації,True,t.me/nrpublic,The sky over Ukraine is closed to civil aviation
7,https://t.me/nrpublic/16315,Білорусь атакує Україну - повідомляє прикордонна служба України,True,t.me/nrpublic,Belarus is attacking Ukraine - reports the border service of Ukraine
8,https://t.me/nrpublic/16316,"Джонсон заявив Зеленському, що сподівається на надання Україною спротиву",True,t.me/nrpublic,Johnson told Zelensky that he hoped Ukraine would resist
9,https://t.me/nrpublic/16317,"У всіх районах Курської області, які межують з Україною, школярів переводять на дистанційне навчання",True,t.me/nrpublic,"In all districts of the Kursk region bordering Ukraine, schoolchildren are transferred to distance learning"
10,https://t.me/nrpublic/16322,CNN: Білоруські війська приєднуються до російських військ у нападі на Україну,True,t.me/nrpublic,CNN: Belarusian troops join Russian troops in attack on Ukraine
11,https://t.me/nrpublic/16326,"Генштаб України повідомляє про завдання ракетно-бомбових ударів по аеропортах у п'яти містах: Бориспіль, Озерний, Кульбакін (Миколаїв), Чугуїв, Краматорськ, Чорнобаївка (Херсон).",True,t.me/nrpublic,"The General Staff of Ukraine reports on the mission of missile and bomb attacks on airports in five cities: Boryspil, Ozerny, Kulbakin (Mykolaiv), Chuguiv, Kramatorsk, Chornobayivka (Kherson)."
12,https://t.me/nrpublic/16327,"У Луганській області України оголошено загальну евакуацію. Пункти збору – на вокзалах Лисичанськ, Рубіжне, Сватів.",True,t.me/nrpublic,"A general evacuation has been announced in the Luhansk region of Ukraine. The collection points are at Lysychansk, Rubizhne, and Svativ railway stations."
13,https://t.me/nrpublic/16328,CNN: танки входять на територію України з боку Білорусії,True,t.me/nrpublic,CNN: tanks enter the territory of Ukraine from the side of Belarus
14,https://t.me/nrpublic/16330,"Повідомляють, що українські ППО підбили російський військовий літак на сході України",True,t.me/nrpublic,It is reported that Ukrainian air defenses shot down a Russian military aircraft in eastern Ukraine
15,https://t.me/nrpublic/16333,"МНС України повідомляє, що окупанти захопили два села — Мілове та Городище у Луганській області.",True,t.me/nrpublic,The Ministry of Emergency Situations of Ukraine reports that the occupiers captured two villages - Milove and Horodyshche in the Luhansk region.
16,https://t.me/nrpublic/16334,"Шольц провів телефонну розмову із Зеленським, висловив солідарність із Україною",True,t.me/nrpublic,"Scholz held a telephone conversation with Zelenskyi, expressed solidarity with Ukraine"
17,https://t.me/nrpublic/16335,Путін сподівається на підтримку росіян у війні з Україною,True,t.me/nrpublic,Putin hopes for Russian support in the war with Ukraine
18,https://t.me/nrpublic/16336,Оновлена ​​карта атакованих міст в Україні,True,t.me/nrpublic,Updated map of attacked cities in Ukraine
19,https://t.me/nrpublic/16338,"Українські військові стверджують, що збили 5 літаків та 1 вертоліт у Луганській області.",True,t.me/nrpublic,The Ukrainian military claims to have shot down 5 planes and 1 helicopter in the Luhansk region.
20,https://t.me/nrpublic/16345,На всій території України введено військовий стан,True,t.me/nrpublic,Martial law has been imposed on the entire territory of Ukraine
21,https://t.me/nrpublic/16348,"Українські ЗМІ повідомляють, що київське метро пускає всіх безкоштовно, станції використовують як бомбосховища",True,t.me/nrpublic,"Ukrainian mass media report that the Kyiv subway lets everyone in for free, and the stations are used as bomb shelters"
22,https://t.me/nrpublic/16350,Німеччина закликала Росію негайно зупинити військову операцію проти України,True,t.me/nrpublic,Germany called on Russia to immediately stop the military operation against Ukraine
23,https://t.me/nrpublic/16367,"МЗС Польщі закликало всіх польських громадян, які перебувають в Україні, терміново залишити країну",True,t.me/nrpublic,The Ministry of Foreign Affairs of Poland called on all Polish citizens in Ukraine to leave the country immediately
24,https://t.me/nrpublic/16372,Підтверджуються перші жертви серед мирного населення України,True,t.me/nrpublic,The first victims among the civilian population of Ukraine are confirmed
25,https://t.me/nrpublic/16396,МВС України повідомляє про загибель прикордонника у населеному пункті Преображенка у Херсонській області.,True,t.me/nrpublic,The Ministry of Internal Affairs of Ukraine reports the death of a border guard in the village of Preobrazhenka in the Kherson region.
26,https://t.me/nrpublic/16402,"ЗМІ повідомляють про проблеми з операціями кількох банків в Україні, не можна зняти гроші, не проходять платежі",True,t.me/nrpublic,"The mass media report on problems with the operations of several banks in Ukraine, it is not possible to withdraw money, payments do not go through"
27,https://t.me/nrpublic/16403,"Посол України в Анкарі заявив, що Київ просить Туреччину закрити протоки Босфор та Дарданелли для Росії",True,t.me/nrpublic,The ambassador of Ukraine in Ankara said that Kyiv is asking Turkey to close the Bosphorus and Dardanelles straits to Russia
28,https://t.me/nrpublic/16407,МЗС Литви закликає громадян негайно залишити Україну,True,t.me/nrpublic,The Ministry of Foreign Affairs of Lithuania calls on citizens to leave Ukraine immediately
29,https://t.me/nrpublic/16420,"Полковник ДНР Басурин: українські військові зброю не склали, угруповання велике, ситуація складна, закликав українців просити своїх родичів в армії скласти зброю",True,t.me/nrpublic,"DNR Colonel Basurin: Ukrainian military did not lay down their arms, the group is large, the situation is difficult, called on Ukrainians to ask their relatives in the army to lay down their arms"
30,https://t.me/nrpublic/16433,Українська прем'єр-ліга оголосила про зупинення чемпіонату країни з футболу,True,t.me/nrpublic,The Ukrainian Premier League announced the suspension of the country's football championship
31,https://t.me/nrpublic/16436,"МЗС Британії про військову допомогу НАТО: Україна не член НАТО, але ми допомагатимемо їм у самозахисті",True,t.me/nrpublic,"The British Foreign Ministry on military assistance to NATO: Ukraine is not a member of NATO, but we will help them in self-defense"
32,https://t.me/nrpublic/16439,Мирному населенню України нічого не загрожує - Міністерство оборони Росії,True,t.me/nrpublic,The peaceful population of Ukraine is not in danger - Ministry of Defense of Russia
33,https://t.me/nrpublic/16441,МЗС КНР: Росія не потребує військової підтримки Китаю під час військової операції в Україні.,True,t.me/nrpublic,The Ministry of Foreign Affairs of the People's Republic of China: Russia does not need military support from China during the military operation in Ukraine.
34,https://t.me/nrpublic/16451,"Українські прикордонники стверджують, що російські танки, вторгаючись до населених пунктів Луганської області, виставили попереду автомобілі із символікою ОБСЄ.",True,t.me/nrpublic,"Ukrainian border guards claim that Russian tanks, invading the settlements of the Luhansk region, put cars with OSCE symbols in front of them."
35,https://t.me/nrpublic/16452,Поліція України видасть зброю ветеранам МВС,True,t.me/nrpublic,The police of Ukraine will issue weapons to veterans of the Ministry of Internal Affairs
36,https://t.me/nrpublic/16465,"Сухопутні війська України повідомляють, що в районі Краматорська збитий шостий російський літак",True,t.me/nrpublic,The ground forces of Ukraine report that the sixth Russian plane was shot down in the Kramatorsk region
37,https://t.me/nrpublic/16472,МЗС Білорусії рекомендувало громадянам країни залишити Україну,True,t.me/nrpublic,The Ministry of Foreign Affairs of Belarus recommended citizens of the country to leave Ukraine
38,https://t.me/nrpublic/16474,Меладзе вийшов в ефір і закликав припинити війну Росії та України,True,t.me/nrpublic,Meladze went on the air and called for an end to the war between Russia and Ukraine
39,https://t.me/nrpublic/16477,Українська армія підбила ще чотири російські танки під Харковом,True,t.me/nrpublic,The Ukrainian army knocked out four more Russian tanks near Kharkiv
40,https://t.me/nrpublic/16485,"Громадянська авіація не літає над Україною та півднем Росії, повідомляє Росавіація.",True,t.me/nrpublic,"Civil aviation does not fly over Ukraine and southern Russia, reports Rosaviatsia."
41,https://t.me/nrpublic/16486,"Максим Галкін закликав зупинити війну ""З раннього ранку на зв'язку з рідними та друзями з України! Не передати словами, що я відчуваю! Як це все можливо! Не може бути виправдань війні! Ні війні!""",True,t.me/nrpublic,"Maksym Galkin called for an end to the war ""Since early in the morning, I have been in touch with my relatives and friends from Ukraine! Words cannot express what I feel! How is this all possible! There can be no excuses for war! No war!"""
42,https://t.me/nrpublic/16495,"За даними Держприкордонслужби України, російська військова техніка порушила український кордон у Чернігівській, Сумській, Луганській, Харківській областях",True,t.me/nrpublic,"According to the State Border Service of Ukraine, Russian military equipment violated the Ukrainian border in Chernihiv, Sumy, Luhansk, and Kharkiv regions"
43,https://t.me/nrpublic/16496,"Президент Литви Гітанас Науседа заявив, що виступить із пропозицією надати Україні статус кандидата на вступ до ЄС, передає Bloomberg.",True,t.me/nrpublic,"The President of Lithuania, Gitanas Nauseda, said that he would make a proposal to grant Ukraine the status of a candidate for EU membership, reports Bloomberg."
44,https://t.me/nrpublic/16498,"Жителі Ростова-на-Дону повідомляють про різкий стрибок вартості іноземної валюти на тлі війни, що почалася в Україні У банку ""Фінам"" долар уже продають по 150 рублів, а євро по 200 рублів.",True,t.me/nrpublic,"Residents of Rostov-on-Don report a sharp jump in the value of foreign currency against the background of the war that began in Ukraine. In the Finam bank, the dollar is already sold at 150 rubles, and the euro at 200 rubles."
45,https://t.me/nrpublic/16507,"Зеленський: Військові сили України ведуть важкі бої, противник зазнає втрат і їх буде ще більше.",True,t.me/nrpublic,"Zelenskyi: The military forces of Ukraine are fighting hard battles, the enemy is suffering losses and there will be even more of them."
46,https://t.me/nrpublic/16511,"Зеленський: Громадяни Росії самі вибиратимуть яким шляхом вони, кожен сам за себе. Час вийти та заявити протести проти цієї війни. Проти війни з Україною",True,t.me/nrpublic,"Zelensky: The citizens of Russia will choose their own path, each for himself. Time to come out and protest this war. Against the war with Ukraine"
47,https://t.me/nrpublic/16513,"Зеленський: Ми знімемо санкції з усіх громадян України рішенням РНБО, які готові зі зброєю в руках захищати нашу державу у складі тероборони",True,t.me/nrpublic,"Zelenskyy: We will remove sanctions from all citizens of Ukraine by decision of the National Security Council, who are ready to defend our state with weapons in their hands as part of the national defense"
48,https://t.me/nrpublic/16519,Україна на кордоні з Білоруссю закрила всі прикордонні переходи,True,t.me/nrpublic,Ukraine closed all border crossings on the border with Belarus
49,https://t.me/nrpublic/16522,"Володін: демілітаризація України — єдиний шлях для запобігання війні в Європі, що залишився.",True,t.me/nrpublic,Volodin: Demilitarization of Ukraine is the only remaining way to prevent war in Europe.
50,https://t.me/nrpublic/16523,Володін: депутати Держдуми підтримують війну в Україні,True,t.me/nrpublic,Volodin: State Duma deputies support the war in Ukraine
51,https://t.me/nrpublic/16525,"Збройні сили України повідомляють, що Маріуполь та Щастя повернули під повний контроль",True,t.me/nrpublic,The Armed Forces of Ukraine report that they have returned Mariupol and Shchastya under full control
52,https://t.me/nrpublic/16534,"Спікер Держдуми В'ячеслав Володін звернувся до громадян України із закликом не брати участь у мобілізації та попросити своїх близьких, які служать у збройних силах України, скласти зброю.",True,t.me/nrpublic,State Duma Speaker Vyacheslav Volodin appealed to the citizens of Ukraine not to participate in the mobilization and to ask their loved ones serving in the armed forces of Ukraine to lay down their arms.
53,https://t.me/nrpublic/16545,"НАТО заявила, що розгортає додаткові оборонні сили на східному напрямку через конфлікт в Україні",True,t.me/nrpublic,NATO has announced that it is deploying additional defense forces in the eastern direction due to the conflict in Ukraine
54,https://t.me/nrpublic/16551,"В офісі президента України заявили, що запасу продуктів у мережевих магазинах вистачить на 15-20 днів",True,t.me/nrpublic,The office of the President of Ukraine announced that the stock of products in chain stores would be enough for 15-20 days
55,https://t.me/nrpublic/16554,"В Україні закрито більшість морських портів, повідомив міністр.",True,t.me/nrpublic,"Most of the seaports in Ukraine are closed, the minister said."
56,https://t.me/nrpublic/16556,"Німеччина закликає Росію негайно вивести війська з України, заявив Шольц.",True,t.me/nrpublic,"Germany calls on Russia to immediately withdraw its troops from Ukraine, Scholz said."
57,https://t.me/nrpublic/16559,НАТО: Росія заплатить дуже високу економічну та політичну ціну за агресію проти України,True,t.me/nrpublic,NATO: Russia will pay a very high economic and political price for aggression against Ukraine
58,https://t.me/nrpublic/16566,"У центр Москви стягнуто велику кількість співробітників 2СПП та ОМОНу, щоб уникнути мітингів через війну з Україною.",True,t.me/nrpublic,A large number of employees of the 2SPP and riot police were pulled into the center of Moscow to avoid rallies due to the war with Ukraine.
59,https://t.me/nrpublic/16573,Лідери G7 зберуть саміт по Україні найближчим часом,True,t.me/nrpublic,G7 leaders will hold a summit on Ukraine in the near future
60,https://t.me/nrpublic/16581,МВС України повідомило про захоплення російського диверсанта під Гостомелем,True,t.me/nrpublic,The Ministry of Internal Affairs of Ukraine reported the capture of a Russian saboteur near Gostomel
61,https://t.me/nrpublic/16584,"Генсек НАТО підтвердив, що скликав онлайн-саміт щодо України на - увага - 25 лютого",True,t.me/nrpublic,The NATO Secretary General confirmed that he has convened an online summit regarding Ukraine on February 25
62,https://t.me/nrpublic/16592,"Росія зачинила двері для політичного вирішення ситуації навколо України, вважає генсек НАТО Столтенберг.",True,t.me/nrpublic,NATO Secretary General Stoltenberg believes that Russia has closed the door to a political solution to the situation around Ukraine.
63,https://t.me/nrpublic/16596,Коментарі у спільноті відключені до врегулювання ситуації між Росією та Україною,True,t.me/nrpublic,Comments in the community are disabled until the situation between Russia and Ukraine is resolved
64,https://t.me/nrpublic/16600,"НАТО продовжуватиме спроби контактувати з Росією для деконфліктації, заявив Столтенберг. Він також повідомив, що запросив Фінляндію та Швецію на завтрашній онлайн-саміт щодо України",True,t.me/nrpublic,"NATO will continue to try to contact Russia for deconfliction, Stoltenberg said. He also announced that he invited Finland and Sweden to tomorrow's online summit regarding Ukraine"
65,https://t.me/nrpublic/16601,"Країни НАТО змусять Росію заплатити велику ціну за операцію в Україні, про економічні санкції - генсек НАТО Столтенберг",True,t.me/nrpublic,"NATO countries will make Russia pay a heavy price for the operation in Ukraine, about economic sanctions - NATO Secretary General Stoltenberg"
66,https://t.me/nrpublic/16605,"В Україні не залишилося американських дипломатів, планів щодо повернення їх до країни поки немає, передає CNN.",True,t.me/nrpublic,"There are no American diplomats left in Ukraine, and there are no plans to return them to the country yet, reports CNN."
67,https://t.me/nrpublic/16607,"Випадки стрілянини зафіксовані на територіях Брянської області, що межують з Україною, в результаті ніхто не постраждав, повідомив губернатор регіону Олександр Богомаз.",True,t.me/nrpublic,"Cases of shooting were recorded in the territories of the Bryansk region bordering Ukraine, as a result, no one was injured, the governor of the region, Oleksandr Bogomaz, said."
68,https://t.me/nrpublic/16611,МЗС України розпочало евакуацію українських дипломатів з Москви,True,t.me/nrpublic,The Ministry of Foreign Affairs of Ukraine has begun the evacuation of Ukrainian diplomats from Moscow
69,https://t.me/nrpublic/16614,Офіс Зеленського: ситуація в Україні контрольована,True,t.me/nrpublic,Zelenskyi's office: the situation in Ukraine is under control
70,https://t.me/nrpublic/16625,"УЄФА перенесе фінал Ліги чемпіонів із Санкт-Петербурга після російського нападу на Україну, повідомило джерело AP",True,t.me/nrpublic,"UEFA to move Champions League final from St. Petersburg after Russian attack on Ukraine, source told AP"
71,https://t.me/nrpublic/16627,"Макрон звернувся до нації, заявив, що дії Росії в Україні порушують Статут ООН і пригрозив запровадити проти Росії масштабні санкції, які торкнуться багатьох секторів.",True,t.me/nrpublic,"Addressing the nation, Macron declared that Russia's actions in Ukraine violate the UN Charter and threatened to introduce large-scale sanctions against Russia that would affect many sectors."
72,https://t.me/nrpublic/16650,Байден скликав раду нацбезпеки для обговорення України,True,t.me/nrpublic,Biden convened the National Security Council to discuss Ukraine
73,https://t.me/nrpublic/16654,Німеччина не постачатиме зброю в Україну,True,t.me/nrpublic,Germany will not supply weapons to Ukraine
74,https://t.me/nrpublic/16656,"Таксі Uber припинив роботу в Україні, повідомляють ЗМІ.",True,t.me/nrpublic,"Uber taxi has stopped working in Ukraine, media reports."
75,https://t.me/nrpublic/16662,"Матвієнко: ті росіяни, що виступають проти військової операції в Україні, думають про свої нагальні проблеми та труднощі",True,t.me/nrpublic,Matvienko: those Russians who oppose the military operation in Ukraine are thinking about their urgent problems and difficulties
