,Link,Text,Label,sources,translated
1023,https://t.me/nrpublic/27840,Президент США Джо Байден на сьогоднішній зустрічі попросив прем'єр-міністра Ізраїлю Яїра Лапіда розширити військову допомогу Україні,True,t.me/nrpublic,US President Joe Biden at today's meeting asked Israeli Prime Minister Yair Lapid to expand military aid to Ukraine
1024,https://t.me/nrpublic/27842,ЄС продовжить блокувати активи Банку Росії Розблокування відбудеться лише за згодою відновлювати Україну.,True,t.me/nrpublic,The EU will continue to block the assets of the Bank of Russia. The unblocking will take place only upon agreement to restore Ukraine.
1025,https://t.me/nrpublic/27901,ЄС може скоротити допомогу Україні на фоні відмови Європи від російського газу - Bloomberg,True,t.me/nrpublic,The EU may cut aid to Ukraine against the background of Europe's rejection of Russian gas - Bloomberg
1026,https://t.me/nrpublic/27918,Курське село Дронівка потрапило під мінометний обстріл з боку України — влада регіону,True,t.me/nrpublic,The Kursk village of Dronivka came under mortar fire from the side of Ukraine — the regional authorities
1027,https://t.me/nrpublic/28082,"Президент України у вечірньому зверненні до народу заявив, що в СБУ почалося кадрове чищення Збираються звільняти 28 високопосадовців різного рівня. Усіх за незадовільну роботу.",True,t.me/nrpublic,"In his evening address to the people, the President of Ukraine stated that the personnel purge has begun in the SBU. They are going to fire 28 high-ranking officials of various levels. All for unsatisfactory work."
1028,https://t.me/nrpublic/28112,"Брянський губернатор Богомаз повідомив про ранковий артобстріл села Нові Юрковичі з території України За його даними, при артобстрілі пошкоджено ділянку автодороги, потерпілих немає.",True,t.me/nrpublic,Bryansk Governor Bogomaz reported on the morning shelling of the village of Novi Yurkovichi from the territory of Ukraine.
1029,https://t.me/nrpublic/28125,"Слуцький: якщо переговори з Україною відновляться, умови з боку Росії будуть якісно жорсткішими",True,t.me/nrpublic,"Slutsky: if the negotiations with Ukraine resume, the conditions on the part of Russia will be qualitatively tougher"
1030,https://t.me/nrpublic/28177,"США цього тижня оголосять новий пакет військової допомоги Україні, він включатиме HIMARS — Білий дім",True,t.me/nrpublic,"The US this week will announce a new package of military aid to Ukraine, it will include HIMARS - the White House"
1031,https://t.me/nrpublic/28183,"Сирія розриває дипломатичні відносини з Україною Це стане відповіддю на аналогічний крок української влади, повідомляє сирійська агенція SANA з посиланням на джерело в МЗС.",True,t.me/nrpublic,"Syria breaks diplomatic relations with Ukraine This will be a response to a similar move by the Ukrainian authorities, the Syrian news agency SANA reports with reference to a source in the Ministry of Foreign Affairs."
1032,https://t.me/nrpublic/28184,"Курський губернатор повідомив, що з боку України йде артобстріл прикордонних територій, під вогнем пункт пропуску Крупець",True,t.me/nrpublic,"The governor of Kursk reported that there is artillery shelling of the border areas from the side of Ukraine, the Krupets checkpoint is under fire"
1033,https://t.me/nrpublic/28208,США поставлять Україні ще 4 РСЗВ HIMARS - шеф Пентагону,True,t.me/nrpublic,The US will supply Ukraine with 4 more HIMARS surface-to-air missiles - the head of the Pentagon
1034,https://t.me/nrpublic/28239,"США разом із союзниками виділяють Україні понад 20 РСЗВ HIMARS, з них 12 уже передано — Пентагон.",True,t.me/nrpublic,"The United States, together with its allies, allocates more than 20 HIMARS surface-to-air missiles to Ukraine, 12 of which have already been handed over to the Pentagon."
1035,https://t.me/nrpublic/28243,США передають Україні РСЗВ HIMARS з дальністю дії 80 кілометрів – Пентагон,True,t.me/nrpublic,The United States hands Ukraine HIMARS anti-aircraft missiles with a range of 80 kilometers - the Pentagon
1036,https://t.me/nrpublic/28252,ЄС надав ще 500 мільйонів євро на закупівлю зброї Україні — Борель,True,t.me/nrpublic,The EU provided another 500 million euros for the purchase of weapons to Ukraine — Borel
1037,https://t.me/nrpublic/28268,"Нацбанк України провів девальвацію гривні, знизивши офіційний курс по відношенню до долара одразу на 25%. Тепер 1 долар коштує 36,5686 гривень.",True,t.me/nrpublic,"The National Bank of Ukraine carried out a devaluation of the hryvnia, lowering the official exchange rate against the dollar by 25%. Now 1 dollar is worth 36.5686 hryvnias."
1038,https://t.me/nrpublic/28290,"Прес-секретар Зеленського спростував інформацію ЗМІ про те, що президент України нібито перебуває у реанімації у тяжкому стані",True,t.me/nrpublic,Zelenskyi's press secretary denied media reports that the president of Ukraine is allegedly in critical condition in intensive care
1039,https://t.me/nrpublic/28356,"Україна підписала угоду з Туреччиною та ООН щодо експорту зерна, повідомляє видання ""Країна"".",True,t.me/nrpublic,"Ukraine has signed an agreement with Turkey and the UN on the export of grain, reports ""Kraina""."
1040,https://t.me/nrpublic/28366,"Ердоган, який виступає після генсека ООН, заявив, що Туреччина провела дуже складний і довгий шлях із Росією та Україною для вирішення продовольчої кризи.",True,t.me/nrpublic,"Erdogan, speaking after the UN Secretary General, said that Turkey had a very difficult and long way with Russia and Ukraine to solve the food crisis."
1041,https://t.me/nrpublic/28374,"Прем'єр-міністр України заявив, що країна зібрала 6,5 мільйонів тонн нового врожаю",True,t.me/nrpublic,The Prime Minister of Ukraine stated that the country collected 6.5 million tons of new harvest
1042,https://t.me/nrpublic/28377,"Українські ЗМІ публікують текст угоди про експорт зерна, яку сьогодні підписала Україна у Стамбулі",True,t.me/nrpublic,Ukrainian mass media publish the text of the grain export agreement signed by Ukraine in Istanbul today
1043,https://t.me/nrpublic/28383,"Білий дім повідомив, що США виділяють Україні новий пакет військової допомоги на суму до 175 мільйонів доларів Також США передадуть українській армії 500 боєприпасів, що барражують, Phoenix Ghost.",True,t.me/nrpublic,The White House announced that the United States is providing Ukraine with a new military aid package worth up to $175 million. The United States will also provide the Ukrainian army with 500 Phoenix Ghost barrage munitions.
1044,https://t.me/nrpublic/28386,США нададуть Україні 580 ударних безпілотників – Білий дім,True,t.me/nrpublic,The US will provide Ukraine with 580 attack drones - the White House
1045,https://t.me/nrpublic/28389,Ми обговорюємо варіанти відправки винищувачів до України — Пентагон.,True,t.me/nrpublic,We are discussing options for sending fighter jets to Ukraine — the Pentagon.
1046,https://t.me/nrpublic/28391,"В Україні працюють над законом про кримінальну відповідальність за здобуття паспорта Росії, повідомив віце-прем'єр.",True,t.me/nrpublic,"Ukraine is working on a law on criminal liability for obtaining a Russian passport, the vice-prime minister said."
1047,https://t.me/nrpublic/28392,"Україна має зерно на суму близько 10 млрд доларів, заявив Зеленський",True,t.me/nrpublic,"Ukraine has grain worth about $10 billion, Zelenskyi said"
1048,https://t.me/nrpublic/28393,"США не мають наміру надавати Україні ракети ATACMS, повідомив помічник Байдена з нацбезпеки.",True,t.me/nrpublic,"The US has no intention of providing ATACMS missiles to Ukraine, Biden's national security aide said."
1049,https://t.me/nrpublic/28394,"США не передавали Україні літаки, а лише допомагають із запчастинами для наявної авіації — Пентагон",True,t.me/nrpublic,"The USA did not hand over planes to Ukraine, but only helps with spare parts for the existing aircraft - the Pentagon"
1050,https://t.me/nrpublic/28428,"Міністр національної оборони Туреччини Хулусі Акар повідомив про початок робіт зі створення у Стамбулі координаційного центру, який візьметься за контролем за вивезенням морем зерна з України.",True,t.me/nrpublic,"The Minister of National Defense of Turkey, Hulusi Akar, announced the start of work on the creation of a coordination center in Istanbul, which will oversee the export of grain from Ukraine by sea."
1051,https://t.me/nrpublic/28477,"Поляки завершили збір на Bayraktar для України Вдалося зібрати понад 22 млн. злотих (4,6 млн. євро). В акції взяли участь понад 200 тис. осіб.",True,t.me/nrpublic,"The Poles completed the collection for Bayraktar for Ukraine They managed to collect more than 22 million zlotys (4.6 million euros). More than 200,000 people took part in the action."
1052,https://t.me/nrpublic/28548,Зеленський звільнив командувача Сил спеціальних операцій Збройних сил України Григорія Галагана Він обіймав цю посаду з серпня 2020 року. Причина такого рішення не називається.,True,t.me/nrpublic,Zelensky dismissed the commander of the Special Operations Forces of the Armed Forces of Ukraine Hryhoriy Galagan. He held this position since August 2020. The reason for such a decision is not given.
1053,https://t.me/nrpublic/28609,"Продовольча криза триватиме довше, ніж воєнний конфлікт в Україні, її наслідки не зникнуть через 12-18 місяців, заявив президент Франції Еммануель Макрон.",True,t.me/nrpublic,"The food crisis will last longer than the military conflict in Ukraine, its consequences will not disappear after 12-18 months, French President Emmanuel Macron said."
1054,https://t.me/nrpublic/28615,Ось так виглядало урочисте вручення Зеленському від Джонсона премії імені Уїнстона Черчілля Український лідер приймав її з відеозв'язку,True,t.me/nrpublic,This is how Zelensky was presented with the Winston Churchill Award by Johnson. The Ukrainian leader received it via video link
1055,https://t.me/nrpublic/28621,"Президент України Зеленський заявив, що Росія навмисно використовує вищі ціни на газ, щоб тероризувати Європу, і заявив, що необхідні додаткові санкції.",True,t.me/nrpublic,Ukrainian President Zelenskyy said Russia was deliberately using higher gas prices to terrorize Europe and said additional sanctions were needed.
1056,https://t.me/nrpublic/28702,Президент України підписав указ про призначення Андрія Костіна генеральним прокурором країни,True,t.me/nrpublic,The President of Ukraine signed a decree on the appointment of Andrii Kostin as the country's Prosecutor General
1057,https://t.me/nrpublic/28719,"Сенат у США ухвалив резолюцію, яка закликає держдеп визнати Росію державою-спонсором тероризму через події в Чечні, Грузії, Сирії та Україні.",True,t.me/nrpublic,"The US Senate passed a resolution calling on the State Department to recognize Russia as a state sponsor of terrorism due to events in Chechnya, Georgia, Syria and Ukraine."
1058,https://t.me/nrpublic/28783,Губернатор Брянської області Олександр Богомаз повідомив про обстріл з боку України населеного пункту Сачковичі у Климівському районі,True,t.me/nrpublic,"The governor of Bryansk region, Oleksandr Bogomaz, reported on shelling from the Ukrainian side of the village of Sachkovichi in the Klimiv district"
1059,https://t.me/nrpublic/28800,"Збройні сили України заперечують завдання ракетного удару, внаслідок якого, за словами Росії, загинули 40 українських військовополонених — Reuters",True,t.me/nrpublic,Ukraine's armed forces deny responsibility for missile strike that Russia says killed 40 Ukrainian prisoners of war — Reuters
1060,https://t.me/nrpublic/28804,"Президент України Зеленський відвідав порт Чорноморськ, щоб ознайомитись з підготовкою до відвантаження зерна – офіс президента України",True,t.me/nrpublic,The President of Ukraine Zelenskyy visited the port of Chornomorsk to familiarize himself with the preparations for the shipment of grain - Office of the President of Ukraine
1061,https://t.me/nrpublic/28823,"У Молдові від тропічної малярії помер біженець з України, який прибув до країни 29 червня, йдеться у повідомленні Національного агентства громадського здоров'я.",True,t.me/nrpublic,"A refugee from Ukraine, who arrived in the country on June 29, died of tropical malaria in Moldova, according to the National Public Health Agency."
1062,https://t.me/nrpublic/29014,Зеленський та Макрон провели телефонні переговори Понад годину президенти обговорювали поточну ситуацію в зоні бойових дій в Україні та відновлення експорту українського зерна.,True,t.me/nrpublic,"Zelensky and Macron held telephone talks. For more than an hour, the presidents discussed the current situation in the war zone in Ukraine and the resumption of Ukrainian grain exports."
1063,https://t.me/nrpublic/29022,Україна обмежить відвантаження зерна до трьох суден на день приблизно на два тижні — Bloomberg із посиланням на міністра інфраструктури,True,t.me/nrpublic,Ukraine will limit the shipment of grain to three ships a day for about two weeks — Bloomberg with reference to the Minister of Infrastructure
1064,https://t.me/nrpublic/29025,США у понеділок схвалять новий пакет допомоги Україні на 550 мільйонів доларів у сфері оборони – Білий дім,True,t.me/nrpublic,The US will approve a new $550 million defense aid package for Ukraine on Monday - the White House
1065,https://t.me/nrpublic/29178,Найближчими тижнями США нададуть Україні до 75 тисяч 155-мм артилерійських снарядів - Білий Дім,True,t.me/nrpublic,"In the coming weeks, the United States will provide Ukraine with up to 75,000 155-mm artillery shells - White House"
1066,https://t.me/nrpublic/29252,"Путін підписав закон про надання статусу ветеранів бойових дій прикордонникам, які відображали збройне вторгнення на територію Росії під час спеціальної військової операції в Україні.",True,t.me/nrpublic,Putin signed a law on granting the status of combat veterans to border guards who repelled the armed invasion of Russian territory during a special military operation in Ukraine.
1067,https://t.me/nrpublic/29274,"Після України Росія піде в атаку на Молдову, Казахстан та Грузію, заявив екс-президент України Леонід Кучма в інтерв'ю ВВС.",True,t.me/nrpublic,"After Ukraine, Russia will attack Moldova, Kazakhstan and Georgia, ex-president of Ukraine Leonid Kuchma said in an interview with the BBC."
1068,https://t.me/nrpublic/29313,"Зеленський звинуватив Європу у затриманні допомоги на 8 млрд євро Український президент вважає, що певні країни ЄС спеціально не переказують Києву гроші.",True,t.me/nrpublic,Zelensky accused Europe of withholding 8 billion euros in aid. The Ukrainian president believes that certain EU countries specifically do not transfer money to Kyiv.
1069,https://t.me/nrpublic/29329,"Україна отримала грант від Албанії в 1 млн євро, повідомили в Міністерстві фінансів України. Гроші вже надійшли на рахунки Державної казначейської служби.",True,t.me/nrpublic,"Ukraine received a grant from Albania in the amount of 1 million euros, the Ministry of Finance of Ukraine reported. The money has already arrived in the accounts of the State Treasury Service."
1070,https://t.me/nrpublic/29365,"Байден анонсував пакет озброєнь на суму 1 мільярд доларів для України - це найбільша сума, виділена на сьогоднішній день",True,t.me/nrpublic,Biden announced an arms package worth $1 billion for Ukraine - this is the largest amount allocated to date
1071,https://t.me/nrpublic/29430,"У Стамбул ""зерновим коридором"" прибуло друге судно з України Корабель Navistar перевозить 33 тис тонн кукурудзи з Одеси. Після інспекції судна у порту Стамбула вантаж вирушить до порту призначення.",True,t.me/nrpublic,"A second ship from Ukraine arrived in Istanbul via the ""grain corridor"". The Navistar ship is transporting 33,000 tons of corn from Odesa. After the inspection of the ship in the port of Istanbul, the cargo will go to the port of destination."
1072,https://t.me/nrpublic/29476,"Якщо референдуми щодо приєднання до Росії будуть проведені, Росія закриє можливість для переговорів з Україною та миром — Зеленський",True,t.me/nrpublic,"If referendums on joining Russia are held, Russia will close the possibility of negotiations with Ukraine and peace - Zelensky"
1073,https://t.me/nrpublic/29486,"Число біженців з території України та Донбасу, які прибули до Росії з лютого, перевищило 3,2 млн осіб - джерело ТАРС",True,t.me/nrpublic,The number of refugees from Ukraine and Donbas who arrived in Russia since February has exceeded 3.2 million - TARS source
1074,https://t.me/nrpublic/29487,Понад 25 000 українців вимагали заборонити на 50 років росіянам відвідувати Україну Петиція до президента Зеленського набрала необхідну кількість голосів і тепер він має її розглянути.,True,t.me/nrpublic,"More than 25,000 Ukrainians demanded that Russians be banned from visiting Ukraine for 50 years. The petition to President Zelensky has received the necessary number of votes and now he must consider it."
1075,https://t.me/nrpublic/29493,Байратари почнуть збирати в Україні Турецька компанія Baykar збудує в Україні завод з виробництва ударних безпілотників Bayraktar. Про це повідомив посол України у Туреччині Василь Боднар,True,t.me/nrpublic,"Bayraktars will begin to be assembled in Ukraine The Turkish company Baykar will build a factory for the production of Bayraktar strike drones in Ukraine. This was reported by the Ambassador of Ukraine to Turkey, Vasyl Bodnar"
1076,https://t.me/nrpublic/29494,Чехія другий день поспіль не видає візи біженцям із України — МВС Чехії.,True,t.me/nrpublic,The Czech Republic does not issue visas to refugees from Ukraine for the second day in a row — the Ministry of Internal Affairs of the Czech Republic.
1077,https://t.me/nrpublic/29506,"США сподіваються, що ситуація в Україні буде згодом врегульована дипломатично, але поки що треба відстоювати її суверенітет — Блінкен",True,t.me/nrpublic,"The USA hopes that the situation in Ukraine will eventually be settled diplomatically, but for now it is necessary to defend its sovereignty - Blinken"
1078,https://t.me/nrpublic/29524,Пентагон оголосив про виділення Україні додаткової допомоги в 1 млрд доларів Новий пакет включає боєприпаси для HIMARS і 75 000 снарядів калібром 155-мм.,True,t.me/nrpublic,"The Pentagon announced the allocation of additional $1 billion in aid to Ukraine. The new package includes ammunition for HIMARS and 75,000 155-mm projectiles."
1079,https://t.me/nrpublic/29560,"Будівництво заводу з виробництва ""Байракторів"" в Україні займе кілька місяців, запуск можливий до кінця 2023 року - посол України в Туреччині",True,t.me/nrpublic,"The construction of the ""Bayractors"" plant in Ukraine will take several months, the launch is possible by the end of 2023 - the Ambassador of Ukraine to Turkey"
1080,https://t.me/nrpublic/29627,"НАТО із задоволенням воюватиме проти Росії на території України ""до останнього українця"" - Кирієнко",True,t.me/nrpublic,"NATO will gladly fight against Russia on the territory of Ukraine ""to the last Ukrainian"" - Kiriyenko"
1081,https://t.me/nrpublic/29632,"США надаватиме Україні військове обладнання для захисту ""скільки буде потрібно"", заявив міністр оборони США Ллойд Остін під час візиту до Латвії.",True,t.me/nrpublic,"The United States will provide Ukraine with military equipment for defense ""as much as it will be needed,"" US Defense Secretary Lloyd Austin said during a visit to Latvia."
1082,https://t.me/nrpublic/29640,Петиція про легалізацію порно та еротики в Україні зібрала необхідну кількість підписів Тепер її має розглянути президент Зеленський.,True,t.me/nrpublic,The petition on the legalization of porn and erotica in Ukraine has collected the necessary number of signatures. Now it must be considered by President Zelensky.
